,# codigo,nombre,direccion,colonia,telefono,telefono2,estado,minicipio,codigopostal,profeco_tiendas_id,folder_id
0,20161,CREMERIA DE ALBA SUCURSAL CENTRAL DE ABASTO,"AV. MAHATMA GANDHI S/N. BLOCK C LOCAL 1 Y 2, INT. CENTR",CENTRAL DE ABASTO,4499711648,,Aguascalientes,Aguascalientes,20280.0,Profeco_010101_tiendas,data20220905
1,20098,TORTILLERIA LA PROVIDENCIA,"VIENA 111, ESQ. DINAMARCA",SAN MARCOS,(449)9940841,,Aguascalientes,Aguascalientes,20070.0,Profeco_010101_tiendas,data20220905
2,20008,WALMART SUCURSAL PLAZA GALERIAS,"INDEPENDENCIA 2351, CENTRO COMERCIAL GALERIAS",LA CONCEPCION,(449)9107001,,Aguascalientes,Aguascalientes,20128.0,Profeco_010101_tiendas,data20220905
3,20057,FARMACIA BENAVIDES SUCURSAL PASEO DE LA ASUNCION,"CONVENCION 710, ESQ. FUNDICION",OLIVARES SANTANA,(449)9127970,,Aguascalientes,Aguascalientes,20010.0,Profeco_010101_tiendas,data20220905
4,20158,FRANCO SOLO CALIDAD SUCURSAL CENTRAL DE ABASTO,"AV. MAHATMA GANDHI S/N. BLOCK H LOCAL 20, INT. CENTRAL",CENTRAL DE ABASTO,4499711338,,Aguascalientes,Aguascalientes,20280.0,Profeco_010101_tiendas,data20220905
5,20091,FARMACIA GUADALAJARA SUCURSAL DEL VALLE,"AGUASCALIENTES PTE. 908, ESQ. DINAMARCA",DEL VALLE 2A. SECCION,(449)9160658,,Aguascalientes,Aguascalientes,20080.0,Profeco_010101_tiendas,data20220905
6,20114,MEGA SORIANA SUCURSAL AGUASCALIENTES,"AGUASCALIENTES NTE. 802, ESQ. BLVD. A ZACATECAS",TROJES DE ALONSO,(449)9968877,,Aguascalientes,Aguascalientes,20116.0,Profeco_010101_tiendas,data20220905
7,20143,FARMACIA 5 DE MAYO,"BUENAVISTA 103, ENTRE ARELLANO Y PALO ALTO",OJO CALIENTE 1,(449)9701431,,Aguascalientes,Aguascalientes,20196.0,Profeco_010101_tiendas,data20220905
8,20125,TORTILLERIA HERNANDEZ,"OJO CALIENTE 1621, ESQ. PALO ALTO",OJO CALIENTE III,(449)9745137,,Aguascalientes,Aguascalientes,20190.0,Profeco_010101_tiendas,data20220905
9,20100,TORTILLERIA SANTA FE DEL ENCINO,"COLON 645, ESQ. ALBA",EL ENCINO,(449)9167046,,Aguascalientes,Aguascalientes,20240.0,Profeco_010101_tiendas,data20220905
10,20130,MAXIFARMA SUCURSAL INEGI,"AGUASCALIENTES SUR 402 A, ENTRE TAMAULIPAS Y MICHOACAN",MEXICO,NO TIENE,,Aguascalientes,Aguascalientes,20270.0,Profeco_010101_tiendas,data20220905
11,20107,FARMACIAS SIMILARES,"AGUASCALIENTES 601, ESQ. DEL PARQUE",SAN MARCOS,(449)9169641,,Aguascalientes,Aguascalientes,20070.0,Profeco_010101_tiendas,data20220905
12,20162,PESCADERIA BUENA OLA SUCURSAL CENTRAL DE ABASTO,"AV. MAHATMA GANDHI S/N. BLOCK B LOCAL 36, INT. CENTRAL",CENTRAL DE ABASTO,4491403978,,Aguascalientes,Aguascalientes,20280.0,Profeco_010101_tiendas,data20220905
13,20010,MERCADO TERAN,"5 DE MAYO S/N, ESQ. ARTEGA",CENTRO,(449)9181732,,Aguascalientes,Aguascalientes,20000.0,Profeco_010101_tiendas,data20220905
14,20144,OXXO SUCURSAL COLON,"JUAN DE MONTORO 101, ESQ. CRISTOBAL COLON A UN COSTADO",CENTRO,,,Aguascalientes,Aguascalientes,20000.0,Profeco_010101_tiendas,data20220905
15,20157,ELEKTRA SUCURSAL PLAZA ESPACIO,"TECNOLOGICO 120, EX EJIDO OJOCALIENTE., CENTRO COMERCIA",EX EJIDO OJOCALIENTE,,,Aguascalientes,Aguascalientes,20000.0,Profeco_010101_tiendas,data20220905
16,20112,TORTILLERIA CRISTO REDENTOR,"LONDRES 518, ENTRE PUEBLITO Y NAVARRETE",SAN MARCOS,(449)9150233,,Aguascalientes,Aguascalientes,20070.0,Profeco_010101_tiendas,data20220905
17,20113,TORTILLERIA DEL CARMEN,"SALTO DE LOS SALADO 519, ENTRE CALVILLITO Y CANADA HOND",OJO CALIENTE 1,(449)9702784,,Aguascalientes,Aguascalientes,20190.0,Profeco_010101_tiendas,data20220905
18,20124,TORTILLERIA SAN ANTONIO,"OJO CALIENTE 304-A, ESQ. EL SALITRE",OJO CALIENTE III,(449)9745137,,Aguascalientes,Aguascalientes,20190.0,Profeco_010101_tiendas,data20220905
19,20156,TORTILLERIA ALEXIA,"MAR CARIBE 507, ENTRE MAR JONICO Y PEDRO GARCIA ROJA",FRACC. LAS BRISAS,(449)2849981,,Aguascalientes,Aguascalientes,20010.0,Profeco_010101_tiendas,data20220905
20,20163,SEMILLAS Y CEREALES EL CIPRES SUCURSAL CENTRAL DE ABASTO,"AV. MAHATMA GANDHI S/N. BLOCK C LOCAL 20 Y21, INTERIOR",CENTRAL DE ABASTO,4495808959,,Aguascalientes,Aguascalientes,20280.0,Profeco_010101_tiendas,data20220905
21,20135,TORTILLERIA SAN PEDRO,"JOSE MARIA CHAVEZ 461, ESQ. IGNACIO T. CHAVEZ",OBRAJE,(449)9183163,,Aguascalientes,Aguascalientes,20230.0,Profeco_010101_tiendas,data20220905
22,20097,TORTILLERIA 5 DE MAYO,"EL GUARDA 128-A, ESQ. OJO CALIENTE",OJO CALIENTE 1,(449)9700624,,Aguascalientes,Aguascalientes,20190.0,Profeco_010101_tiendas,data20220905
23,20101,COPPEL SUCURSAL SAN MARCOS,"CONVENCION NTE. 2301, ESQ. FUNDICION",SAN CAYETANO,(449)9124766,,Aguascalientes,Aguascalientes,20010.0,Profeco_010101_tiendas,data20220905
24,20149,TORTILLERIA SAN MARCOS,"CAMINO A SAN IGNACIO 325, ENTRE AMBIENTE Y ECOLOGIA",DE SAN IGNACIO,,,Aguascalientes,Aguascalientes,20010.0,Profeco_010101_tiendas,data20220905
25,20095,MARISCOS ALTAMAR,"PARIS 703, ESQ. LONDRES",FRACCIONAMIENTO DEL VALLE 2A. SECCION,(449)4544046,,Aguascalientes,Aguascalientes,20089.0,Profeco_010101_tiendas,data20220905
26,20039,CHEDRAUI SUCURSAL AGUASCALIENTES,"BLVD. JOSE MA. CHAVEZ 1809, ENTRE VALENTE QUINTANA Y AN",PRADOS DE VILLASUNCIÓN,(449)9106461,,Aguascalientes,Aguascalientes,20280.0,Profeco_010101_tiendas,data20220905
27,20063,LIVERPOOL SUCURSAL AGUASCALIENTES,"ZACATECAS NTE. 851, ESQ. ALTARIA",TROJES DE ALONSO,(449)1393400,,Aguascalientes,Aguascalientes,20200.0,Profeco_010101_tiendas,data20220905
28,20102,ELEKTRA SUCURSAL VILLASUNCION,"MAHATMA GANDHI S/N, INTERIOR CENTRO COMERCIAL VILLASUNC",PILAR BLANCO,,,Aguascalientes,Aguascalientes,20289.0,Profeco_010101_tiendas,data20220905
29,20160,CENTRAL DE ABASTO,"AV. MAHATMA GANDHI S/N, SALIDA A MÉXICO",CENTRAL DE ABASTO,,,Aguascalientes,Aguascalientes,20280.0,Profeco_010101_tiendas,data20220905
30,20099,TORTILLERIA SAN GERARDO,"OJO CALIENTE 952, ENTRE SALTO DE LOS SALADO Y CHICALOTE",OJO CALIENTE 1,(449)9718108,,Aguascalientes,Aguascalientes,20190.0,Profeco_010101_tiendas,data20220905
31,20136,TORTILLERIA SANTA LUCIA,"JOSEFA ORTIZ DE DOMINGUEZ 601, ESQ. SANTANA",BARRIO EL ENCINO,(449)1458714,,Aguascalientes,Aguascalientes,20240.0,Profeco_010101_tiendas,data20220905
32,20058,SEARS SUCURSAL AGUASCALIENTES,"BLVD. A ZACATECAS S/N, ESQ. BLVD. COLOSIO",TROJES DE ALONSO,(449)9107022,,Aguascalientes,Aguascalientes,20116.0,Profeco_010101_tiendas,data20220905
33,20090,FARMACIAS DEL AHORRO SUCURSAL DEL VALLE,"AGUASCALIENTES PTE. 820, ESQ. PARIS",DEL VALLE 1A. SECCION,(449)2614159,,Aguascalientes,Aguascalientes,20080.0,Profeco_010101_tiendas,data20220905
34,20142,MERCADO GUILLERMO PRIETO,"CARLOS SAGREDO 615-B, ESQ. GUILLERMO PRIETO",ALTAVISTA,,,Aguascalientes,Aguascalientes,20040.0,Profeco_010101_tiendas,data20220905
35,20083,SORIANA HIPER SUCURSAL SAN MARCOS,"CONVENCION S/N, ENTRE CARLOS SAGREDO Y FUNDICION",SAN CAYETANO,(449)9142239,,Aguascalientes,Aguascalientes,20010.0,Profeco_010101_tiendas,data20220905
36,20002,BODEGA AURRERA,"CONVENCION 1914 PTE. 1101, ENTRE A. DE LOS ARELLANO Y G",GUADALUPE,(449)9164250,,Aguascalientes,Aguascalientes,20180.0,Profeco_010101_tiendas,data20220905
37,20150,COPPEL SUCURSAL ESPACIO AGUASCALIENTES,"TECNOLOGICO 120, INT. CENTRO COMERCIAL ESPACIO AGUASCAL",OJOCALIENTE,,,Aguascalientes,Aguascalientes,20000.0,Profeco_010101_tiendas,data20220905
38,20159,SUPER CARNICERIA SAN JUAN SUCURSAL CENTRAL DE ABASTO,"AV. MAHATMA GANDHI S/N. BLOCK B LOCAL DEL 5 AL 7, INT.",CENTRAL DE ABASTO,4491469491,,Aguascalientes,Aguascalientes,20280.0,Profeco_010101_tiendas,data20220905
39,21003,CALIMAX SUCURSAL RIO,BLVD. CUAUHTEMOC Y PASEO DE LOS HEROES 1250,ZONA RIO,(664)6343255,,Baja California,Tijuana,22340.0,Profeco_020201_tiendas,data20220905
40,21477,TORTILLERIA MADERO,"AV. FRANCISCO I MADERO 826, ENTRE CALLE SEGUNDA Y CALLE",ZONA CENTRO,,,Baja California,Tijuana,22000.0,Profeco_020201_tiendas,data20220905
41,21393,TORTILLERIA GRANO DE ORO SUCURSAL RIO,"GUADALUPE VICTORIA 9350, ESQ. FRANCISCO JAVIER MINA",ZONA RIO,(664)6847021,,Baja California,Tijuana,22320.0,Profeco_020201_tiendas,data20220905
42,21418,FARMACIA PEY PHARMA SUCURSAL 2,"GUADALUPE VICTORIA 51-A, ESQ. JAVIER MINA",ZONA RIO,(664)6388121,,Baja California,Tijuana,22320.0,Profeco_020201_tiendas,data20220905
43,21415,MERCADO MIGUEL HIDALGO,"BLVD. SANCHEZ TABOADA 9351, ENTRE CALZ. INDEPENDENCIA Y",ZONA RIO TIJUANA,(664)6840485,,Baja California,Tijuana,22010.0,Profeco_020201_tiendas,data20220905
44,21384,SEARS SUCURSAL PLAZA RIO,"PASEO DE LOS HEROES 95, INT. PLAZA RIO",ZONA RIO,(664)6840424,,Baja California,Tijuana,22320.0,Profeco_020201_tiendas,data20220905
45,21448,BODEGA DE LIBROS TIJUANA SUCURSAL CCT,"PLUTARCO ELIAS CALLES 11, ENTRE ALBERTO ROSALES Y RODOL",MARRON,(664)6847220,,Baja California,Tijuana,22000.0,Profeco_020201_tiendas,data20220905
46,21420,TORTILLERIA ISAURA,"CALLE 9 NO. 2100, ENTRE NEGRETE Y MADERO",ZONA CENTRO,(664)6855500,,Baja California,Tijuana,22000.0,Profeco_020201_tiendas,data20220905
47,21478,OXXO SUCURSAL TAMAYO,"RUFINO TAMAYO 1, ESQ. BLVD. CUAUHTEMOC",ZONA RIO,(664)9757300,,Baja California,Tijuana,22000.0,Profeco_020201_tiendas,data20220905
48,21045,LEY SUCURSAL OTAY (1051),BLVD. LAZARO CARDENAS Y CALZ. TECNOLOGICO S/N,HIPODROMO,(664)6470040,,Baja California,Tijuana,22390.0,Profeco_020201_tiendas,data20220905
49,21067,SALINAS Y ROCHA SUCURSAL 9085,"CONSTITUCION 957, ENTRE TERCERA Y CUARTA",ZONA CENTRO,(664)1379950,,Baja California,Tijuana,22000.0,Profeco_020201_tiendas,data20220905
50,21394,TORTILLERIA JUAREZ,"QUINTA EMILIANO ZAPATA 447-8, ESQ. OCAMPO",ZONA CENTRO,(664)6882219,,Baja California,Tijuana,22000.0,Profeco_020201_tiendas,data20220905
51,21473,TORTILLERIA EL DIAMANTE SUCURSAL UNICA,"ALLENDE 7737, ENTRE BRAVO Y RAYON",INDEPENDENCIA,(664)3314392,,Baja California,Tijuana,22255.0,Profeco_020201_tiendas,data20220905
52,21416,FARMACIA DEL SOL SUCURSAL 2,"INDEPENDENCIA 63, ENTRE BLVD. SANCHEZ TABOADA Y JAVIER",ZONA RIO,(664)6845763,,Baja California,Tijuana,22010.0,Profeco_020201_tiendas,data20220905
53,22131,COPPEL SUCURSAL 75,"CONSTITUCION 840, ENTRE CALLE 2A. Y CALLE 3A.",CENTRO,(664)6882740,,Baja California,Tijuana,22000.0,Profeco_020201_tiendas,data20220905
54,21110,WALMART SUCURSAL TIJUANA HIPODROMO,"AGUACALIENTE, ESQ. PASEO DE LAS AMERICAS 11999",HIPODROMO,(664)6816150,,Baja California,Tijuana,22024.0,Profeco_020201_tiendas,data20220905
55,21391,PESCADERIA EL PESCADOR,"SEXTA 8724, ESQ. OCAMPO",ZONA CENTRO,(664)6881847,,Baja California,Tijuana,22000.0,Profeco_020201_tiendas,data20220905
56,21417,FARMACIA DE LOS ANGELES,"IGNACIO COMONFORT 9330, ESQ. FRANCISCO JAVIER MINA",ZONA RIO,(664)6340669,,Baja California,Tijuana,22010.0,Profeco_020201_tiendas,data20220905
57,21474,TORTILLERIA HIDALGO SUCURSAL UNICA,"CALLE SEXTA 8390, ENTRE NEGRETE Y MADERO",ZONA CENTRO,(664)6854379,,Baja California,Tijuana,22000.0,Profeco_020201_tiendas,data20220905
58,21464,COPPEL SUCURSAL 179,"CONSTITUCION 1033-17, ENTRE CALLE QUINTA Y CONSTITUCION",ZONA CENTRO,(664)6883728,,Baja California,Tijuana,22000.0,Profeco_020201_tiendas,data20220905
59,21064,ELEKTRA SUCURSAL CONSTITUCION (2150),"AV. CONSTITUCION 634, ENTRE CALLE 2DA Y 3RA",ZONA CENTRO,(664)1379918,,Baja California,Tijuana,22000.0,Profeco_020201_tiendas,data20220905
60,21263,ELEKTRA SUCURSAL EKT MEGATIJUANA CENTRO,"TERCERA 1703, ESQ. FIDEL MARTINEZ",ZONA CENTRO,(664)1379929,,Baja California,Tijuana,22000.0,Profeco_020201_tiendas,data20220905
61,21465,SORIANA SUPER SUCURSAL LIBERTAD (377),"RAMPA RUIZ CORTINEZ S/N, ENTRE DEFENSORES DE B.C. Y FER",LIBERTAD,(664)6831609,,Baja California,Tijuana,22300.0,Profeco_020201_tiendas,data20220905
62,21145,LIBRERIA MEXICO,"PASEO DE LOS HEROES 94 LOC. B-20, INTERIOR PLAZA RIO",ZONA RIO,(664)6341654,,Baja California,Tijuana,22320.0,Profeco_020201_tiendas,data20220905
63,21475,TORTILLERIA LA BOCHITA SUCURSAL UNICA,"GUADALUPE VICTORIA INT 21, INT. MERCADO HIDALGO",ZONA RIO,(664)2150705,,Baja California,Tijuana,22010.0,Profeco_020201_tiendas,data20220905
64,21476,TORTILLERIA EL GRANO DE ORO SUCURSAL CUAUHTEMOC,"BLVD. CUAUHTEMOC SUR 2801, INT. PLAZA TROPICANA",DAVILA,(664)6818755,,Baja California,Tijuana,22044.0,Profeco_020201_tiendas,data20220905
65,23101,BODEGA AURRERA SUCURSAL UNIDAD CAMIMO REAL 3119,"CALZADA CAMINO REAL S/N, ESQ. CARR. TRANSPENISULAR LA P",CAMINO REAL,(612)1254180,,Baja California Sur,La Paz,23088.0,Profeco_030301_tiendas,data20220905
66,23047,MERCADO NICOLAS BRAVO,"NICOLAS BRAVO S/N, ESQ. GUILLERMO PRIETO",CENTRO,(612)1221604,,Baja California Sur,La Paz,23000.0,Profeco_030301_tiendas,data20220905
67,23066,TORTILLERIA SERDAN,"AQUILES SERDAN 5145, ESQ. TENOCHTITLAN",PUESTA DEL SOL,(612)1403216,,Baja California Sur,La Paz,23090.0,Profeco_030301_tiendas,data20220905
68,23056,TORTILLERIA HIGIENICA,"IGNACIO ALTAMIRANO S/N, ENTRE AÑIÑI Y RETORNO CHICORI",PERICUES,(612)1221912,,Baja California Sur,La Paz,23097.0,Profeco_030301_tiendas,data20220905
69,23091,COPPEL SUCURSAL OLACHEA,"AGUSTIN OLACHEA S/N, ESQ. PASEO LA PAZ",EL ZACATAL,(612)1665044,,Baja California Sur,La Paz,23088.0,Profeco_030301_tiendas,data20220905
70,23145,SEMILLAS LA PROVIDENCIA,"CALZADA AGUSTIN OLACHEA KM. 3.5, LOCAL 8, INT. CENTRAL",PUESTA DEL SOL,(612)1240552,,Baja California Sur,La Paz,23090.0,Profeco_030301_tiendas,data20220905
71,23000,CASA LEY SUCURSAL LA PAZ,"AGUSTIN OLACHEA S/N, ESQ. ANTONIO NAVARRO",PUESTA DEL SOL,(612)1255515,(612)1255125,Baja California Sur,La Paz,23070.0,Profeco_030301_tiendas,data20220905
72,23030,COPPEL SUCURSAL LA PAZ,"BLVD. FORJADORES DE SUDCALIFORNIA 4390, ESQ. LUIS DONAL",EX BASE AEREA,(612)1654264,,Baja California Sur,La Paz,23050.0,Profeco_030301_tiendas,data20220905
73,23036,FARMACON SUCURSAL PASEO LA PAZ,BLVD. AGUSTIN OLACHEA 1515,SAN ANTONIO EL ZACATAL,(612)1240847,,Baja California Sur,La Paz,23090.0,Profeco_030301_tiendas,data20220905
74,23120,FARMACIAS ESPECIALIZADAS,"NICOLAS BRAVO 215, ESQ. REVOLUCION",CENTRO,(612)1289927,,Baja California Sur,La Paz,23000.0,Profeco_030301_tiendas,data20220905
75,23142,CARNICERIA SAN RAFAEL,"CALZADA AGUSTIN OLACHEA KM. 3.5, LOCAL 3, INT. CENTRAL",PUESTA DEL SOL,(612)1241814,,Baja California Sur,La Paz,23090.0,Profeco_030301_tiendas,data20220905
76,23034,SEARS SUCURSAL LA PAZ,"BLVD. FORJADORES DE SUDCALIFORNIA S/N, PLAZA LA PAZ",EX BASE AEREA,(612)1259373,,Baja California Sur,La Paz,23050.0,Profeco_030301_tiendas,data20220905
77,23070,TORTILLERIA LA PAZ,"REVOLUCION S/N, ESQ. SINALOA",PUEBLO NUEVO,(612)1223677,,Baja California Sur,La Paz,23060.0,Profeco_030301_tiendas,data20220905
78,23057,TORTILLERIA PROMASA,"AQUILES SERDAN S/N, ENTRE BRAVO Y OCAMPO",CENTRO,(612)3488040,,Baja California Sur,La Paz,23000.0,Profeco_030301_tiendas,data20220905
79,23150,CARNICERIA REY TORO,"CALZADA AGUSTIN OLACHEA MK 3.5, INTERIOR CENTRAL DE ABA",AGENCIA PUESTA DEL SOL,(612)1982969,,Baja California Sur,La Paz,23090.0,Profeco_030301_tiendas,data20220905
80,23002,SORIANA HIPER SUCURSAL LA PAZ BC,"FORJADORES DE SUD CALIFORNIA NO 4390, ESQ. LUIS DONALDO",CENTRO,(612)1214772,,Baja California Sur,La Paz,23000.0,Profeco_030301_tiendas,data20220905
81,23039,FARMACIA BENAVIDES SUCURSAL OLACHEA,"CALZ. GRAL. AGUSTIN OLACHEA S/N, ENTRE CORMORANES Y TIJ",RESIDENCIAL LAS GARZAS,(612)1461282,,Baja California Sur,La Paz,23079.0,Profeco_030301_tiendas,data20220905
82,23067,TORTILLERIA GUAYCURA,"MARQUEZ DE LEON S/N, ESQ. HEROES DE INDEPENDENCIA",CENTRO,(612)1285015,,Baja California Sur,La Paz,23000.0,Profeco_030301_tiendas,data20220905
83,23147,CREMERIA QUESSISIMO,"CALZADA AGUSTIN OLACHEA KM. 3.5, INT. CENTRAL DE ABASTO",PUESTA DEL SOL,,,Baja California Sur,La Paz,23090.0,Profeco_030301_tiendas,data20220905
84,23125,PESCADERIA GRIS MAR,"GOMEZ FARIAS S/N, ESQ. MAYAS",PUESTA DEL SOL,(612)1589442,,Baja California Sur,La Paz,23090.0,Profeco_030301_tiendas,data20220905
85,23020,CHEDRAUI SUCURSAL LA PAZ COLIMA,"MADERO S-N, ENTRE COLIMA Y ABASOLO",PUEBLO NUEVO,(612)1462270,,Baja California Sur,La Paz,23060.0,Profeco_030301_tiendas,data20220905
86,23064,TORTILLERIA ESPERANZA,"GOMEZ FARIAS 5030, ESQ. AZTECAS",PUESTA DEL SOL,(612)1461220,,Baja California Sur,La Paz,23090.0,Profeco_030301_tiendas,data20220905
87,23060,TORTILLERIA Y MINISUPER LAS GARZAS,"BLVD. FRANCISCO J MUJICA 194, ENTRE MISIONEROS COMBONIA",INDECO,(612)1220674,,Baja California Sur,La Paz,23070.0,Profeco_030301_tiendas,data20220905
88,23042,FARMACIAS SIMILARES,"DE LOS DEPORTISTAS 78-B, FRENTE A HOSPITAL SALVATIERRA",8 DE OCTUBRE 1A. SECCION,,,Baja California Sur,La Paz,23085.0,Profeco_030301_tiendas,data20220905
89,23032,ELEKTRA SUCURSAL LA PAZ,"BLVD. FORJADORES DE SUDCALIFORNIA S/N, ESQ. DURANGO",ADOLFO RUIZ CORTINEZ,(612)1509803,,Baja California Sur,La Paz,23040.0,Profeco_030301_tiendas,data20220905
90,23149,FARMACIA GUADALAJARA,"AQUILES SERDAN 2395, ESQ. MARQUEZ DE LEON",CENTRO,(612)1232591,,Baja California Sur,La Paz,23000.0,Profeco_030301_tiendas,data20220905
91,23122,OXXO SUCURSAL COLIMA,"COLIMA 295, ESQ. AQUILES SERDAN",JARDINES DE LA PAZ,,,Baja California Sur,La Paz,23090.0,Profeco_030301_tiendas,data20220905
92,23144,PLASTICOS Y SEMILLAS CABRERA,"CALZADA AGUSTIN OLACHEA KM. 3.5, LOCAL 6, INT. CENTRAL",PUESTA DEL SOL,(612)1240900,,Baja California Sur,La Paz,23090.0,Profeco_030301_tiendas,data20220905
93,23065,TORTILLERIA DOÑA ESTHELA,"TORONJA S/N, ENTRE PAPAYA Y MANDARINA",INDECO,(662)1220338,,Baja California Sur,La Paz,23070.0,Profeco_030301_tiendas,data20220905
94,23048,MERCADO FRANCISCO I. MADERO,"REVOLUCION S/N, ENTRE OCAMPO Y DEGOLLADO",CENTRO,(612)1220135,,Baja California Sur,La Paz,23000.0,Profeco_030301_tiendas,data20220905
95,23146,CREMERIA ZAPOPAN,"CALZADA AGUSTIN OLACHEA KM. 3.5, LOCAL 1, INT. CENTRAL",PUESTA DEL SOL,(612)1241088,,Baja California Sur,La Paz,23090.0,Profeco_030301_tiendas,data20220905
96,23055,TORTILLERIA SANTA CRUZ,"GUILLERMO PRIETO 4445, ENTRE COLOSIO Y PERLA",INAPALA,(612)1221697,,Baja California Sur,La Paz,23098.0,Profeco_030301_tiendas,data20220905
97,23033,LIVERPOOL SUCURSAL LA PAZ,"AGUSTIN OLACHEA LT. 7 Y 8 S/N, PLAZA THE SHOPPES AT LA",FIDEPAZ,(612)1751000,,Baja California Sur,La Paz,23090.0,Profeco_030301_tiendas,data20220905
98,23141,CENTRAL DE ABASTOS,"CALZADA AGUSTIN OLACHEA KM. 3.5, INT. CENTRAL DE ABASTO",PUESTA DEL SOL,,,Baja California Sur,La Paz,23090.0,Profeco_030301_tiendas,data20220905
99,23152,MINISUPER Y TORTILLERIA COLOSIO,"BOULEVARD COLOSIO SIN NUMERO, ENTRE IGNACIO RAMÍREZ E I",AGENCIA PUEBLO NUEVO,6122025209,,Baja California Sur,La Paz,23060.0,Profeco_030301_tiendas,data20220905
100,23123,FARMACIA EMERGENCIAS SUCURSAL SALVATIERRA,"DE LOS DEPORTISTAS S/N, ENTRE SIERRA DE LA VICTORIA Y B",8 DE OCTUBRE,(612)1212469,,Baja California Sur,La Paz,23080.0,Profeco_030301_tiendas,data20220905
101,23008,WALMART SUCURSAL COLA DE BALLENA,"AGUSTIN OLACHEA S/N, ENTRE CTRA. TRANSPENINSULAR Y LIBR",EL ZACATAL,(612)1242314,,Baja California Sur,La Paz,23088.0,Profeco_030301_tiendas,data20220905
102,24029,TORTILLERIA LA BENDICION SUCURSAL CAMPECHE,"VICTORIA 54, ESQ. COLOSIO",SAN JOSE,,,Campeche,Campeche,24040.0,Profeco_040401_tiendas,data20220905
103,24026,TORTILLERIA FLORES,"CALLE 2 S/N, ENTRE CALLE 11 Y CALLE 12",SAMULA,,,Campeche,Campeche,24090.0,Profeco_040401_tiendas,data20220905
104,24004,WALMART SUCURSAL CAMPECHE,"MARIA LAVALLE URBINA, ENTRE JOAQUIN CLAUSEL Y RICARDO C",AH KIN PEACH,(981)8117516,,Campeche,Campeche,24014.0,Profeco_040401_tiendas,data20220905
105,24089,CUIDADO CON EL PERRO,"CALLE 10. 297, ENTRE CALLE 53 Y 55 EN LA ESQUINA",CENTRO,(981)8117330,,Campeche,Campeche,24000.0,Profeco_040401_tiendas,data20220905
106,24034,TORTILLERIA LAS DELICIAS,"VERACRUZ 24, ENTRE DELICIAS Y LUIS DONALDO COLOSIO",SANTA ANA,,,Campeche,Campeche,24050.0,Profeco_040401_tiendas,data20220905
107,24036,TORTILLERIA PINZON,"RIVAPALACIOS. 51, ENTRE CALLE 16 Y CALLE 14",SAN FRANCISCO,,,Campeche,Campeche,24050.0,Profeco_040401_tiendas,data20220905
108,24102,MERCADO DE SAMULA,"CALLE 19 S/N, ESQ. CALLE 8",SAMULA,NO TIENE,,Campeche,Campeche,24090.0,Profeco_040401_tiendas,data20220905
109,24085,SORIANA EXPRESS SUCURSAL CAMPECHE,"AGUSTÍN MELGAR S/N, ESQ. LÓPEZ PORTILLO (INTERIOR PLAZA",BOSQUES DE CAMPECHE,(981)8112597,,Campeche,Campeche,24030.0,Profeco_040401_tiendas,data20220905
110,24101,MERCADO DE SAN FRANCISCO,"CALLE 10 NO. 72, ESQ. CALLE 39 A",BARRIO DE SAN FRANCISCO,NO TIENE,,Campeche,Campeche,24010.0,Profeco_040401_tiendas,data20220905
111,24041,COLCHONES Y MUEBLES DE CAMPECHE,"FRANCISCO I. MADERO 184, ENTRE CALLE 16 Y CALLE 14",SAN FRANCISCO,(981)8169195,,Campeche,Campeche,24010.0,Profeco_040401_tiendas,data20220905
112,24001,CHEDRAUI SUCURSAL CAMPECHE,"GOBERNADORES 418, ENTRE VENEZUELA Y ARGENTINA",SANTA ANA,(981)8165631,,Campeche,Campeche,24050.0,Profeco_040401_tiendas,data20220905
113,24023,TORTILLERIA BELEN,"QUERETARO 137, ESQ. NICARAGUA",SANTA ANA,,,Campeche,Campeche,24040.0,Profeco_040401_tiendas,data20220905
114,24039,LIVERPOOL SUCURSAL CAMPECHE,"PEDRO SAINZ DE BARANDA 139, ESQ. DARSENA",CENTRO,(981)8181300,,Campeche,Campeche,24400.0,Profeco_040401_tiendas,data20220905
115,24107,FARMACIAS GUADALAJARA SUCURSAL CASA DE JUSTICIA,"PATRICIO TRUEBA Y REGIL 312, ENTRE PRIVADA PATRICIO TRU",SAN RAFAEL,9818139878,,Campeche,Campeche,24090.0,Profeco_040401_tiendas,data20220905
116,24110,TORTILLERIA MELKEN,"CALLE 10 NÚMERO. 171-A, ENTRE CALLE 45 Y ROSALES",SAN FRANCISCO,,,Campeche,Campeche,24010.0,Profeco_040401_tiendas,data20220905
117,24025,TORTILLERIA LA LUPITA,"CALLE 7-A S/N, ENTRE CALLE 6 Y CALLE 4",SAMULA,,,Campeche,Campeche,24090.0,Profeco_040401_tiendas,data20220905
118,24035,TORTILLERIA MONTECRISTO,"MONTECRISTO 20, ESQ. CALLE 16",SANTA ANA,,,Campeche,Campeche,24040.0,Profeco_040401_tiendas,data20220905
119,24103,MERCADO EJIDAL,"QUERETARO S/N, ENTRE REPUBLICA DEL SALVADOR Y AVENIDA C",SANTA ANA,NO TEINE,,Campeche,Campeche,24050.0,Profeco_040401_tiendas,data20220905
120,24013,ULTRAHOGAR SUCURSAL CAMPECHE,"CALLE 10 NO. 300, ENTRE CALLE 53 Y CALLE 51",CENTRO,(981)8114404,,Campeche,Campeche,24000.0,Profeco_040401_tiendas,data20220905
121,24042,FARMACIA BAZAR,"AVENIDA CENTRAL 63, ENTRE TRUJANO Y PRIV. DEL SALVADOR",CENTRO,(981)8117441,,Campeche,Campeche,24000.0,Profeco_040401_tiendas,data20220905
122,24024,TORTILLERIA EL PEDREGAL,"LOPEZ PORTILLO 16 A, ENTRE EL DUQUE Y CALLE 2",LOMAS DE PEDREGAL,,,Campeche,Campeche,24035.0,Profeco_040401_tiendas,data20220905
123,24108,COPPEL SUCURSAL SELEM,"CALLE 12 <hash>157, ENTRE CALLE 57 Y 55",CENTRO,,,Campeche,Campeche,24000.0,Profeco_040401_tiendas,data20220905
124,24032,TORTILLERIA LA ROSITA,"CALLE 14 NO. 274 F, ENTRE ABASOLO Y VICTORIA",SAN ROMAN,,,Campeche,Campeche,24040.0,Profeco_040401_tiendas,data20220905
125,24028,TORTILLERIA LA AVENTURERA,"PEDRO MORENO 164, ENTRE ESPERANZA Y VICENTE GUERRERO",SAN RAFAEL,,,Campeche,Campeche,24090.0,Profeco_040401_tiendas,data20220905
126,24038,MERCADO PRINCIPAL PEDRO SAINZ DE BARANDA,"CIRCUITO BALUARTE S/N, ENTRE TABASCO Y COSTA RICA",CENTRO,,,Campeche,Campeche,24000.0,Profeco_040401_tiendas,data20220905
127,24021,TORTILLERIA ALEX,"CALLE 6 NO. 403, ENTRE LOPEZ PORTILLO Y ALLENDE",SAN RAFAEL,,,Campeche,Campeche,24090.0,Profeco_040401_tiendas,data20220905
128,24090,MILANO SUCURSAL CENTRO,"CALLE 10 NO. 238-B, ENTRE CALLE 53 Y CALLE 51.",CENTRO,,,Campeche,Campeche,24000.0,Profeco_040401_tiendas,data20220905
129,24104,MERCADO DE SAN ROMAN,"CALLE 14 S/N, ESQ. PROLONGACION ALLENDE",BARRIO DE SAN ROMAN,NO TIENE,,Campeche,Campeche,24040.0,Profeco_040401_tiendas,data20220905
130,24099,TORTILLERIA LUISITO SUCURSAL CAMPECHE,"CALLE 16 52-A, ENTRE VENEZUELA Y URUGUAY",SAN FRANCISCO,,,Campeche,Campeche,24010.0,Profeco_040401_tiendas,data20220905
131,24105,ELEKTRA SUCURSAL MEGA CAMPECHE,"CALLE 49 O CIRCUITO BALUARTES 56, ENTRE 51 Y CIRCUITO B",CENTRO,98111002,,Campeche,Campeche,24000.0,Profeco_040401_tiendas,data20220905
132,24033,TORTILLERIA LA SOMBRILLA SUCURSAL CAMPECHE,"CALLE 18 NO. 99, DEPARTAMENTO 14 BAZAR SELEM",SANTA ANA,,,Campeche,Campeche,24050.0,Profeco_040401_tiendas,data20220905
133,24016,FARMACIAS YZA SUCURSAL COLOSIO,"COLOSIO 321, ESQ. PROLONGACION ALLENDE",SAN RAFAEL,(981)1281166,,Campeche,Campeche,24001.0,Profeco_040401_tiendas,data20220905
134,24044,FARMACIAS SIMILARES SUCURSAL CAMPECHE 7,"AVENIDA CENTRAL 58, ENTRE MARIANO RODRIGUEZ Y JOSE ANTO",SAN JOSE,(981)8169166,,Campeche,Campeche,24040.0,Profeco_040401_tiendas,data20220905
135,24083,FARMACIA CANTO SUCURSAL ALAMEDA,"TABASCO S/N LOC. 11, ENTRE CHIHUAHUA Y CTO. BALUARTE (F",SANTA ANA,(981)8163170,,Campeche,Campeche,24050.0,Profeco_040401_tiendas,data20220905
136,24027,TORTILLERIA LA AVENIDA SUCURSAL CAMPECHE,"GOBERNADORES 365, ENTRE CUBA Y URUGUAY",SANTA ANA,(981)8113123,,Campeche,Campeche,24050.0,Profeco_040401_tiendas,data20220905
137,24037,OXXO SUCURSAL CATASTRO,"CALLE 51 NO. 1, ESQ. ADOLFO RUIZ CORTINEZ",CENTRO,,,Campeche,Campeche,24000.0,Profeco_040401_tiendas,data20220905
138,24109,FARMACIA BAZAR SUCURSAL LOPEZ MATEOS,"AV LOPEZ MATEOS 374, ENTRE LAZARETO Y MONTECRISTO",PRADO,,,Campeche,Campeche,24030.0,Profeco_040401_tiendas,data20220905
139,24022,TORTILLERIA ARROLLO,"CALLE 10 S/N, ESQ. CALLE 12, INT.MERCADO SAN FRANCISCO",SAN FRANCISCO,,,Campeche,Campeche,24010.0,Profeco_040401_tiendas,data20220905
140,24040,COPPEL SUCURSAL SAN RAFAEL,"PATRICIO TRUEBA 306, ENTRE VICENTE GUERRERO Y CALLE 6",SAN RAFAEL,(981)8125039,,Campeche,Campeche,24090.0,Profeco_040401_tiendas,data20220905
141,24000,BODEGA AURRERA SUCURSAL PATRICIO TRUEBA,"PATRICIO TRUEBA DE REGIL 189, ENTRE NIEBLA Y CASA DE JU",FRACCIORAMA 2000,,,Campeche,Campeche,24090.0,Profeco_040401_tiendas,data20220905
142,25347,CARNICERIA DIVISION DEL NORTE,"LUIS ECHEVERRIA ALVAREZ S/N, ESQ. FUNDADORES, LOCAL 55",SAN RAMÓN,(844)3158832,,Coahuila,Saltillo,25020.0,Profeco_050501_tiendas,data20220905
143,25354,OXXO SUCURSAL FORRAJES,"VALDES SANCHEZ 9740, ESQ. CON CALLE FORRAJES",PRADERAS,8183202020,,Coahuila,Saltillo,25295.0,Profeco_050501_tiendas,data20220905
144,25320,LIBRERÍA TRILLAS,"BLVD. VENUSTIANO CARRANZA 2230, ENTRE SAUCE Y ALAMO",JARDINES DE LA FLORIDA,(844)4152496,,Coahuila,Saltillo,25240.0,Profeco_050501_tiendas,data20220905
145,25178,TORTILLERIA OCEANIA,"POLINESIA 421, ESQ. NUEVA ZELANDA",OCEANIA,(844)2494893,,Coahuila,Saltillo,25290.0,Profeco_050501_tiendas,data20220905
