,# codigo,nombre,direccion,colonia,telefono,telefono2,estado,minicipio,codigopostal,profeco_tiendas_id,folder_id
582,51078,CARNICERIA LA MARRANITA SUCURSAL 2,"JOSE LOPEZ PORTILLO KM. 4.5, INT. 128 LOCAL 106, ENTRE",SAN MATEO OTZACATIPAN,(722)2102991,,Estado de México,,50200.0,Profeco_150901_tiendas,data20220712
583,11498,LIVERPOOL SUCURSAL PERINORTE,"CARR. MEX-QUER. KM. 30.5, HDA. DE SIERRRA VIEJA Y HDA.",HACIENDA EL PARQUE,58 64 95 00,,Estado de México,Cuautitlán Izcalli,54769.0,Profeco_150901_tiendas,data20220712
584,11015,TORTILLERIA LA JALISCIENSE,"AVENIDA CENTRAL 813, ENTRE HACIENDA CORRALEJO Y HACIEND",IMPULSORA,,,Estado de México,Nezahualcóyotl,57130.0,Profeco_150901_tiendas,data20220712
585,4958,EL ZORRO ABARROTERO (ATIZAPAN),EXHACIENDA DEL PEDREGAL 11 INT. 15,FRACCIONAMIENTO EL PEDREGAL,,,Estado de México,,52947.0,Profeco_150901_tiendas,data20220712
586,11866,TORTILLERIA CANCHOLA,"CITLALTEPEC 2, ENTRE NEVADO DE TOLUCA Y PARICUTIN",INFONAVIT NORTE,,,Estado de México,Cuautitlán Izcalli,54720.0,Profeco_150901_tiendas,data20220712
587,64,SUMESA SUCURSAL ARBOLEDAS,CALZ. DE LOS JINETES 155,ARBOLEDAS,53790352,,Estado de México,,52950.0,Profeco_150901_tiendas,data20220712
588,11004,MERCADO SORIANA SUCURSAL M LAS FLORES (500),"LOPEZ PORTILLO 105, BLVD. COACALCO Y BLVD. FLORES",ZACUAUTITLAN,,,Estado de México,Coacalco,55700.0,Profeco_150901_tiendas,data20220712
589,5099,MERCADO SORIANA SUCURSAL LOPEZ PORTILLO,"LOPEZ PORTILLO 90, CASI ESQ. HERMENEGILDO GALEANA",BUENAVISTA,588441066,,Estado de México,Tultitlán,54944.0,Profeco_150901_tiendas,data20220712
590,11217,PANADERIA LA ABEJITA,"RANCHO SANTA MARIA SIN NUMERO, ESQ. LLANO UNO",VILLAS DE SAN JOSE,,,Estado de México,Tultitlán,54910.0,Profeco_150901_tiendas,data20220712
591,58109,CHEDRAUI SUCURSAL UNICA,HEROES DE NOCUPETARO Nª 201,CENTRO,(443)3176322,,Michoacán,Morelia,58000.0,Profeco_161601_tiendas,data20220712
592,58145,LA PALMITA,"MADRIGALES DE LAS ALTAS TORRES 390, ENTRE L. URUAPAN Y",VASCO DE QUIROGA,,,Michoacán,Morelia,58232.0,Profeco_161601_tiendas,data20220712
593,58134,HIPER LUMEN,"CAMELINAS 2596, ENTRE LA CALLE NUBE Y AGUA",PRADO DEL CAMPESTRE,(443)3156364,,Michoacán,Morelia,58290.0,Profeco_161601_tiendas,data20220712
594,58152,SIN NOMBRE,"CAUCHO 124, ENTRE SAUCE Y BREZO",JARDINES DEL RINCON,,,Michoacán,Morelia,58270.0,Profeco_161601_tiendas,data20220712
595,58011,MERCADO INDEPENDENCIA,"LAZARO CARDENAS S/N, ENTRE VICENTE SANTA MARIA Y ANDRES",CENTRO,312 2828,,Michoacán,Morelia,58000.0,Profeco_161601_tiendas,data20220712
596,58028,TORRE MEDICA,"ANA MARIA GALLAGA 911, ESQ. ISIDRO HUARTE Y LAZARO CARD",CENTRO,(443)3135040,,Michoacán,Morelia,58020.0,Profeco_161601_tiendas,data20220712
597,58017,MERCADO VASCO DE QUIROGA,"OBRAJEROS DE NURIO 17, ENTRE CALLES MADRIGAL DE LAS ALT",VASCO DE QUIROGA,,,Michoacán,Morelia,58230.0,Profeco_161601_tiendas,data20220712
598,58259,WAL-MART EXPRESS SUCURSAL LAS AMÉRICAS,"ENRIQUE RAMIREZ 445, AV. ENRIQUE RAMÍREZ MIGUEL",LAS AMÉRICAS,,,Michoacán,Morelia,58270.0,Profeco_161601_tiendas,data20220712
599,58131,MEGA SORIANA,"ARTILLEROS DE 47 NO. 1520, ENTRE ENRIQUE RAMIREZ Y CURT",CHAPULTEPEC ORIENTE,(443)3142161,,Michoacán,Morelia,58260.0,Profeco_161601_tiendas,data20220712
600,58156,ELEKTRA SUCURSAL 2,"VICENTE SANTA MARIA 300, LAZARO CARDENAS Y LAGO DE YURI",VENTURA PUENTE,(443)3138212,,Michoacán,Morelia,58040.0,Profeco_161601_tiendas,data20220712
601,58146,TORTILLERIA SAN JUAN,"PLAN DE AYALA 647, ENTRE LUIS DE MOYA Y REVOLUCION",CENTRO,(443)3122610,,Michoacán,Morelia,58000.0,Profeco_161601_tiendas,data20220712
602,58153,TORTILLERIA Y MOLINO CARMELITA,"PLAN DE AYALA S/N LOCAL 363, ENTRE PLAZUELA REVOLUCION",CENTRO,(443)3145569,,Michoacán,Morelia,58000.0,Profeco_161601_tiendas,data20220712
603,58250,TORTILLERIA LORENA,"BATALLA DE CASA MATA 1296, ESQ. CALLE TERCERA PRIVADA D",CHAPULTEPEC SUR,,,Michoacán,Morelia,58260.0,Profeco_161601_tiendas,data20220712
604,58087,COPPEL SUCURSAL MADERO,"MADERO ORIENTE 318, ENTRE FRAY DE SAN MIGUEL",CENTRO,(443)3174770,,Michoacán,Morelia,58000.0,Profeco_161601_tiendas,data20220712
605,58258,TORTILLERIA SIN NOMBRE,"NICOLAS BRAVO 277, ENTRE GRANADITAS Y CORREGIDORA",CENTRO,,,Michoacán,Morelia,58000.0,Profeco_161601_tiendas,data20220712
606,58019,FARMACIAS SANTA CRUZ DE MORELIA SUCURSAL G502,"BLVD.GARCIA DE LEON 1711, ESQ. MARIANO JIMENEZ",5 DE DICIEMBRE,(443)3147001,,Michoacán,Morelia,58260.0,Profeco_161601_tiendas,data20220712
607,58127,OFFICE DEPOT SUCURSAL 207,CAMELINAS 2650 ESQ. SOLIDARIDAD,PRADO DEL CAMPESTRE,(443)3153835,,Michoacán,Morelia,58290.0,Profeco_161601_tiendas,data20220712
608,58103,FARMACIA GUADALAJARA SUCURSAL 157,"LAZARO CARDENAS 360, ENTRE VICENTE SANTA MARIA Y MORELO",CENTRO,(443)3132213,(443)3211055,Michoacán,Morelia,58000.0,Profeco_161601_tiendas,data20220712
609,58157,LIVERPOOL SUCURSAL MORELIA,"ENRIQUE RAMIREZ MIGUEL 1000, ENTRE CAMELINAS Y VENEZUEL",PLAZA LAS AMERICAS,(443)1132600,,Michoacán,Morelia,58270.0,Profeco_161601_tiendas,data20220712
610,58180,TORTILLERIA LILI,"BUCARELI 627, ENTRE OBREROS DE STA. CLARA Y TEJEDORES D",VASCO DE QUIROGA,(443)3155571,,Michoacán,Morelia,58230.0,Profeco_161601_tiendas,data20220712
611,58255,TORTILLERIA MORA,"BUCARELI 890-A, ESQ. LACAS DE URUAPAN",VASCO DE QUIROGA,,,Michoacán,Morelia,58230.0,Profeco_161601_tiendas,data20220712
612,58166,MOLINO PARA NIXTAMAL Y TORTILLERIA,"NICOLAS BRAVO 412, GUERRERO Y GRANADITAS",CENTRO,(443)3139141,,Michoacán,Morelia,58000.0,Profeco_161601_tiendas,data20220712
613,58257,TORTILLERIA LA GUADALUPANA,"ARISTEO MERCADO 157, ENTRE FRANCISCO MUJICA Y RAFAEL SÁ",NUEVA CHAPULTEPEC,,,Michoacán,Morelia,58280.0,Profeco_161601_tiendas,data20220712
614,58071,FAMSA METROPOLITANO SUCURSAL UNICA,"LAZARO CARDENAS 1400, ENTRE RIO MAYO Y RIO TEPALTEPEC",VENTURA PUENTE,(443)3174452,,Michoacán,Morelia,58020.0,Profeco_161601_tiendas,data20220712
615,58015,MERCADO REVOLUCION SAN JUAN,"PLAN DE AYALA S/N, ENTRE REVOLUCION Y 20 DE NOVIEMBRE",CENTRO,(443)3120360,,Michoacán,Morelia,58000.0,Profeco_161601_tiendas,data20220712
616,58177,TONY SUPER PAPELERIAS,"VICENTE SANTA MARIA 637, ANA MARIA GALLAGA Y LAZARO CAR",CENTRO,(443)3128757,,Michoacán,Morelia,58000.0,Profeco_161601_tiendas,data20220712
617,58065,WAL MART SIN SUCURSAL,"CALZ. DE LA HUERTA 3000, ESQ. LIBRAMIENTO ORIENTE",EXHACIENDA LA HUERTA,(443)3274813,,Michoacán,Morelia,58011.0,Profeco_161601_tiendas,data20220712
618,58184,TORTILLERIA SIN NOMBRE,"LAGUNA DE PARRAS 115, ENTRE RIO YAQUI Y MIGUEL DE CERVA",VENTURA PUENTE,,,Michoacán,Morelia,58020.0,Profeco_161601_tiendas,data20220712
619,58144,TORTILLERIA TERE,"MANUEL MUÑIZ 618, ENTRE CUAUTLA Y JUAREZ",JUAREZ,(443)3123155,,Michoacán,Morelia,58010.0,Profeco_161601_tiendas,data20220712
620,58154,SORIANA HIPER SUCURSAL SORIANA RÍO 293,"SOLIDARIDAD 350, ESQ. SORIANA RÍO",FELIX IRETA,,,Michoacán,Morelia,58070.0,Profeco_161601_tiendas,data20220712
621,62094,LIVERPOOL SUCURSAL CUERNAVACA,"AUT. MEXICO-ACAPULCO KM. 87.850, INT. GALERIAS CUERNAVA",RICARDO FLORES MAGON,(777)1007400,,Morelos,Cuernavaca,62370.0,Profeco_171701_tiendas,data20220712
622,62084,BODEGA AURRERA SUCURSAL 3869,CUAUHTEMOC 186 ENTRE BAJADA DE CHAPULTEPEC Y PLAN DE AY,CHAPULTEPEC,,,Morelos,Cuernavaca,62450.0,Profeco_171701_tiendas,data20220712
623,62118,FARMATODO SUCURSAL CUERNAVACA,"AVENIDA CENTRAL 19 LOC. 9, INT. PLAZA LA LUNA",CUAUHNAHUAC,(777)3166222,,Morelos,Cuernavaca,62430.0,Profeco_171701_tiendas,data20220712
624,62112,MERCADO NARCISO MENDOZA,"CENTENARIO DE LA INDEPENDENCIA S/N, ENTRE AMADO NERVO Y",CAROLINA,,,Morelos,Cuernavaca,62190.0,Profeco_171701_tiendas,data20220712
625,62132,TORTILLERIA EL AZ,"CLAVIJERO 46, ENTRE FRANCISCO ZARCO Y GUERRERO",LOMAS DE LA SELVA,(777)3146191,,Morelos,Cuernavaca,62000.0,Profeco_171701_tiendas,data20220712
626,62116,FAMSA SUCURSAL LA LUNA,"AVENIDA CENTRAL 19 LOC. 6, INT. PLAZA LA LUNA",CUAUHNAHUAC,(777)3165880,,Morelos,Cuernavaca,62430.0,Profeco_171701_tiendas,data20220712
627,62109,TORTILLERIA MAIZALI SUCURSAL LA NEGRA,"CENTENARIO 100, ESQ. LUIS G. URBINA",CAROLINA,(777)2443817,,Morelos,Cuernavaca,62190.0,Profeco_171701_tiendas,data20220712
628,62183,TORTILLERIA LA NUEVA PROVIDENCIA,"FRANCISCO ZARCO 2, CASI ESQ. CLAVIJERO",CENTRO,,,Morelos,Cuernavaca,62000.0,Profeco_171701_tiendas,data20220712
629,62127,TORTILLERIA LA PEQUEÑA,"ADOLFO LOPEZ MATEOS 318 LOC. 852, INT. MCDO. ADOLFO LOP",CENTRO,,,Morelos,Cuernavaca,62000.0,Profeco_171701_tiendas,data20220712
630,62137,TORTILLERA LA TIENDITA,"ARISTA 6, ENTRE GUERRERO Y NO REELECCION",CENTRO,,,Morelos,Cuernavaca,62000.0,Profeco_171701_tiendas,data20220712
631,62121,PAPELERIA COSAS Y DETALLES,"MATAMOROS 105, ENTRE DWIGTH W. MONROW Y LERDO DE TEJADA",CENTRO,,,Morelos,Cuernavaca,62000.0,Profeco_171701_tiendas,data20220712
632,62182,TORTILLERIA ROSY,"ESTRADA CAJIGAL 406, CASI ESQ. AV. DOMINGO DIEZ",EL EMPLEADO,,,Morelos,Cuernavaca,62250.0,Profeco_171701_tiendas,data20220712
633,62106,TONY SUPER PAPELERIAS SUCURSAL CUERNAVACA,"PLAN DE AYALA 2000, INT. PLAZA MARGOL LOC. 4, 5, 6",FRACCIONAMIENTO CUAHUNAHUAC,(777)3159393,,Morelos,Cuernavaca,62430.0,Profeco_171701_tiendas,data20220712
634,62088,MEGA SORIANA SUCURSAL LA SELVA,"VICENTE GUERRERO 205, ENTRE PERICON Y DE LA SELVA",LOMAS DE LA SELVA,(777)3105016,,Morelos,Cuernavaca,62270.0,Profeco_171701_tiendas,data20220712
635,62117,FARMACIAS SIMILARES SUCURSAL 291,"DEGOLLADO 16, ENTRE MORELOS Y MATAMOROS",CENTRO,(777)3102476,,Morelos,Cuernavaca,62000.0,Profeco_171701_tiendas,data20220712
636,62044,SEARS,"ALTA TENSION S/N, INT. PLAZA CUERNAVACA",LOMAS DE LA SELVA,(777)3620208,,Morelos,Cuernavaca,62270.0,Profeco_171701_tiendas,data20220712
637,62098,CHEDRAUI SUCURSAL CUERNAVACA FLORES MAGON,PLAN DE AYALA (CART. JIU-CUE) KM 1.5 ENTRE JACARANDA Y,FLORES MAGON,(777)3291900,,Morelos,Cuernavaca,66237.0,Profeco_171701_tiendas,data20220712
638,64280,TORTILLERIA DE LA TORRE SUCURSAL UNICA,"CHAPULTEPEC 700 LOCAL 1082, INT. CENTRAL DE ABASTOS MON",SANTA MARGARITA,83553773,,Nuevo León,Guadalupe,67147.0,Profeco_191901_tiendas,data20220712
639,64125,H.E.B. SUCURSAL LINCOLN,"LINCOLN 5252 PONIENTE, ESQ. LEON XIII",AMPLIACION SAN JORGE,(81)81531440,,Nuevo León,Monterrey,64330.0,Profeco_191901_tiendas,data20220712
640,64260,CREMERIA KESOS Y KOSAS,"CHAPULTEPEC 700 BODEGA 238, INT. CENTRAL DE ABASTOS MON",CENTRAL DE ABASTOS,,,Nuevo León,Guadalupe,67140.0,Profeco_191901_tiendas,data20220712
641,64062,PAPELERIA SALDAÑA SUCURSAL JUAREZ,"JUAREZ 315 NORTE, ESQ. ESPINOZA",CENTRO,(81)83431518,,Nuevo León,Monterrey,64000.0,Profeco_191901_tiendas,data20220712
642,64214,TORTILLERIA LA RANCHERA,"COLEGIO CIVIL 114 SUR, ENTRE ARAMBERRI Y MODESTO ARREOL",CENTRO,(81)14773721,,Nuevo León,Monterrey,64000.0,Profeco_191901_tiendas,data20220712
643,64258,SAN MATEO GRANOS Y SEMILLAS,"CHAPULTEPEC 700 BODEGA 72, INT. CENTRAL DE ABASTOS MONT",CENTRAL DE ABASTOS,(81)83175994,,Nuevo León,Guadalupe,67140.0,Profeco_191901_tiendas,data20220712
644,64269,TORTILLERÍA LÓPEZ SUCURSAL MATRIZ,"ANASTACIO BUSTAMANTE 171, ENTRE BENITO JUÁREZ Y PORFIRI",CENTRO,8180574217,,Nuevo León,San Nicolás de los Garza,66400.0,Profeco_191901_tiendas,data20220712
645,64277,MERCO SUCURSAL ARRAMBERRI (528),"SILVESTRE ARRAMBERRI 318, ENTRE JIMENEZ Y MODESTO ARREO",CENTRO,8118233050,,Nuevo León,Monterrey,64000.0,Profeco_191901_tiendas,data20220712
646,64141,FARMACIA VISTA HERMOSA,"ENRIQUE C. LIVAS 598, ENTRE PUERTO RICO Y GUAYANA HOLAN",VISTA HERMOSA,(81)83461303,(81)83487418,Nuevo León,Monterrey,64620.0,Profeco_191901_tiendas,data20220712
647,64254,SAN GABRIEL ABASTECEDORA DE CARNES,"CHAPULTEPEC 700 BODEGA 70, INT. CENTRAL DE ABASTOS MONT",CENTRAL DE ABASTOS,(81)83172400,,Nuevo León,Guadalupe,67140.0,Profeco_191901_tiendas,data20220712
648,64186,TORTILLERIA REGIA,"ZARAGOZA 1150 NORTE, ENTRE COLON Y REFORMA",CENTRO,(81)83751049,,Nuevo León,Monterrey,64000.0,Profeco_191901_tiendas,data20220712
649,64199,PAPELERIA EL LAPIZ,"SIMON BOLIVAR 1609, ESQ. ATLIXCO",MITRAS CENTRO,(81)83484805,,Nuevo León,Monterrey,64460.0,Profeco_191901_tiendas,data20220712
650,64255,ABARROTES PAEZ HERMANOS,"CHAPULTEPEC 700 BODEGA 240, INT. CENTRAL DE ABASTOS MON",CENTRAL DE ABASTOS,(81)83170913,,Nuevo León,Guadalupe,67140.0,Profeco_191901_tiendas,data20220712
651,64192,MUEBLERIA ELIZONDO SUCURSAL MADERO,"MADERO 580 OTE., ENTRE ZARAGOZA Y EMILIO CARRANZA",CENTRO,(81)81254000,,Nuevo León,Monterrey,64000.0,Profeco_191901_tiendas,data20220712
652,64176,ELEKTRA SUCURSAL JUAREZ,"JIMENEZ 920, ESQ. ARTEAGA",CENTRO,(81)81874913,,Nuevo León,Monterrey,64000.0,Profeco_191901_tiendas,data20220712
653,64116,H.E.B. SUCURSAL SAN NICOLAS,"UNIVERSIDAD NTE. 101, ENTRE PARQUE ANAHUAC Y TREVI",ANAHUAC,,,Nuevo León,San Nicolás de los Garza,66450.0,Profeco_191901_tiendas,data20220712
654,64151,MERCADO EL MESON ESTRELLA,"JUAN MENDEZ, ENTRE RUPERTO MARTINEZ Y ARAMBERRI",CENTRO,NO TIENE,,Nuevo León,Monterrey,64000.0,Profeco_191901_tiendas,data20220712
655,64259,LDR EL MUNDO DEL QUESO,"CHAPULTEPEC 700 BODEGA 56, INT. CENTRAL DE ABASTOS MONT",CENTRAL DE ABASTOS,83-17-01-00,,Nuevo León,Guadalupe,67140.0,Profeco_191901_tiendas,data20220712
656,64155,FARMACIAS DEL AHORRO SUCURSAL VISTA HERMOSA,"ENRIQUE C. LIVAS 679, ESQ. CANADA",VISTA HERMOSA,(81)83480020,,Nuevo León,Monterrey,64620.0,Profeco_191901_tiendas,data20220712
657,64161,FARMACIA GUADALAJARA SUCURSAL JUAREZ,"JUAREZ 893, ESQ. ARTEAGA",CENTRO,(81)83754667,,Nuevo León,Monterrey,64000.0,Profeco_191901_tiendas,data20220712
658,64026,SORIANA HÍPER SUCURSAL LINCONL (10),"ABRAHAM LINCOLN S/N, ENTRE JOSE E. GONZALEZ Y SAN FERNA",MITRAS NORTE,(81)83299000,,Nuevo León,Monterrey,64320.0,Profeco_191901_tiendas,data20220712
659,64172,GUANAJUATO,"COLEGIO CIVIL 321, ENTRE MIGUEL M. DEL LLANO Y ALBINO E",CENTRO,,,Nuevo León,Monterrey,64000.0,Profeco_191901_tiendas,data20220712
660,64167,GINI,EDIPO 406,VALLE DE INFORNAVIT,,,Nuevo León,Monterrey,64350.0,Profeco_191901_tiendas,data20220712
661,64189,TORTILLERIA LA MEXICANA,"GUERRERO 131 SUR, ENTRE ARAMBERRI Y MODESTO ARREOLA",CENTRO,(81)83426637,,Nuevo León,Monterrey,64000.0,Profeco_191901_tiendas,data20220712
662,64149,LIVERPOOL SUCURSAL CENTRO,"MELCHOR OCAMPO 108, ESQ. BENITO JUÁREZ",ORIENTE CENTRO,8183184900,,Nuevo León,Monterrey,64620.0,Profeco_191901_tiendas,data20220712
663,64251,POLLOS TRESA,"CHAPULTEPEC 700 BODEGA 28, INT. CENTRAL DE ABASTOS MONT",CENTRAL DE ABASTOS,(81)83175655,,Nuevo León,Guadalupe,67140.0,Profeco_191901_tiendas,data20220712
664,64219,TORTILLERIA SEGURA SUCURSAL LINCOLN,"LINCOLN 5816, ENTRE PELICANO Y CARPINTERO",VALLE VERDE 2DO. SECTOR,(81)83815535,,Nuevo León,Monterrey,64117.0,Profeco_191901_tiendas,data20220712
665,64252,¡QUE POLLO!,"CHAPULTEPEC 700 BODEGA 101, INT. CENTRAL DE ABASTOS MON",CENTRAL DE ABASTOS,(81)83172165,,Nuevo León,Guadalupe,67140.0,Profeco_191901_tiendas,data20220712
666,64148,FARMACIA DE SIMILARES SUCURSAL MONTERREY 2,"JUAREZ 311 NTE., ESQ. ESPINOZA",CENTRO,(81)83459159,,Nuevo León,Monterrey,64000.0,Profeco_191901_tiendas,data20220712
667,64273,COPPEL SUCURSAL COLÓN (1360),"AV.CRISTOBAL COLÓN 360, ENTRE JIMENEZ Y JUAN MENDEZ",CENTRO,8113540589,,Nuevo León,Monterrey,64000.0,Profeco_191901_tiendas,data20220712
668,64256,ABARROTES COMERCIAL TREVIÑO,"CHAPULTEPEC 700 BODEGAS 106 Y 107, INT. CENTRAL DE ABAS",CENTRAL DE ABASTOS,(81)83170088,,Nuevo León,Guadalupe,67140.0,Profeco_191901_tiendas,data20220712
669,64150,WAL MART SUCURSAL LINCOLN,"ABRAHAM LINCOLN 5400, ENTRE MA. DE JESUS CANDIA Y PINGÜ",RINCON DE SANTA CECILIA,(81)11671381,,Nuevo León,Monterrey,64117.0,Profeco_191901_tiendas,data20220712
670,64263,MI TIENDA DEL AHORRO SUCURSAL AZTLAN,"SOLIDARIDAD 5151, ENTRE PENITENCIARIA Y GARDENIA",VALLE DEL TOPO CHICO,(81)81531283,,Nuevo León,Monterrey,64259.0,Profeco_191901_tiendas,data20220712
671,64211,TORTILLERIA LOS DEL ROBLE,"MELCHOR MUZQUIZ 2601, ESQ. ROBLE",TALLERES,(81)83460385,,Nuevo León,Monterrey,64480.0,Profeco_191901_tiendas,data20220712
672,64232,BODEGA AURRERA SUCURSAL TOPO CHICO,"ALMAZÁN 4313, ESQ. RODRIGO GÓMEZ",VALLE DEL TOPO CHICO,(81)83013533,,Nuevo León,Monterrey,64259.0,Profeco_191901_tiendas,data20220712
673,64236,FARMACIAS ABC DEL NORTE SUCURSAL UNIDAD MODELO,"COYOACAN 104, ESQ. AZTLAN",UNIDAD MODELO,(81)83222236,,Nuevo León,Monterrey,64140.0,Profeco_191901_tiendas,data20220712
674,64027,SORIANA HÍPER SUCURSAL SAN NICÓLAS (12),"ALFONSO REYES 601,ENTRE FRAY BARTOLOME DE LAS CASAS Y 1",EL ROBLE,(81)83299000,,Nuevo León,San Nicolás de los Garza,66450.0,Profeco_191901_tiendas,data20220712
675,64250,CENTRAL DE ABASTOS,"CHAPULTEPEC 700, INT. CENTRAL DE ABASTOS MONTERREY",CENTRAL DE ABASTOS,,,Nuevo León,Guadalupe,67140.0,Profeco_191901_tiendas,data20220712
676,64134,OXXO SUCURSAL MOISES SAENZ,"MOISES SAENZ 608, ESQ. YURIRIA",MITRAS CENTRO,(81)83460101,,Nuevo León,Monterrey,64460.0,Profeco_191901_tiendas,data20220712
677,64242,TORTILLERIA EL ROBLE NUEVO,"VILLAS DE MEXICO 294, ESQ. VILLAS DE SUIZA",ROBLE NUEVO,(81)87627384,,Nuevo León,General Escobedo,64050.0,Profeco_191901_tiendas,data20220712
678,64253,CARNICERÍA PRYCA,"CHAPULTEPEC 700 BODEGA 111, INT. CENTRAL DE ABASTOS MON",CENTRAL DE ABASTOS,(81)83172165,,Nuevo León,Guadalupe,67140.0,Profeco_191901_tiendas,data20220712
679,64268,7 ELEVEN SUCURSAL SIMÓN BOLÍVAR,"AV.SIMÓN BOLÍVAR 1248, ENTRE AV.MOISÉS SAÉNZ Y CALLE CE",MITRAS CENTRO,,,Nuevo León,Monterrey,64460.0,Profeco_191901_tiendas,data20220712
680,64078,HEMSA,"JUAREZ SUR 430, ENTRE 5 Y 15 DE MAYO",CENTRO,(81)83185500,,Nuevo León,Monterrey,64000.0,Profeco_191901_tiendas,data20220712
681,64257,SEMILLAS RG,"CHAPULTEPEC 700 BODEGA 113, INT. CENTRAL DE ABASTOS MON",CENTRAL DE ABASTOS,(81)13519785,,Nuevo León,Guadalupe,67140.0,Profeco_191901_tiendas,data20220712
682,64276,TORTILLERIA LA HERRADURA,"AV. CHAPULTEPEC 806, ESQ. AV. REALITO",LA HERRADURA,8183171279,,Nuevo León,Guadalupe,67140.0,Profeco_191901_tiendas,data20220712
683,77120,TORTILLERIA LA LUPITA,"MZ. 1 LT. 35, POR PROLONGACION TULUM",SM.- 67,,,Quintana Roo,Benito Juárez,77500.0,Profeco_232301_tiendas,data20220712
684,77133,FARMACIA CANTO SUCURSAL CRUCERO,"LOPEZ PORTILLO MZ. 3 LT. 14, CRUCERO CENTRO",SM. 64,(998)884635,,Quintana Roo,Benito Juárez,77524.0,Profeco_232301_tiendas,data20220712
685,77000,SORIANA SÚPER SUCURSAL CANCÚN GLORIETA,"AV. TULUM MZ-01, LT- 37, 38 Y 39, ESQ. GLORIETA UXMAL",S.M. 2,9988843330,,Quintana Roo,Benito Juárez,77500.0,Profeco_232301_tiendas,data20220712
686,77092,SANBORNS,"TULUM SUR 276 S.M. 7, PLAZA LAS AMERICAS",CENTRO,,,Quintana Roo,Benito Juárez,77500.0,Profeco_232301_tiendas,data20220712
687,77090,OFFICEMAX SUCURSAL CANCUN 115,"COBA 122, SM. 36, A UN COSTADO DE ELEKTRA",CENTRO,(998)8877807,,Quintana Roo,Benito Juárez,77500.0,Profeco_232301_tiendas,data20220712
688,77104,SORIANA HIPER SUCURSAL CANCÚN (126),"AV. COBA SM. 21 L. 2, ENTRE AV. ANDRÉS QUINTANA ROO",CENTRO,,,Quintana Roo,Benito Juárez,77500.0,Profeco_232301_tiendas,data20220712
689,77089,LIVERPOOL,"TULUM 276 SM. 7 LOC. 4-9, PLAZA LAS AMERICAS",CENTRO,,,Quintana Roo,Benito Juárez,77503.0,Profeco_232301_tiendas,data20220712
690,77083,SEARS ROEBUCK DE MEXICO,"TULUM 260 SM. 7 Y 9, PLAZA LA AMERICAS",CENTRO,,,Quintana Roo,Benito Juárez,77500.0,Profeco_232301_tiendas,data20220712
691,77108,MERCEDES,INTERIOR DEL MERCADO CHETUMALITO,SM. 67,,,Quintana Roo,Benito Juárez,77510.0,Profeco_232301_tiendas,data20220712
692,77304,TORTILLERIA EL PARIAN,"MZ. 9, LT. 29, CALLE 7, ESQ. CALLE 18",SM. 66,,,Quintana Roo,Benito Juárez,77500.0,Profeco_232301_tiendas,data20220712
693,77119,TORTILLERIA MIRANDA,"MZ. 2 LT. 10, FRENTE AL HOTEL LOS CUATES DE CANCUN",SM. 65,,,Quintana Roo,Benito Juárez,77500.0,Profeco_232301_tiendas,data20220712
694,77018,TELEBODEGA,"REG. 89 MZ. 61 LT. 1 AL 7, A UN COSTADO DEL ESTADIO CAN",NUEVOS HORIZONTES,(998)8882270,,Quintana Roo,Benito Juárez,77516.0,Profeco_232301_tiendas,data20220712
695,77118,FARMACIA YZA SUCURSAL UXMAL,"DIAGONAL PINO LT. 19, ESQ. TULUM",SM. 23,(998)8873738,,Quintana Roo,Benito Juárez,77500.0,Profeco_232301_tiendas,data20220712
696,77011,CHEDRAUI,"TULUM 260 SM. 7 MZ. 4 Y 9, PLAZA LAS AMERICAS",CENTRO,(998)8872190,,Quintana Roo,Benito Juárez,77500.0,Profeco_232301_tiendas,data20220712
697,77100,ELEKTRA SUCURSAL 3230,"TULUM SM. 64 MZ. 4 LT. 1 Y 2, FRENTE A ZAPATERIA 3 HERM",CENTRO,(998)8879517,,Quintana Roo,Benito Juárez,77500.0,Profeco_232301_tiendas,data20220712
698,77300,FARMACIA DEL AHORRO SUCURSAL CRUCERO,"LOPEZ PORTILLO, MZ. 1, LT. 24 Y 25, ESQ. PROLONGACION T",SM. 66,,,Quintana Roo,Benito Juárez,77500.0,Profeco_232301_tiendas,data20220712
699,77124,TORTILLERIA EL DIVINO REDENTOR,"MZ. 54 LT. 1, E-A CALLE, LOC. 19 A 21",SM. 23,,,Quintana Roo,Benito Juárez,77500.0,Profeco_232301_tiendas,data20220712
700,77276,COPPEL SUCURSAL TULUM,"TULUM 1165, ENTRE CHICHEN ITZA Y UXMAL",SUPERMANZANA 2,(998)8846827,,Quintana Roo,Benito Juárez,77500.0,Profeco_232301_tiendas,data20220712
701,77275,SUPER AKI SUCURSAL CRUCERO,"LOPEZ PORTILLO MZ. 1 LT. 31, ESQ. PROLONG. TULUM",SUPERMANZANA 66,(998)8924690,,Quintana Roo,Benito Juárez,77500.0,Profeco_232301_tiendas,data20220712
702,77109,TORTILLERIA LA ANTENA,"MZ. 8, LT. 34",REGION 218,,,Quintana Roo,Benito Juárez,77515.0,Profeco_232301_tiendas,data20220712
703,77110,TORTILLERIA BENITO,"MZ. 32, LT. 01",SM. 23,,,Quintana Roo,Benito Juárez,77500.0,Profeco_232301_tiendas,data20220712
704,77008,WAL MART,"COBA SM. 21 MZ. 2 LT. 2, COSTADO SAMS CLUB",CENTRO,(998)8877114,,Quintana Roo,Benito Juárez,77500.0,Profeco_232301_tiendas,data20220712
705,77312,TORTILLERÍA TANY,"CALLE 7, MZ.- 2, LT.- LT.-44, ESQ. CALLE 18 PONIENTE",SM.-66,,,Quintana Roo,Benito Juárez,77500.0,Profeco_232301_tiendas,data20220712
706,77099,FARMACIAS SIMILARES,"TULUM SM. 22 MZ. 7 LT. 4, A UN COSTADO DEL HOTEL RIVER",CENTRO,(998)8980190,,Quintana Roo,Benito Juárez,77500.0,Profeco_232301_tiendas,data20220712
707,77281,PAPELERIA DEL AHORRO,"LOPEZ PORTILLO MZ.18 LT. 2, ENTRE C.ALLE 71 NORTE Y C.",SM. 60,,,Quintana Roo,Benito Juárez,77500.0,Profeco_232301_tiendas,data20220712
708,77091,OFFICE DEPOT SUCURSAL CANCUN,"TULUM 29 LT. 1 SM. 20 MZ. 1, A LADO DEL RESTAURANTE ITA",CENTRO,(998)8920150,,Quintana Roo,Benito Juárez,77500.0,Profeco_232301_tiendas,data20220712
709,78049,OFFICE MAX SUCURSAL SAN LUIS POTOSI 2,"VENUSTIANO CARRANZA 2301, ESQ. NICOLAS FERNANDO TORRES",FRACCIONAMIENTO POLANCO,(444)8175511,,San Luis Potosí,San Luis Potosí,78220.0,Profeco_242401_tiendas,data20220712
710,78056,TORTILLERIA SAN LUIS SUCURSAL 3,"SAN LUIS 490, ENTRE ALLENDE Y ZARAGOZA",CENTRO,(444)1284583,,San Luis Potosí,San Luis Potosí,78000.0,Profeco_242401_tiendas,data20220712
711,78090,ELEKTRA SUCURSAL REFORMA (2587),"REFORMA 313, ENTRE EJE VIAL JUAN SARABIA Y ALHONDIGA",CENTRO,(444)5328600,,San Luis Potosí,San Luis Potosí,78000.0,Profeco_242401_tiendas,data20220712
712,78082,MERCADO REPUBLICA,"REFORMA 405-A, ENTRE 16 DE SPTIEMBRE Y PEDRO MONTOYA",CENTRO,(444)8127060,,San Luis Potosí,San Luis Potosí,78000.0,Profeco_242401_tiendas,data20220712
713,78045,FOLY MUEBLES SUCURSAL SAN LUIS POTOSI,"AMADO NERVO 541, ENTRE CAPITAN CALDERA Y MUÑOZ",TEQUISQUAPAN,(444)1683020,,San Luis Potosí,San Luis Potosí,78250.0,Profeco_242401_tiendas,data20220712
714,78035,PESCADERIA LOS 7 MARES,"HIDALGO MIER Y TERAN S/N SECC. F , INT. MCDO. HIDALGO",CENTRO,(444)8128734,,San Luis Potosí,San Luis Potosí,78000.0,Profeco_242401_tiendas,data20220712
715,78046,FARMACIA CENTRAL SUCURSAL CARRANZA,"VENUSTIANO CARRANZA 2376, ENTRE ALBUQUERQUE Y ARTISTAS",POLANCO,(444)8139855,,San Luis Potosí,San Luis Potosí,78220.0,Profeco_242401_tiendas,data20220712
716,78015,LIVERPOOL SUCURSAL SAN LUIS POTOSÍ 136,"BLVD. ANTONIO ROCHA CORDERO 700, INT. PLAZA SAN LUIS",LOMAS DEL TECNOLOGICO,(444)8264800,,San Luis Potosí,San Luis Potosí,78000.0,Profeco_242401_tiendas,data20220712
717,78055,TORTILLERIA SAN LUIS SUCURSAL 2,"INDEPENDENCIA 405, ENTRE HIMNO NACIONAL Y PINTORES",HIMNO NACIONAL 2A. SECCION,(444)1284583,,San Luis Potosí,San Luis Potosí,78369.0,Profeco_242401_tiendas,data20220712
718,78007,H.E.B. SUCURSAL SAN LUIS POTOSI,"HIMNO NACIONAL 100, ENTRE NIÑO ARTILLERO Y JOSE ARLEGUI",VIRREYES,(444)8260093,,San Luis Potosí,San Luis Potosí,78240.0,Profeco_242401_tiendas,data20220712
719,78066,TORTILLERIA SIN NOMBRE,"SANTOS DEGOLLADO 708, ESQ. ANAHUAC",TEQUISQUIAPAN,,,San Luis Potosí,San Luis Potosí,78040.0,Profeco_242401_tiendas,data20220712
720,78044,COPPEL SUCURSAL 043 REFORMA,"REFORMA 750, ESQ. DAMIAN CARMONA",CENTRO,(444)8120412,,San Luis Potosí,San Luis Potosí,78000.0,Profeco_242401_tiendas,data20220712
721,78026,TONY SUPER PAPELERIAS SUCURSAL CARRANZA SAN LUIS POTOSI,"VENUSTIANO CARRANZA 2390, FRENTE A HEB",POLANCO,(444)8113623,,San Luis Potosí,San Luis Potosí,78220.0,Profeco_242401_tiendas,data20220712
722,78036,PESCADERIA REYITOS,"HIDALGO MIER Y TERAN S/N SECC. F , INT. MERCADO HIDAL",CENTRO,(444)8145121,,San Luis Potosí,San Luis Potosí,78000.0,Profeco_242401_tiendas,data20220712
723,78001,MEGA SORIANA SUCURSAL TANGAMANGA (878),"DR. SALVADOR NAVA S/N, ESQ. MANUEL J. CLOUTHIER",TANGAMANGA,,,San Luis Potosí,San Luis Potosí,78269.0,Profeco_242401_tiendas,data20220712
724,78012,FAMSA SUCURSAL ALLENDE,"IGNACIO ALLENDE 205, ENTRE ALVARO OBREGON Y ARISTA",CENTRO,(444)8120706,,San Luis Potosí,San Luis Potosí,78000.0,Profeco_242401_tiendas,data20220712
725,78069,SEARS SUCURSAL TANGAMANGA,"MANUEL J. CLOUTHIER 273, ENTRE SALVADOR NAVA E HIMNO NA",FRACCIONAMIENTO TANGAMANGA,(444)1027600,,San Luis Potosí,San Luis Potosí,78269.0,Profeco_242401_tiendas,data20220712
726,78023,OXXO SUCURSAL GEMELOS,"NEREO RODRIGUEZ BARRAGAN 1387, FRENTE A PLAZA GEMELOS",POLANCO,(444)811012,,San Luis Potosí,San Luis Potosí,78220.0,Profeco_242401_tiendas,data20220712
727,78027,TORTILLERIA MIRANDA SUCURSAL ZAPATA,"NICOLAS ZAPATA 633, ESQ. AMADO NERVO",TEQUISQUIAPAN,(444)8393942,,San Luis Potosí,San Luis Potosí,78250.0,Profeco_242401_tiendas,data20220712
