,# codigo,nombre,direccion,colonia,telefono,telefono2,estado,minicipio,codigopostal,profeco_tiendas_id,folder_id
0,20008,WALMART SUCURSAL PLAZA GALERIAS,"INDEPENDENCIA 2351, CENTRO COMERCIAL GALERIAS",LA CONCEPCION,(449)9107001,,Aguascalientes,Aguascalientes,20128.0,Profeco_010101_tiendas,data20220622
1,20158,FRANCO SOLO CALIDAD SUCURSAL CENTRAL DE ABASTO,"AV. MAHATMA GANDHI S/N. BLOCK H LOCAL 20, INT. CENTRAL",CENTRAL DE ABASTO,4499711338,,Aguascalientes,Aguascalientes,20280.0,Profeco_010101_tiendas,data20220622
2,20114,MEGA SORIANA SUCURSAL AGUASCALIENTES,"AGUASCALIENTES NTE. 802, ESQ. BLVD. A ZACATECAS",TROJES DE ALONSO,(449)9968877,,Aguascalientes,Aguascalientes,20116.0,Profeco_010101_tiendas,data20220622
3,20010,MERCADO TERAN,"5 DE MAYO S/N, ESQ. ARTEGA",CENTRO,(449)9181732,,Aguascalientes,Aguascalientes,20000.0,Profeco_010101_tiendas,data20220622
4,20145,PAPELERIA MARCHAND,"BLVD. A ZACATECAS 502 B, ENTRE TEPEZALA Y AV. AGUASCALI",EL PLATEADO,996-96-32,,Aguascalientes,Aguascalientes,20137.0,Profeco_010101_tiendas,data20220622
5,20144,OXXO SUCURSAL COLON,"JUAN DE MONTORO 101, ESQ. CRISTOBAL COLON A UN COSTADO",CENTRO,,,Aguascalientes,Aguascalientes,20000.0,Profeco_010101_tiendas,data20220622
6,20135,TORTILLERIA SAN PEDRO,"JOSE MARIA CHAVEZ 461, ESQ. IGNACIO T. CHAVEZ",OBRAJE,(449)9183163,,Aguascalientes,Aguascalientes,20230.0,Profeco_010101_tiendas,data20220622
7,20039,CHEDRAUI SUCURSAL AGUASCALIENTES,"BLVD. JOSE MA. CHAVEZ 1809, ENTRE VALENTE QUINTANA Y AN",PRADOS DE VILLASUNCIÓN,(449)9106461,,Aguascalientes,Aguascalientes,20280.0,Profeco_010101_tiendas,data20220622
8,20160,CENTRAL DE ABASTO,"AV. MAHATMA GANDHI S/N, SALIDA A MÉXICO",CENTRAL DE ABASTO,,,Aguascalientes,Aguascalientes,20280.0,Profeco_010101_tiendas,data20220622
9,20058,SEARS SUCURSAL AGUASCALIENTES,"BLVD. A ZACATECAS S/N, ESQ. BLVD. COLOSIO",TROJES DE ALONSO,(449)9107022,,Aguascalientes,Aguascalientes,20116.0,Profeco_010101_tiendas,data20220622
10,20083,SORIANA HIPER SUCURSAL SAN MARCOS,"CONVENCION S/N, ENTRE CARLOS SAGREDO Y FUNDICION",SAN CAYETANO,(449)9142239,,Aguascalientes,Aguascalientes,20010.0,Profeco_010101_tiendas,data20220622
11,20002,BODEGA AURRERA,"CONVENCION 1914 PTE. 1101, ENTRE A. DE LOS ARELLANO Y G",GUADALUPE,(449)9164250,,Aguascalientes,Aguascalientes,20180.0,Profeco_010101_tiendas,data20220622
12,20159,SUPER CARNICERIA SAN JUAN SUCURSAL CENTRAL DE ABASTO,"AV. MAHATMA GANDHI S/N. BLOCK B LOCAL DEL 5 AL 7, INT.",CENTRAL DE ABASTO,4491469491,,Aguascalientes,Aguascalientes,20280.0,Profeco_010101_tiendas,data20220622
13,21003,CALIMAX SUCURSAL RIO,BLVD. CUAUHTEMOC Y PASEO DE LOS HEROES 1250,ZONA RIO,(664)6343255,,Baja California,Tijuana,22340.0,Profeco_020201_tiendas,data20220622
14,21477,TORTILLERIA MADERO,"AV. FRANCISCO I MADERO 826, ENTRE CALLE SEGUNDA Y CALLE",ZONA CENTRO,,,Baja California,Tijuana,22000.0,Profeco_020201_tiendas,data20220622
15,21393,TORTILLERIA GRANO DE ORO SUCURSAL RIO,"GUADALUPE VICTORIA 9350, ESQ. FRANCISCO JAVIER MINA",ZONA RIO,(664)6847021,,Baja California,Tijuana,22320.0,Profeco_020201_tiendas,data20220622
16,21422,TORTILLERIA LA POBLANITA,"CALLE 7A. GALEANA 1810, ENTRE NIÑOS HEROES Y CONSTITUCI",ZONA CENTRO,(664)6880560,,Baja California,Tijuana,22000.0,Profeco_020201_tiendas,data20220622
17,21018,SORIANA HIPER SUCURSAL RIO,"PASEO DE LOS HEROES 95, CENTRO COMERCIAL PLAZA RÍO",ZONA RIO,(664)6840135,,Baja California,Tijuana,22010.0,Profeco_020201_tiendas,data20220622
18,21415,MERCADO MIGUEL HIDALGO,"BLVD. SANCHEZ TABOADA 9351, ENTRE CALZ. INDEPENDENCIA Y",ZONA RIO TIJUANA,(664)6840485,,Baja California,Tijuana,22010.0,Profeco_020201_tiendas,data20220622
19,21420,TORTILLERIA ISAURA,"CALLE 9 NO. 2100, ENTRE NEGRETE Y MADERO",ZONA CENTRO,(664)6855500,,Baja California,Tijuana,22000.0,Profeco_020201_tiendas,data20220622
20,21478,OXXO SUCURSAL TAMAYO,"RUFINO TAMAYO 1, ESQ. BLVD. CUAUHTEMOC",ZONA RIO,(664)9757300,,Baja California,Tijuana,22000.0,Profeco_020201_tiendas,data20220622
21,21045,LEY SUCURSAL OTAY (1051),BLVD. LAZARO CARDENAS Y CALZ. TECNOLOGICO S/N,HIPODROMO,(664)6470040,,Baja California,Tijuana,22390.0,Profeco_020201_tiendas,data20220622
22,21067,SALINAS Y ROCHA SUCURSAL 9085,"CONSTITUCION 957, ENTRE TERCERA Y CUARTA",ZONA CENTRO,(664)1379950,,Baja California,Tijuana,22000.0,Profeco_020201_tiendas,data20220622
23,21394,TORTILLERIA JUAREZ,"QUINTA EMILIANO ZAPATA 447-8, ESQ. OCAMPO",ZONA CENTRO,(664)6882219,,Baja California,Tijuana,22000.0,Profeco_020201_tiendas,data20220622
24,21473,TORTILLERIA EL DIAMANTE SUCURSAL UNICA,"ALLENDE 7737, ENTRE BRAVO Y RAYON",INDEPENDENCIA,(664)3314392,,Baja California,Tijuana,22255.0,Profeco_020201_tiendas,data20220622
25,21416,FARMACIA DEL SOL SUCURSAL 2,"INDEPENDENCIA 63, ENTRE BLVD. SANCHEZ TABOADA Y JAVIER",ZONA RIO,(664)6845763,,Baja California,Tijuana,22010.0,Profeco_020201_tiendas,data20220622
26,21110,WALMART SUCURSAL TIJUANA HIPODROMO,"AGUACALIENTE, ESQ. PASEO DE LAS AMERICAS 11999",HIPODROMO,(664)6816150,,Baja California,Tijuana,22024.0,Profeco_020201_tiendas,data20220622
27,21064,ELEKTRA SUCURSAL CONSTITUCION (2150),"AV. CONSTITUCION 634, ENTRE CALLE 2DA Y 3RA",ZONA CENTRO,(664)1379918,,Baja California,Tijuana,22000.0,Profeco_020201_tiendas,data20220622
28,21421,TORTILLERIA LA MEXICANA,"NEGRETE 714, ESQ. CALLE 4A.",ZONA CENTRO,(664)6858460,,Baja California,Tijuana,22000.0,Profeco_020201_tiendas,data20220622
29,21465,SORIANA SUPER SUCURSAL LIBERTAD (377),"RAMPA RUIZ CORTINEZ S/N, ENTRE DEFENSORES DE B.C. Y FER",LIBERTAD,(664)6831609,,Baja California,Tijuana,22300.0,Profeco_020201_tiendas,data20220622
30,21475,TORTILLERIA LA BOCHITA SUCURSAL UNICA,"GUADALUPE VICTORIA INT 21, INT. MERCADO HIDALGO",ZONA RIO,(664)2150705,,Baja California,Tijuana,22010.0,Profeco_020201_tiendas,data20220622
31,21476,TORTILLERIA EL GRANO DE ORO SUCURSAL CUAUHTEMOC,"BLVD. CUAUHTEMOC SUR 2801, INT. PLAZA TROPICANA",DAVILA,(664)6818755,,Baja California,Tijuana,22044.0,Profeco_020201_tiendas,data20220622
32,23101,BODEGA AURRERA SUCURSAL UNIDAD CAMIMO REAL 3119,"CALZADA CAMINO REAL S/N, ESQ. CARR. TRANSPENISULAR LA P",CAMINO REAL,(612)1254180,,Baja California Sur,La Paz,23088.0,Profeco_030301_tiendas,data20220622
33,23047,MERCADO NICOLAS BRAVO,"NICOLAS BRAVO S/N, ESQ. GUILLERMO PRIETO",CENTRO,(612)1221604,,Baja California Sur,La Paz,23000.0,Profeco_030301_tiendas,data20220622
34,23056,TORTILLERIA HIGIENICA,"IGNACIO ALTAMIRANO S/N, ENTRE AÑIÑI Y RETORNO CHICORI",PERICUES,(612)1221912,,Baja California Sur,La Paz,23097.0,Profeco_030301_tiendas,data20220622
35,23000,CASA LEY SUCURSAL LA PAZ,"AGUSTIN OLACHEA S/N, ESQ. ANTONIO NAVARRO",PUESTA DEL SOL,(612)1255515,(612)1255125,Baja California Sur,La Paz,23070.0,Profeco_030301_tiendas,data20220622
36,23030,COPPEL SUCURSAL LA PAZ,"BLVD. FORJADORES DE SUDCALIFORNIA 4390, ESQ. LUIS DONAL",EX BASE AEREA,(612)1654264,,Baja California Sur,La Paz,23050.0,Profeco_030301_tiendas,data20220622
37,23023,OFFICE MAX SUCURSAL LA PAZ,"BLVD. FORJADORES DE SUDCALIFORNIA S/N, PLAZA LA PAZ",CENTRO,(612)1243902,,Baja California Sur,La Paz,23000.0,Profeco_030301_tiendas,data20220622
38,23036,FARMACON SUCURSAL PASEO LA PAZ,BLVD. AGUSTIN OLACHEA 1515,SAN ANTONIO EL ZACATAL,(612)1240847,,Baja California Sur,La Paz,23090.0,Profeco_030301_tiendas,data20220622
39,23120,FARMACIAS ESPECIALIZADAS,"NICOLAS BRAVO 215, ESQ. REVOLUCION",CENTRO,(612)1289927,,Baja California Sur,La Paz,23000.0,Profeco_030301_tiendas,data20220622
40,23034,SEARS SUCURSAL LA PAZ,"BLVD. FORJADORES DE SUDCALIFORNIA S/N, PLAZA LA PAZ",EX BASE AEREA,(612)1259373,,Baja California Sur,La Paz,23050.0,Profeco_030301_tiendas,data20220622
41,23070,TORTILLERIA LA PAZ,"REVOLUCION S/N, ESQ. SINALOA",PUEBLO NUEVO,(612)1223677,,Baja California Sur,La Paz,23060.0,Profeco_030301_tiendas,data20220622
42,23057,TORTILLERIA PROMASA,"AQUILES SERDAN S/N, ENTRE BRAVO Y OCAMPO",CENTRO,(612)3488040,,Baja California Sur,La Paz,23000.0,Profeco_030301_tiendas,data20220622
43,23002,SORIANA HIPER SUCURSAL LA PAZ BC,"FORJADORES DE SUD CALIFORNIA NO 4390, ESQ. LUIS DONALDO",CENTRO,(612)1214772,,Baja California Sur,La Paz,23000.0,Profeco_030301_tiendas,data20220622
44,23067,TORTILLERIA GUAYCURA,"MARQUEZ DE LEON S/N, ESQ. HEROES DE INDEPENDENCIA",CENTRO,(612)1285015,,Baja California Sur,La Paz,23000.0,Profeco_030301_tiendas,data20220622
45,23024,PAPELERIA BAJA CALIFORNIA SUCURSAL ALTAMIRANO,"ALTAMIRANO 2725, ENTRE 5 DE FEBRERO Y NAVARRO",CENTRO,(612)1257585,,Baja California Sur,La Paz,23000.0,Profeco_030301_tiendas,data20220622
46,23020,CHEDRAUI SUCURSAL LA PAZ COLIMA,"MADERO S-N, ENTRE COLIMA Y ABASOLO",PUEBLO NUEVO,(612)1462270,,Baja California Sur,La Paz,23060.0,Profeco_030301_tiendas,data20220622
47,23151,DISTRIBUIDORA DE PAPELERÍAS EL MUELLE,"LIC. PRIMO VERDAD 995, ESQ. JALISCO",PUEBLO NUEVO,(612)1221744,,Baja California Sur,La Paz,23060.0,Profeco_030301_tiendas,data20220622
48,23064,TORTILLERIA ESPERANZA,"GOMEZ FARIAS 5030, ESQ. AZTECAS",PUESTA DEL SOL,(612)1461220,,Baja California Sur,La Paz,23090.0,Profeco_030301_tiendas,data20220622
49,23060,TORTILLERIA Y MINISUPER LAS GARZAS,"BLVD. FRANCISCO J MUJICA 194, ENTRE MISIONEROS COMBONIA",INDECO,(612)1220674,,Baja California Sur,La Paz,23070.0,Profeco_030301_tiendas,data20220622
50,23042,FARMACIAS SIMILARES,"DE LOS DEPORTISTAS 78-B, FRENTE A HOSPITAL SALVATIERRA",8 DE OCTUBRE 1A. SECCION,,,Baja California Sur,La Paz,23085.0,Profeco_030301_tiendas,data20220622
51,23032,ELEKTRA SUCURSAL LA PAZ,"BLVD. FORJADORES DE SUDCALIFORNIA S/N, ESQ. DURANGO",ADOLFO RUIZ CORTINEZ,(612)1509803,,Baja California Sur,La Paz,23040.0,Profeco_030301_tiendas,data20220622
52,23149,FARMACIA GUADALAJARA,"AQUILES SERDAN 2395, ESQ. MARQUEZ DE LEON",CENTRO,(612)1232591,,Baja California Sur,La Paz,23000.0,Profeco_030301_tiendas,data20220622
53,23122,OXXO SUCURSAL COLIMA,"COLIMA 295, ESQ. AQUILES SERDAN",JARDINES DE LA PAZ,,,Baja California Sur,La Paz,23090.0,Profeco_030301_tiendas,data20220622
54,23065,TORTILLERIA DOÑA ESTHELA,"TORONJA S/N, ENTRE PAPAYA Y MANDARINA",INDECO,(662)1220338,,Baja California Sur,La Paz,23070.0,Profeco_030301_tiendas,data20220622
55,23048,MERCADO FRANCISCO I. MADERO,"REVOLUCION S/N, ENTRE OCAMPO Y DEGOLLADO",CENTRO,(612)1220135,,Baja California Sur,La Paz,23000.0,Profeco_030301_tiendas,data20220622
56,23033,LIVERPOOL SUCURSAL LA PAZ,"AGUSTIN OLACHEA LT. 7 Y 8 S/N, PLAZA THE SHOPPES AT LA",FIDEPAZ,(612)1751000,,Baja California Sur,La Paz,23090.0,Profeco_030301_tiendas,data20220622
57,23152,MINISUPER Y TORTILLERIA COLOSIO,"BOULEVARD COLOSIO SIN NUMERO, ENTRE IGNACIO RAMÍREZ E I",AGENCIA PUEBLO NUEVO,6122025209,,Baja California Sur,La Paz,23060.0,Profeco_030301_tiendas,data20220622
58,23123,FARMACIA EMERGENCIAS SUCURSAL SALVATIERRA,"DE LOS DEPORTISTAS S/N, ENTRE SIERRA DE LA VICTORIA Y B",8 DE OCTUBRE,(612)1212469,,Baja California Sur,La Paz,23080.0,Profeco_030301_tiendas,data20220622
59,23008,WALMART SUCURSAL COLA DE BALLENA,"AGUSTIN OLACHEA S/N, ENTRE CTRA. TRANSPENINSULAR Y LIBR",EL ZACATAL,(612)1242314,,Baja California Sur,La Paz,23088.0,Profeco_030301_tiendas,data20220622
60,24026,TORTILLERIA FLORES,"CALLE 2 S/N, ENTRE CALLE 11 Y CALLE 12",SAMULA,,,Campeche,Campeche,24090.0,Profeco_040401_tiendas,data20220622
61,24004,WALMART SUCURSAL CAMPECHE,"MARIA LAVALLE URBINA, ENTRE JOAQUIN CLAUSEL Y RICARDO C",AH KIN PEACH,(981)8117516,,Campeche,Campeche,24014.0,Profeco_040401_tiendas,data20220622
62,24036,TORTILLERIA PINZON,"RIVAPALACIOS. 51, ENTRE CALLE 16 Y CALLE 14",SAN FRANCISCO,,,Campeche,Campeche,24050.0,Profeco_040401_tiendas,data20220622
63,24102,MERCADO DE SAMULA,"CALLE 19 S/N, ESQ. CALLE 8",SAMULA,NO TIENE,,Campeche,Campeche,24090.0,Profeco_040401_tiendas,data20220622
64,24085,SORIANA EXPRESS SUCURSAL CAMPECHE,"AGUSTÍN MELGAR S/N, ESQ. LÓPEZ PORTILLO (INTERIOR PLAZA",BOSQUES DE CAMPECHE,(981)8112597,,Campeche,Campeche,24030.0,Profeco_040401_tiendas,data20220622
65,24101,MERCADO DE SAN FRANCISCO,"CALLE 10 NO. 72, ESQ. CALLE 39 A",BARRIO DE SAN FRANCISCO,NO TIENE,,Campeche,Campeche,24010.0,Profeco_040401_tiendas,data20220622
66,24001,CHEDRAUI SUCURSAL CAMPECHE,"GOBERNADORES 418, ENTRE VENEZUELA Y ARGENTINA",SANTA ANA,(981)8165631,,Campeche,Campeche,24050.0,Profeco_040401_tiendas,data20220622
67,24023,TORTILLERIA BELEN,"QUERETARO 137, ESQ. NICARAGUA",SANTA ANA,,,Campeche,Campeche,24040.0,Profeco_040401_tiendas,data20220622
68,24039,LIVERPOOL SUCURSAL CAMPECHE,"PEDRO SAINZ DE BARANDA 139, ESQ. DARSENA",CENTRO,(981)8181300,,Campeche,Campeche,24400.0,Profeco_040401_tiendas,data20220622
69,24107,FARMACIAS GUADALAJARA SUCURSAL CASA DE JUSTICIA,"PATRICIO TRUEBA Y REGIL 312, ENTRE PRIVADA PATRICIO TRU",SAN RAFAEL,9818139878,,Campeche,Campeche,24090.0,Profeco_040401_tiendas,data20220622
70,24110,TORTILLERIA MELKEN,"CALLE 10 NÚMERO. 171-A, ENTRE CALLE 45 Y ROSALES",SAN FRANCISCO,,,Campeche,Campeche,24010.0,Profeco_040401_tiendas,data20220622
71,24025,TORTILLERIA LA LUPITA,"CALLE 7-A S/N, ENTRE CALLE 6 Y CALLE 4",SAMULA,,,Campeche,Campeche,24090.0,Profeco_040401_tiendas,data20220622
72,24035,TORTILLERIA MONTECRISTO,"MONTECRISTO 20, ESQ. CALLE 16",SANTA ANA,,,Campeche,Campeche,24040.0,Profeco_040401_tiendas,data20220622
73,24103,MERCADO EJIDAL,"QUERETARO S/N, ENTRE REPUBLICA DEL SALVADOR Y AVENIDA C",SANTA ANA,NO TEINE,,Campeche,Campeche,24050.0,Profeco_040401_tiendas,data20220622
74,24002,MEGA SORIANA SUCURSAL CAMPECHE CENTRAL 971,"AVENIDA CENTRAL 91, ENTRE REPUBLICA DEL SALVADOR Y CENT",SANTA ANA,(981)8117514,,Campeche,Campeche,24050.0,Profeco_040401_tiendas,data20220622
75,24045,PAPELERIA COPACA SUCURSAL CENTRO,"CALLE 51 NO. 13, ESQ. CALLE 10",CENTRO,,,Campeche,Campeche,24000.0,Profeco_040401_tiendas,data20220622
76,24013,ULTRAHOGAR SUCURSAL CAMPECHE,"CALLE 10 NO. 300, ENTRE CALLE 53 Y CALLE 51",CENTRO,(981)8114404,,Campeche,Campeche,24000.0,Profeco_040401_tiendas,data20220622
77,24042,FARMACIA BAZAR,"AVENIDA CENTRAL 63, ENTRE TRUJANO Y PRIV. DEL SALVADOR",CENTRO,(981)8117441,,Campeche,Campeche,24000.0,Profeco_040401_tiendas,data20220622
78,24024,TORTILLERIA EL PEDREGAL,"LOPEZ PORTILLO 16 A, ENTRE EL DUQUE Y CALLE 2",LOMAS DE PEDREGAL,,,Campeche,Campeche,24035.0,Profeco_040401_tiendas,data20220622
79,24017,OFFICE DEPOT SUCURSAL CAMPECHE (412),"LAVALLE URBINA 19, ENTRE JOAQUIN CLAUSEL Y ROMAN PIÑA C",SECTORES FUNDADORES,(981)8164051,,Campeche,Campeche,24080.0,Profeco_040401_tiendas,data20220622
80,24108,COPPEL SUCURSAL SELEM,"CALLE 12 <hash>157, ENTRE CALLE 57 Y 55",CENTRO,,,Campeche,Campeche,24000.0,Profeco_040401_tiendas,data20220622
81,24032,TORTILLERIA LA ROSITA,"CALLE 14 NO. 274 F, ENTRE ABASOLO Y VICTORIA",SAN ROMAN,,,Campeche,Campeche,24040.0,Profeco_040401_tiendas,data20220622
82,24028,TORTILLERIA LA AVENTURERA,"PEDRO MORENO 164, ENTRE ESPERANZA Y VICENTE GUERRERO",SAN RAFAEL,,,Campeche,Campeche,24090.0,Profeco_040401_tiendas,data20220622
83,24038,MERCADO PRINCIPAL PEDRO SAINZ DE BARANDA,"CIRCUITO BALUARTE S/N, ENTRE TABASCO Y COSTA RICA",CENTRO,,,Campeche,Campeche,24000.0,Profeco_040401_tiendas,data20220622
84,24021,TORTILLERIA ALEX,"CALLE 6 NO. 403, ENTRE LOPEZ PORTILLO Y ALLENDE",SAN RAFAEL,,,Campeche,Campeche,24090.0,Profeco_040401_tiendas,data20220622
85,24046,PAPELERIA SAN MARTIN,"CALLE 10. 283, ENTRE 51 Y 53",CENTRO,9818162780,,Campeche,Campeche,24000.0,Profeco_040401_tiendas,data20220622
86,24104,MERCADO DE SAN ROMAN,"CALLE 14 S/N, ESQ. PROLONGACION ALLENDE",BARRIO DE SAN ROMAN,NO TIENE,,Campeche,Campeche,24040.0,Profeco_040401_tiendas,data20220622
87,24105,ELEKTRA SUCURSAL MEGA CAMPECHE,"CALLE 49 O CIRCUITO BALUARTES 56, ENTRE 51 Y CIRCUITO B",CENTRO,98111002,,Campeche,Campeche,24000.0,Profeco_040401_tiendas,data20220622
88,24033,TORTILLERIA LA SOMBRILLA SUCURSAL CAMPECHE,"CALLE 18 NO. 99, DEPARTAMENTO 14 BAZAR SELEM",SANTA ANA,,,Campeche,Campeche,24050.0,Profeco_040401_tiendas,data20220622
89,24016,FARMACIAS YZA SUCURSAL COLOSIO,"COLOSIO 321, ESQ. PROLONGACION ALLENDE",SAN RAFAEL,(981)1281166,,Campeche,Campeche,24001.0,Profeco_040401_tiendas,data20220622
90,24044,FARMACIAS SIMILARES SUCURSAL CAMPECHE 7,"AVENIDA CENTRAL 58, ENTRE MARIANO RODRIGUEZ Y JOSE ANTO",SAN JOSE,(981)8169166,,Campeche,Campeche,24040.0,Profeco_040401_tiendas,data20220622
91,24083,FARMACIA CANTO SUCURSAL ALAMEDA,"TABASCO S/N LOC. 11, ENTRE CHIHUAHUA Y CTO. BALUARTE (F",SANTA ANA,(981)8163170,,Campeche,Campeche,24050.0,Profeco_040401_tiendas,data20220622
92,24037,OXXO SUCURSAL CATASTRO,"CALLE 51 NO. 1, ESQ. ADOLFO RUIZ CORTINEZ",CENTRO,,,Campeche,Campeche,24000.0,Profeco_040401_tiendas,data20220622
93,24109,FARMACIA BAZAR SUCURSAL LOPEZ MATEOS,"AV LOPEZ MATEOS 374, ENTRE LAZARETO Y MONTECRISTO",PRADO,,,Campeche,Campeche,24030.0,Profeco_040401_tiendas,data20220622
94,24022,TORTILLERIA ARROLLO,"CALLE 10 S/N, ESQ. CALLE 12, INT.MERCADO SAN FRANCISCO",SAN FRANCISCO,,,Campeche,Campeche,24010.0,Profeco_040401_tiendas,data20220622
95,24040,COPPEL SUCURSAL SAN RAFAEL,"PATRICIO TRUEBA 306, ENTRE VICENTE GUERRERO Y CALLE 6",SAN RAFAEL,(981)8125039,,Campeche,Campeche,24090.0,Profeco_040401_tiendas,data20220622
96,24000,BODEGA AURRERA SUCURSAL PATRICIO TRUEBA,"PATRICIO TRUEBA DE REGIL 189, ENTRE NIEBLA Y CASA DE JU",FRACCIORAMA 2000,,,Campeche,Campeche,24090.0,Profeco_040401_tiendas,data20220622
97,25061,OFFICE DEPOT SUCURSAL SALTILLO,"LUIS ECHEVERRIA 1032, ESQ. MARIANO ABASOLO",GUANAJUATO,(844)4152032,,Coahuila,Saltillo,25280.0,Profeco_050501_tiendas,data20220622
98,25304,TORTILLERIA LA ESPIGA,"LOMA DE LAS PALOMAS 112, ESQ. BLVD. OTILIO GONZALEZ",LOMAS DE SAN JAVIER,(844)1011741,,Coahuila,Saltillo,25057.0,Profeco_050501_tiendas,data20220622
99,25181,COPPEL SUCURSAL SENDERO,"EULALIO GUTIERREZ 365, ESQ. VALDEZ SANCHEZ PLAZA SENDER",EX HACIENDA LOS CERRITOS,(844)4318266,,Coahuila,Saltillo,25010.0,Profeco_050501_tiendas,data20220622
100,25005,H E B SUCURSAL SALTILLO REPUBLICA,BLVD. LUIS ECHEVERRIA 851 CASI ESQ. BLVD. DE LOS FUNDAD,REPUBLICA NORTE,(844)4168371,,Coahuila,Saltillo,25280.0,Profeco_050501_tiendas,data20220622
101,25074,TORTILLERIA EL METATE,"RAMON CORONA 728, ESQ. FRANCISCO DE URDIÑOLA",CENTRO,(844)4105116,,Coahuila,Saltillo,25000.0,Profeco_050501_tiendas,data20220622
102,29025,SANBORN S,"BELISARIO DOMINGUEZ 1861, ENTRE LOS TUCANES Y CIRO FARR",BUGAMBILIAS,(961)6153397,,Chiapas,Tuxtla Gutiérrez,29020.0,Profeco_070701_tiendas,data20220622
103,29009,SORIANA HIPER SUCURSAL POLIFORUM,"BLVD ANDRES SERRA ROJAS <hash>250, ENTRE BLVD ANGEL ALBINO C",EL RETIRO,(961)6142574,,Chiapas,Tuxtla Gutiérrez,29040.0,Profeco_070701_tiendas,data20220622
104,29004,WALMART SUCURSAL BLVD. BELISARIO,"BLVD. BELISARIO DOMINGUEZ 2058, ENTRE 19A PONIENTE Y 20",FRACCIONAMIENTO ARBOLEDAS,(961)1215537,,Chiapas,Tuxtla Gutiérrez,29030.0,Profeco_070701_tiendas,data20220622
105,29000,BODEGA AURRERA,"CENTRAL PONIENTE 677, ENTRE 6A PONIENTE Y 5 PONIENTE",EL CERRITO,,,Chiapas,Tuxtla Gutiérrez,29066.0,Profeco_070701_tiendas,data20220622
106,29133,TORTILLERIA AMBAR,"DOCEAVA AVENIDA NORTE OTE. 677, ENTRE CALLE 5A. OTE. NO",CENTRO,NO TIENE,,Chiapas,Tuxtla Gutiérrez,29000.0,Profeco_070701_tiendas,data20220622
107,29148,TORTILLERIA LA SUPERIOR,"AV. 20 DE NOVIEMBRE 360, ENTRE RIO AGUA AZUL Y RIO SANT",ALBANIA BAJA,,,Chiapas,Tuxtla Gutiérrez,29010.0,Profeco_070701_tiendas,data20220622
108,29130,MERCADO SAN JUAN,"EL PENSIL S/N, CASI ESQ. AV. JUAN SABINES GUTIERREZ",LOS CHOFERES,,,Chiapas,Tuxtla Gutiérrez,29078.0,Profeco_070701_tiendas,data20220622
109,29021,COPPEL SUCURSAL NORTE,"AVENIDA 5 NORTE PTE. 2650, ENTRE 5 NORTE Y RIO SABINAL",LOS CAFETALES,(961)1251716,,Chiapas,Tuxtla Gutiérrez,29060.0,Profeco_070701_tiendas,data20220622
110,29022,ELEKTRA SUCURSAL ORIENTE,"BELISARIO DOMINGUEZ 991, ENTRE LAS PALMAS Y RODULFO FIG",LAS PALMAS,(961)6191292,,Chiapas,Tuxtla Gutiérrez,29040.0,Profeco_070701_tiendas,data20220622
111,29066,MERCADO PUBLICO 5 DE MAYO,"CALLE 4 NORTE S/N, ENTRE CALLE 11 PONIENTE Y CALLE 12",HIDALGO,(961)6124674,,Chiapas,Tuxtla Gutiérrez,29040.0,Profeco_070701_tiendas,data20220622
112,29026,OFFICE DEPOT SUCURSAL ORIENTE,"ANDRES SERRA ROJAS 151, ENTRE B. DOMINGUEZ Y LIBRAMIENT",CASTILLO TIELMANS,(961)6144588,,Chiapas,Tuxtla Gutiérrez,29070.0,Profeco_070701_tiendas,data20220622
113,29149,TORTILLERIA LAS DELICIAS,"CALLE 5A ORIENTE 1390, AV. 12 NORTE ORIENTE Y AV. 13 NO",LA PIMIENTA,,,Chiapas,Tuxtla Gutiérrez,29034.0,Profeco_070701_tiendas,data20220622
114,29003,SORIANA HIPER SUCURSAL SOL TUXTLA GUTIERREZ,"5A NORTE PONIENTE 2650, ESQ. LIBRAMIENTO NORTE",1o. DE MAYO,(961)1251641,,Chiapas,Tuxtla Gutiérrez,29000.0,Profeco_070701_tiendas,data20220622
115,29033,TORTILLERIA ALBANIA,"RIO FRIO 1076, ENTRE 20 DE NOVIEMBRE Y RIO OCOTLA",ALBANIA ALTA,,,Chiapas,Tuxtla Gutiérrez,29010.0,Profeco_070701_tiendas,data20220622
116,29145,FARMACIA DEL AHORRO,"BLVD. BELISARIO DOMINGUEZ 2775, ESQ. PROL. BUGAMBILIAS",CENTRO,(961)6026677,,Chiapas,Tuxtla Gutiérrez,29000.0,Profeco_070701_tiendas,data20220622
117,29134,TORTILLERIA HECTOR,"PRESA CECILIO DEL VALLE S/N, ESQ. PRESA TINGAMBATO",LAS PALMAS,NO TIENE,,Chiapas,Tuxtla Gutiérrez,29040.0,Profeco_070701_tiendas,data20220622
118,29135,TORTILLERIA SAN PABLO,"LAS PALMAS 507, CASI ESQ. PALMA CAMEDOR",LAS PALMAS,,,Chiapas,Tuxtla Gutiérrez,29040.0,Profeco_070701_tiendas,data20220622
119,29146,FARMACIA GUADALAJARA,"BLVD BELISARIO DOMINGUEZ 2040 , ENTRE LAURELES Y PRIMAV",JARDINES DE TUXTLA,,,Chiapas,Tuxtla Gutiérrez,29020.0,Profeco_070701_tiendas,data20220622
120,29136,MERCADO DE LOS ANCIANOS,"13 OTE SUR L 1067, ENTRE 8A Y 9A SUR",BARRIO SANTA CRUZ,,,Chiapas,Tuxtla Gutiérrez,29019.0,Profeco_070701_tiendas,data20220622
121,29124,TORTILLERIA LA MICHOACANA SUCURSAL II,"CALLE 2 PONIENTE NTE. 1452, ENTRE CALLE 15 NORTE PTE. Y",CENTRO,,,Chiapas,Tuxtla Gutiérrez,29000.0,Profeco_070701_tiendas,data20220622
122,29150,TORTILLERIA LOS CORRIDOS,"AV. 20 DE NOVIEMBRE S/N, ESQ. CALLE FRANCES",ALBANIA BAJA,,,Chiapas,Tuxtla Gutiérrez,29010.0,Profeco_070701_tiendas,data20220622
123,29001,CHEDRAUI SUCURSAL TUXTLA CRYSTAL,"BELISARIO DOMINGUEZ 1691, ENTRE BUGAMBILIAS Y CIRO FERR",TERAN,(961)6150030,,Chiapas,Tuxtla Gutiérrez,29000.0,Profeco_070701_tiendas,data20220622
124,29027,OFFICE MAX,"AVENIDA 5A NORTE PTE. 2651, ESQ. RIO SABINAL",LAS BRISAS,(961)1251891,,Chiapas,Tuxtla Gutiérrez,29030.0,Profeco_070701_tiendas,data20220622
125,29016,OXXO SUCURSAL ORIENTE,"CARR. PANAMERICANA 1901, ENTRE GPE. VICTORIA Y VICENTE",CASTILLO TIELMANS,(961)2543629,,Chiapas,Tuxtla Gutiérrez,29070.0,Profeco_070701_tiendas,data20220622
126,29068,COPPEL SUCURSAL CENTRO,"AVENIDA CENTRAL 432, ENTRE CALLE 3 PONIENTE Y CALLE 4 P",CENTRO,(961)6114697,,Chiapas,Tuxtla Gutiérrez,29000.0,Profeco_070701_tiendas,data20220622
127,31030,ALSUPER STORE SUCURSAL INDEPENDENCIA,"BLVD. JOSE FUENTES MARES 200, ESQ. INDEPENDENCIA",SANTA ROSA,(614)4202869,,Chihuahua,Chihuahua,31030.0,Profeco_080801_tiendas,data20220622
128,31009,WALMART SUCURSAL FUENTES MARES,"BLVD. JOSE FUENTES MARES 8820, ENTRE T. ORTEGA Y FRANCI",SECTOR RELOJ,(614)4989083,,Chihuahua,Chihuahua,31064.0,Profeco_080801_tiendas,data20220622
129,31004,S MART SUCURSAL FUENTES MARES,"PACHECO 1901, ENTRE BLVD. JOSE FUENTES MARES Y JUAN PAB",FRACCIONAMIENTO EL MARMOL,(614)4351168,,Chihuahua,Chihuahua,31072.0,Profeco_080801_tiendas,data20220622
130,31002,MERCADO SORIANA SUCURSAL LA SIERRA,"CALZ. SILVESTRE TERRAZAS 9001, ENTRE 24 DE FEBRERO Y P.",RAMON REYES,(614)4189698,,Chihuahua,Chihuahua,31410.0,Profeco_080801_tiendas,data20220622
131,31172,FARMACIA GUADALAJARA SUCURSAL CLOUTHIER,"MANUEL J. CLOUTHIER 9082, ESQ. MAMEY",EL GRANJERO,(656)6798882,,Chihuahua,JUÁREZ,32690.0,Profeco_080802_tiendas,data20220622
132,31081,FARMACIA BENAVIDES SUCURSAL JUAREZ,"PLUTARCO ELIAS CALLES S/N, ESQ. 21 DE MARZO",LOS NOGALES,(656)6203104,,Chihuahua,JUÁREZ,32350.0,Profeco_080802_tiendas,data20220622
133,31085,OFFICE DEPOT SUCURSAL EJERCITO,"EJERCITO NACIONAL 2926, ESQ. RANCHO CALIENTE",PARTIDO IGLESIAS,(656)6239505,,Chihuahua,JUÁREZ,32528.0,Profeco_080802_tiendas,data20220622
134,31122,SANBORNS SUCURSAL MISIONES,"BLVD. TEOFILO BORUNDA 8681, INT. CENTRO COMERCIAL LAS M",PARTIDO IGLESIAS,(656)6482181,,Chihuahua,JUÁREZ,32618.0,Profeco_080802_tiendas,data20220622
135,31077,ELEKTRA SUCURSAL JILOTEPEC,"MANUEL J. CLOUTHIER 7822, INT. SUPERMERCADO GONZALEZ JI",FRACCIONAMIENTO AMPLIACION AEROPUERTO,(656)6201943,,Chihuahua,JUÁREZ,32000.0,Profeco_080802_tiendas,data20220622
136,31193,FARMACIA FARMALIVIO SUCURSAL RAZA,"DE LA RAZA 4946, ESQ. NOGALES",EL COLEGIO,(656)6237781,,Chihuahua,JUÁREZ,32340.0,Profeco_080802_tiendas,data20220622
137,31072,LIVERPOOL SUCURSAL MISIONES,"BLVD. TEOFILO BORUNDA 8681, INT. CENTRO COMERCIAL LAS M",PARTIDO IGLESIAS,(656)2272400,,Chihuahua,JUÁREZ,32618.0,Profeco_080802_tiendas,data20220622
138,31125,PAPELERIA DEL NORTE,"PASEO DE LA VICTORIA 2904, ENTRE E. NACIONAL Y BLVD. GO",PARTIDO SENECU,(656)6482910,,Chihuahua,JUÁREZ,32459.0,Profeco_080802_tiendas,data20220622
139,31144,TORTILLERIA ROSARITO,"IZTACCIHUATL 5591, ESQ. IZCOATL",FRACCIONAMIENTO DEL REAL,(656)4070630,,Chihuahua,JUÁREZ,32660.0,Profeco_080802_tiendas,data20220622
140,31071,MERCADO AEROPUERTO,"AERONAUTICA 6910, ESQ. PANAMERICANA",JARDINES DEL AEROPUERTO,(656)6292944,,Chihuahua,JUÁREZ,32695.0,Profeco_080802_tiendas,data20220622
141,31190,FARMACIAS DEL AHORRO SUCUERSALPRADERA DORADA,"EJERCITO NACIONAL 7250, ENTRE RANCHIO SAN VALENTIN Y RA",PRADERA DORADA,6142809587,,Chihuahua,JUÁREZ,32618.0,Profeco_080802_tiendas,data20220622
142,31075,COPPEL SUCURSAL LOPEZ,"LOPEZ MATEOS 2125, INT. SMART LOPEZ MATEOS",REFORMA,(656)6115407,,Chihuahua,JUÁREZ,32390.0,Profeco_080802_tiendas,data20220622
143,31118,SEARS SUCURSAL MISIONES,"BLVD. TEOFILO BORUNDA 8681, INT. CENTRO COMERCIAL LAS M",PARTIDO IGLESIAS,(656)6880856,,Chihuahua,JUÁREZ,32618.0,Profeco_080802_tiendas,data20220622
144,31137,TORTILLERIA LA MILPA,"BLVD. GOMEZ MORIN 8431, ENTRE SAN ANTONIO Y PRIV. DE PO",PARTIDO SENECU,(656)6173417,,Chihuahua,JUÁREZ,32459.0,Profeco_080802_tiendas,data20220622
145,31194,TORTILLERIA CEILAN,"GRANJERO 7629, ENTRE CEILAN Y EGIPTO",OASIS,(656)5553321,,Chihuahua,JUÁREZ,32697.0,Profeco_080802_tiendas,data20220622
