,# codigo,nombre,direccion,colonia,telefono,telefono2,estado,minicipio,codigopostal,profeco_tiendas_id,folder_id
728,78016,FARMACIA BENAVIDES SUCURSAL LOMAS,"HIMALAYA 500, ESQ. COORDILLERA ARAKAN",LOMAS 4A SECCION,(444)8253904,,San Luis Potosí,San Luis Potosí,78216.0,Profeco_242401_tiendas,data20220712
729,78095,FARMACIA GUADALAJARA SUCURSAL CARRANZA,MARIANO OTERO 600. ESQ. VENUSTIANO CARRANZA,TEQUISQUIAPAN,4448332077,,San Luis Potosí,San Luis Potosí,78230.0,Profeco_242401_tiendas,data20220712
730,78011,ELEKTRA SUCURSAL OBREGON,"ALVARO OBREGON 430, ENTRE IGNACIO ALDAMA Y ALLENDE",CENTRO,(444)8471926,,San Luis Potosí,San Luis Potosí,78000.0,Profeco_242401_tiendas,data20220712
731,78050,OFFICE DEPOT SUCURSAL NEREO,"NEREO RODRIGUEZ BARRAGAN 1350, ESQ. DEL PARQUE",DEL PARQUE,(444)8139279,,San Luis Potosí,San Luis Potosí,78220.0,Profeco_242401_tiendas,data20220712
732,78005,WALMART SUCURSAL SAN LUIS POTOSI,"SALVADOR NAVA 3135, ESQ. PARQUE CHAPULTEPEC",COLINAS DEL PARQUE,018009678337,,San Luis Potosí,San Luis Potosí,78110.0,Profeco_242401_tiendas,data20220712
733,78076,EL GRAN ZAPATERO DE LEON SUCURSAL TIENDA 7,"HIDALGO 355, ENTRE GUAJARDO Y JULIAN DE LOS REYES",CENTRO,(444)8123379,,San Luis Potosí,San Luis Potosí,78000.0,Profeco_242401_tiendas,data20220712
734,78096,PAPELERIA MUSA SUCURSAL SAN LUIS POTOSI,"MARIANO ARISTA 320, ENTRE INDEPENDENCIA Y DAMIAN CARMON",CENTRO,(444)8142972,,San Luis Potosí,San Luis Potosí,78000.0,Profeco_242401_tiendas,data20220712
735,78088,TORTILLERIA LA INMACULADA,"MOCTEZUMA 260 INT. C, ENTRE PEDRO MONTOYA Y REFORMA",CENTRO,(444)8124566,,San Luis Potosí,San Luis Potosí,78000.0,Profeco_242401_tiendas,data20220712
736,78064,TORTILLERIA PREMIUM,"GACIA DIEGO 400, ESQ. MARIANO AVILA",VALLE DE TEQUIS,(444)1660492,,San Luis Potosí,San Luis Potosí,78230.0,Profeco_242401_tiendas,data20220712
737,78085,TORTILLERIA LA INMACULADA,"PEDRO MONTOYA 300, ESQ. 16 DE SEPTIEMBRE",CENTRO,(444)8084594,,San Luis Potosí,San Luis Potosí,78000.0,Profeco_242401_tiendas,data20220712
738,78010,MERCADO HIDALGO,"HIDALGO S/N, ESQ. MIER Y TERAN",CENTRO,(444)8121494,,San Luis Potosí,San Luis Potosí,78000.0,Profeco_242401_tiendas,data20220712
739,78053,TORTILLERIA SAN LUIS,"ALHONDIGA 15, ESQ. SAN LUIS",CENTRO,(444)1284583,,San Luis Potosí,San Luis Potosí,78000.0,Profeco_242401_tiendas,data20220712
740,78002,CHEDRAUI SUCURSAL SAN LUIS POTOSI,"NEREO RODRIGUEZ BARRAGAN 450, ESQ. BARRIO DE TLXCALA",DEL VALLE,(444)8332188,,San Luis Potosí,San Luis Potosí,78206.0,Profeco_242401_tiendas,data20220712
741,78091,SORIANA SUCURSAL TANGAMANGA (193),"MANUEL J. CLOUTHIER 229, INT. PLAZA TANGAMANGA",TANGAMANGA,(444)1623116,,San Luis Potosí,San Luis Potosí,78269.0,Profeco_242401_tiendas,data20220712
742,78021,SANBORNS SUCURSAL EL DORADO SAN LUIS POTOSI,"NEREO RODRIGUEZ BARRAGAN 450, INT. PLAZA EL DORADO",DEL VALLE,(444)8330799,,San Luis Potosí,San Luis Potosí,78200.0,Profeco_242401_tiendas,data20220712
743,78060,TORTILLERIA BONITA,"SANTOS DEGOLLADO 1250, ENTRE HIMNO NACIONAL Y ECONOMIA",BUROCRATAS,(444)8333355,,San Luis Potosí,San Luis Potosí,78270.0,Profeco_242401_tiendas,data20220712
744,78031,FARMACIAS SIMILARES SUCURSAL 1373,"SANTOS DEGOLLADO 769 LOC. E, ESQ. ZENON FERNANDEZ",JARDINES DEL ESTADIO,(444)8084456,,San Luis Potosí,San Luis Potosí,78280.0,Profeco_242401_tiendas,data20220712
745,78089,TORTILLERIA TORTIHOGAR,"PEDRO MONTOYA 418, ENTRE EJE VIAL PONCIANO ARRIAGA Y 16",CENTRO,,,San Luis Potosí,San Luis Potosí,78000.0,Profeco_242401_tiendas,data20220712
746,80265,FARMACIA GUADALAJARA SUCURSAL 635,"BLVD. ENRIQUE SÁNCHEZ 2202, ENTRE RUFINO TAMAYO Y DAVID",DESARROLLO URBANO TRES RIOS,(667)1466260,(667)1466256,Sinaloa,Culiacán,80020.0,Profeco_252501_tiendas,data20220712
747,80280,CARNICERIA KR,"CALLE TERCERA, MODULO P BOD. 19 Y 20, INTERIOR CENTRAL",MERCADO DE ABASTOS,NO TIENE,,Sinaloa,Culiacán,80299.0,Profeco_252501_tiendas,data20220712
748,80121,COPPEL SUCURSAL ESCOBEDO,"ESCOBEDO 190 PTE, ESQ. DOMINGO RUBI",CENTRO,(667)7153471,,Sinaloa,Culiacán,80000.0,Profeco_252501_tiendas,data20220712
749,80208,TORTILLERIA PILIS,"MADERO 520 PTE., ENTRE RIVA PALACIO Y DONATO GUERRA",CENTRO,,,Sinaloa,Culiacán,80000.0,Profeco_252501_tiendas,data20220712
750,80223,TORTILLERIA MAZORCA DE ORO,"BLVD. ENRIQUE CABRERA 3035, FRENTE A IMSS HUMAYA",INFONAVIT HUMAYA,(667)7502215,,Sinaloa,Culiacán,80020.0,Profeco_252501_tiendas,data20220712
751,80001,LEY,"TEOFILO NORIS 1421, FRENTE A PLAZA FORUM",DESARROLLO URBANO TRES RÍOS,(667)7165779,,Sinaloa,Culiacán,80020.0,Profeco_252501_tiendas,data20220712
752,80010,MERCADO RAFAEL BUELNA,"HIDALGO S/N ,ESQ. GRANADOS",CENTRO,,,Sinaloa,Culiacán,80000.0,Profeco_252501_tiendas,data20220712
753,80281,POLLERIA PILGRIMS,"CALLE TERCERA 2272, INTERIOR CENTRAL DE ABASTOS",MERCADO DE ABASTOS,,,Sinaloa,Culiacán,80299.0,Profeco_252501_tiendas,data20220712
754,80005,WAL MART,"REGIONAL 1330, ENTRE PROY. TRES RIOS",CENTRO,(667)7508160,,Sinaloa,Culiacán,80000.0,Profeco_252501_tiendas,data20220712
755,80226,TORTILLERIA ESTRELLA DE ORO,"JUAN JOSE RIOS <hash> 106 OTE., ENTRE PALIZA Y ANDRADE",MIGUEL ALEMAN,716-62-33,,Sinaloa,Culiacán,80200.0,Profeco_252501_tiendas,data20220712
756,80276,ABARROTES LA CUARTA SUCURSAL ABASTOS,"CALLE TERCERA 2821, INTERIOR CENTRAL DE ABASTOS",MERCADO DE ABASTOS,(667)7491813,,Sinaloa,Culiacán,80299.0,Profeco_252501_tiendas,data20220712
757,80277,GRANOS Y SEMILLAS TIRADO,"CALLE CUARTA, MODULO C LOC. 12 Y 13, INTERIOR CENTRAL D",MERCADO DE ABASTOS,(667)7182688,,Sinaloa,Culiacán,80299.0,Profeco_252501_tiendas,data20220712
758,80341,TORTILLERÍA GLORIA,"BLVD. ENRIQUE CABRERA 2348-C, ESQ. REP. DE HONDURAS",HUMAYA,,,Sinaloa,Culiacán,80240.0,Profeco_252501_tiendas,data20220712
759,80194,BODEGA AURRERA SUCURSAL ESTADIO,"BLVD. ENRIQUE SANCHEZ A. 402, FRENTE A GAS. JULIO CESAR",DESARROLLO URBANO TRES RIOS,(667)7126396,,Sinaloa,Culiacán,80030.0,Profeco_252501_tiendas,data20220712
760,80042,SORIANA HIPER SUCURSAL ZAPATA,"BLVD. EMILIANO ZAPATA S/N., ESQ. MANUEL J. CLOUTHIER",FRANCISCO VILLA,(667)7148626,,Sinaloa,Culiacán,80180.0,Profeco_252501_tiendas,data20220712
761,80283,MERCADO PLAZA ABASTOS HUMAYA,"ENRIQUE CABRERA S/N, ESQ. VILLA LOMBARDO TOLEDANO",INFONAVIT HUMAYA,,,Sinaloa,Culiacán,80020.0,Profeco_252501_tiendas,data20220712
762,80227,TORTILLERIA LA ESCONDIDA,"RUBI ESQ. ANGEL FLORES, MERCADO GARMENDIA LOCAL 37",CENTRO,(667)7139711,,Sinaloa,Culiacán,80000.0,Profeco_252501_tiendas,data20220712
763,80190,LIVERPOOL SUCURSAL CULIACAN,"BLVD. JOSE DIEGO VALADEZ 167 PTE., ENTRE PROYECTO TRES",DESARROLLO URBANO TRES RIOS,(667)7592800,,Sinaloa,Culiacán,80000.0,Profeco_252501_tiendas,data20220712
764,80275,CENTRAL DE ABASTOS,"CARRETERA INTERNACIONAL KM. 1, INTERIOR CENTRAL DE ABAS",MERCADO DE ABASTOS,,,Sinaloa,Culiacán,80299.0,Profeco_252501_tiendas,data20220712
765,80340,FARMACIA FARMACON SUCURSAL BONANZA,"BLVD. REPÚBLICA DE BRASIL 2113, ESQ. ENRIQUE FÉLIX CAST",HUMAYA,667 4553342,,Sinaloa,Culiacán,80020.0,Profeco_252501_tiendas,data20220712
766,80267,FARMACIA EMERGENCIAS SUCURSAL BUELNA,"RAFAEL BUELNA 27-1 OTE., ENTRE CARRASCO Y OBREGON",CENTRO,(667)7270105,,Sinaloa,Culiacán,80000.0,Profeco_252501_tiendas,data20220712
767,80278,CASA LEY MAYOREO ABASTOS SUCURSAL M45 MAYOREO ABASTOS,"CARRETERA INTERNACIONAL AL SUR KM. 3.5, INTERIOR CENTRA",MERCADO DE ABASTOS,(667)7182690,,Sinaloa,Culiacán,80299.0,Profeco_252501_tiendas,data20220712
768,80231,FARMACIA DURANGO,"FRANCISCO ZARCO Y RIO ZAUQUE 806, A MEDIA CUADRA DEL IS",ROSALES,(667)7150585,,Sinaloa,Culiacán,80049.0,Profeco_252501_tiendas,data20220712
769,80228,TORTILLERIA LA SUPERIOR <hash> 1,"EPITACIO OSUNA 144 PTE. , ESQ. NICOLAS BRAVO",JORGE ALMADA,(667)7130757,,Sinaloa,Culiacán,80200.0,Profeco_252501_tiendas,data20220712
770,80014,ELEKTRA,ANGEL FLORES 230,CENTRO,(667)125757,,Sinaloa,Culiacán,80000.0,Profeco_252501_tiendas,data20220712
771,80090,FAMSA SUCURSAL SORIANA,"BLVD. EMILIANO ZAPATA LOC. 6, 7 Y 8, ESQ. BAHIA DE OHUI",FRANCISCO VILLA,(667)7170190,(667)7170194,Sinaloa,Culiacán,80110.0,Profeco_252501_tiendas,data20220712
772,80191,SANBORNS SUCURSAL FORUM CULIACAN,"BLVD. JOSE DIEGO VALADEZ 167 ORIENTE, ENTRE PROYECTO TR",DESARROLLO URBANO TRES RIOS,(667)7166424,,Sinaloa,Culiacán,80000.0,Profeco_252501_tiendas,data20220712
773,80274,TORTILLERIA FAMILIAR,"MARIANO ESCOBEDO 578 PTE., ESQ. TEOFILO NORIS",CENTRO,6677132127,,Sinaloa,Culiacán,80000.0,Profeco_252501_tiendas,data20220712
774,80229,FARMACIAS SIMILARES SUCURSAL CULIACAN 12,"JUAN CARRASCO S/N LOC. 414-A, ENTRE HIDALGO Y ANGEL FLO",CENTRO,(667)7164977,,Sinaloa,Culiacán,80000.0,Profeco_252501_tiendas,data20220712
775,80008,MERCADO GARMENDIA,"DOMINGO RUBI S/N, ESQ. ANGELES FLORES",CENTRO,(667)7144115,,Sinaloa,Culiacán,80000.0,Profeco_252501_tiendas,data20220712
776,80220,TORTILLERIA LA PASADITA,"REPUBLICA DE BRASIL 1820, ENTRE INTERNACIONAL Y FELIX C",INFONAVIT HUMAYA,,,Sinaloa,Culiacán,80020.0,Profeco_252501_tiendas,data20220712
777,80219,TORTILLERIA DON VICENTE,"CALLE TIERRA Y ANDADOR TIERRA, ESQUINA PINTADO DE MINSA",INFONAVIT HUMAYA,(667)7506033,,Sinaloa,Culiacán,80020.0,Profeco_252501_tiendas,data20220712
778,80189,SEARS SUCURSAL FORUM CULIACAN,"BLVD. JOSE DIEGO VALADEZ 167 PTE., ENTRE PROYECTO TRES",DESARROLLO URBANO TRES RIOS,(667)7590221,,Sinaloa,Culiacán,80000.0,Profeco_252501_tiendas,data20220712
779,80279,CREMERIA EL CAMPERO,"CALLE TERCERA 1785 Y 1779, LOC. 7 AL 12, INTERIOR CENTR",MERCADO DE ABASTOS,,,Sinaloa,Culiacán,80299.0,Profeco_252501_tiendas,data20220712
780,80334,LEY EXPRESS SUCURSAL LOLA BELTRAN,"LOLA BELTRAN 2892, ENTRE CALLE VOLUNTAD Y CALLE MONTECA",JUNTAS DE HUMAYA,,,Sinaloa,Culiacán,80050.0,Profeco_252501_tiendas,data20220712
781,80225,MINISUPER Y TORTILLERIA ESTADIO,"ANDRADE 648 SUR, ENTRE CONSTITUCION Y AGUILAR BARRAZA",MIGUEL ALEMAN,(667)7166622,,Sinaloa,Culiacán,80200.0,Profeco_252501_tiendas,data20220712
782,80282,POLLERIA BACHOCO SUCURSAL CENTRO DE VENTAS ABASTOS,"HEROICO COLEGIO MILITAR S/N, INTERIOR CENTRAL DE ABASTO",MERCADO DE ABASTOS,(667)7184030,,Sinaloa,Culiacán,80299.0,Profeco_252501_tiendas,data20220712
783,83359,SUPER DEL NORTE SUCURSAL CENTRO,"AQUILES SERDAN 93, ENTRE GARDEMIA Y MARIANO ABASOLO",CENTRO,2136415,,Sonora,Hermosillo,83000.0,Profeco_262601_tiendas,data20220712
784,83327,WALMART SUCURSAL BOULEVARD MORELOS,"BLVD. JOSE MARIA MORELOS 355, ESQ. CONGRESO",ZONA MILITAR,(662)2678318,,Sonora,Hermosillo,83145.0,Profeco_262601_tiendas,data20220712
785,86230,TORTILLERÍA SAN JUDAS TADEO,"PASEO DE LA SIERRA 437-C, ENTRE NOVEROLA Y CENTENARIO I",REFORMA,,,Tabasco,Centro,86090.0,Profeco_272701_tiendas,data20220712
786,86025,TONY TABASCO SUCURSAL CONSTITUCION,"CONSTITUCION 1028, ENTRE BASTAR ZOZAYA Y PEDRO FUENTES",CENTRO,312 9989,,Tabasco,Centro,86000.0,Profeco_272701_tiendas,data20220712
787,86215,BODEGA AURRERA SUCURSAL CD. INDUSTRIAL,"PROLONGACIÓN AV. UNIVERSIDAD 634, CASI ESQ. PERIFERICO",CASA BLANCA,(993)1404070,,Tabasco,Centro,86060.0,Profeco_272701_tiendas,data20220712
788,86084,SORIANA HÍPER SUCURSAL VILLAHERMOSA GUAYABAL,"CARLOS PELLICER CAMARA S/N, ESQ. PASEO USUMACINTA Y PE",GUAYABAL,9933122407,,Tabasco,Centro,86090.0,Profeco_272701_tiendas,data20220712
789,86226,TORTILLERÍA MACDONALD,LOCAL 101 INT. MERCADO DE LA SIERRA GREGORIO MENDEZ MAG,REFORMA,,,Tabasco,Centro,86090.0,Profeco_272701_tiendas,data20220712
790,86139,TORTILLERIA SANTA MARTHA,"CALLE 2 DE ABRIL 257, ENTRE IGNACIO ZARAGOZA Y MARIANO",CENTRO,(993)1310422,,Tabasco,Centro,86000.0,Profeco_272701_tiendas,data20220712
791,86211,FARMACIAS DE DESCUENTO UNION SUCURSAL VILLAHERMOSA. ADO,"FRANCISCO J. MINA 203 L-2, ENTRE LINO MERINO Y PEDRO FU",CENTRO,(993)3142001,,Tabasco,Centro,86000.0,Profeco_272701_tiendas,data20220712
792,86091,FARMACIA UNION DE DESCUENTO,"PINO SUAREZ 216, ENTRE CONSTITUCION Y MADERO",CENTRO,358 0130,358 0138,Tabasco,Centro,86000.0,Profeco_272701_tiendas,data20220712
793,86222,TORTILLERIA LA FLOR TABASCO,"FRANCISCO TRUJILLO GURRIA 907, JOSE ACOSTA Y ENCARNACIÓ",JOSE MARIA PINO SUAREZ,9934530030,,Tabasco,Centro,86029.0,Profeco_272701_tiendas,data20220712
794,86110,LA LUPITA,"MORELOS 303, ENTRE 27 DE FEBRERO Y BUENA VISTA",ATASTA,,,Tabasco,Centro,86100.0,Profeco_272701_tiendas,data20220712
795,86147,TORTILLERIA GRANO DE ORO,"JOSE MA. PINO SUAREZ 514, ENTRE LINO MERINO Y PEDRO F",CENTRO,(993)2467661,,Tabasco,Centro,86000.0,Profeco_272701_tiendas,data20220712
796,86219,TORTILLERÍA CASA BLANCA,"RIÓ GRIJALVA 125, CASI ESQ. ADOLFO RUIZ CORTINES",CASA BALNCA,,,Tabasco,Centro,86060.0,Profeco_272701_tiendas,data20220712
797,86233,SUPER SANCHEZ SUCURSAL CENTRAL DE ABASTO,"PERIF. CARLOS PELLICER CAMARA S/N, BODEGA 19 Y 20, INT.",CARRIZAL,,,Tabasco,Centro,86108.0,Profeco_272701_tiendas,data20220712
798,86136,PAPELERIA DEL AHORRO,"CONSTITUCION 1235, PEDRO FUENTES Y HERMANOS BASTAR ZOZA",CENTRO,(993)3142639,,Tabasco,Centro,86000.0,Profeco_272701_tiendas,data20220712
799,86205,TORTILLERIA 2 DE ABRIL,"CALLE 2 DE ABRIL 323, ENTRE MENDEZ Y ZARAGOZA",NUEVA VILLAHERMOSA,(993)1500538,,Tabasco,Centro,86070.0,Profeco_272701_tiendas,data20220712
800,86223,TORTILLERÍA AZTLAN,"AV. 27 DE FEBRERO 2020, ESQ. JOSE MA. MORELOS",ATASTA,,,Tabasco,Centro,86100.0,Profeco_272701_tiendas,data20220712
801,86094,FARMACIA DE SIMILARES SUCURSAL PINO SUAREZ,"JOSE MA. PINO SUAREZ 622, ENTRE BASTAR ZOZAYA Y PEDRO F",CENTRO,312 6643,,Tabasco,Centro,86000.0,Profeco_272701_tiendas,data20220712
802,86212,FARMACIA GUADALAJARA SUCURSAL AV. GREGORIO MENDEZ,"CORONEL GREORIO MENDEZ MAGAÑA 1521-B, ALFONSO TARACENA",NUEVA VILLAHERMOSA,(993)3523231,,Tabasco,Centro,86070.0,Profeco_272701_tiendas,data20220712
803,86238,SEMILLAS GRUPO LUISFER SUCURSAL CENTRAL DE ABASTO,"PERIF. CARLOS PELLICER CAMARA S/N, NAVE 1, BODEGA 12, I",CARRIZAL,9933835391,,Tabasco,Centro,86108.0,Profeco_272701_tiendas,data20220712
804,86114,SORIANA SUPER SUCURSAL 441,"FRANCISCO I. MADERO S/N, ESQ. IGNACIO ZARAGOZA",CENTRO,(993)1121006,,Tabasco,Centro,86000.0,Profeco_272701_tiendas,data20220712
805,86154,MEGA SORIANA SUCURSAL 934,"EJERCITO MEXICANO 102, ENTRE QUINTIN ARAUZ Y VELODROMO",ATASTA DE SERRA,(993)3525986,,Tabasco,Centro,86100.0,Profeco_272701_tiendas,data20220712
806,86150,FARMACIA CABALLERO SUCURSAL UNICA,"JOSE MARIA PINO SUAREZ 22, ENTRE PEDRO FUENTES Y BASTA",CENTRO,N/T,,Tabasco,Centro,86000.0,Profeco_272701_tiendas,data20220712
807,86124,TORTILLERIA CASA BLANCA,"AMADO NERVO 2DA. CERRADA, ENTRE PINO SUAREZ Y CONSTITUC",CENTRO,3 12 82 32,,Tabasco,Centro,86000.0,Profeco_272701_tiendas,data20220712
808,86232,CENTRAL DE ABASTO SUCURSAL VILLAHERMOSA,"PERIF. CARLOS PELLICER CAMARA S/N, INT. CENTRAL DE ABAS",CARRIZAL,,,Tabasco,Centro,86108.0,Profeco_272701_tiendas,data20220712
809,86200,TORTILLERIA LA ESPERANZA,"FRANCISCO JAVIER TRUJILLO GURRIA S/N, ENTRE MATIN PEREZ",JOSE MARIA PINO SUAREZ,(993)1181817,,Tabasco,Centro,86029.0,Profeco_272701_tiendas,data20220712
810,86097,FAMSA SUCURSAL RUIZ CORTINEZ,"ADOLFO RUIZ CORTINEZ 801-B, ENTRE FCO. JAVIER MINA Y GI",ARBOLEDAS,358 0240,EXT. 1003,Tabasco,Centro,86097.0,Profeco_272701_tiendas,data20220712
811,86096,BODEGA AURRERA SUCURSAL VILLAHERMOSA GUAYABAL,"PROL. PASEO USUMACINTA 409, ENTRE CARLOS PELLICER Y PE",GUAYABAL,131 1089,131 1152,Tabasco,Centro,86090.0,Profeco_272701_tiendas,data20220712
812,86220,TORTILLERÍA MI TORTILLA,"2 DE ABRIL 291, ENTRE FCO. J. MINA Y D. BORREGO",CENTRO,,,Tabasco,Centro,86000.0,Profeco_272701_tiendas,data20220712
813,86087,WAL MART SUCURSAL UNIVERSIDAD,"ADOLFO RUIZ CORTINEZ NO.496, ENTRE UNIVERSIDAD Y FCO. J",CASA BLANCA,312 3302,,Tabasco,Centro,86060.0,Profeco_272701_tiendas,data20220712
814,86138,TORTILLERIA LEZ SUCURSAL MINA,"FRANCISCO JAVIER MINA S/N CASI ESQ. NARCISO MENDOZA,",CENTRO,(993)3148888,,Tabasco,Centro,86000.0,Profeco_272701_tiendas,data20220712
815,86067,EL ESCRITORIO SUCURSAL CONSTITUCION,"CONSTITUCION 1009, ENTRE PEDRO FUENTES Y LINO MERINO",CENTRO,312 8928,,Tabasco,Centro,86000.0,Profeco_272701_tiendas,data20220712
816,86131,TORTILLERIA TERESITA SUCURSAL PARQUE,"MAXIMINO PEREZ FRIAS 106, CASTELLANOS Y RAMON MENDOZA",JOSE MA. PINO SUAREZ,,,Tabasco,Centro,86029.0,Profeco_272701_tiendas,data20220712
817,86208,TORTILLERÍA SANTA CRUZ SUCURSAL PEDRO FUENTES,"PEDRO FUENTES 503, ENTRE JUAN ALVAREZ Y DOÑA FIDENCIA",CENTRO,,,Tabasco,Centro,86000.0,Profeco_272701_tiendas,data20220712
818,86153,OFIX SUCURSAL VILLAHERMOSA,"MENDEZ 1400, ESQ. PAGES LLERGO",NUEVA VILLAHERMOSA,(993)3122660,,Tabasco,Centro,86070.0,Profeco_272701_tiendas,data20220712
819,86093,COPPEL SUCURSAL CONSTITUCION,"CONSTITUCION 1247, ENTRE BASTAR Y ZOZAYA Y PEDRO FUENTE",CENTRO,314 3277,,Tabasco,Centro,86000.0,Profeco_272701_tiendas,data20220712
820,86239,SEMILLAS CRISMAG SUCRSAL CENTRAL DE ABASTO,"PERIF. CARLOS PELLICER CAMARA S/N, NAVE 2, BODEGA 23,",CARRIZAL,,,Tabasco,Centro,86108.0,Profeco_272701_tiendas,data20220712
821,86235,CARNICERÍA SANTANDER SUCURSAL CENTRAL DE ABASTO,"PERIF. CARLOS PELLICER CAMARA S/N, NAVE 11, LOCAL 4, IN",CARRIZAL,,,Tabasco,Centro,86108.0,Profeco_272701_tiendas,data20220712
822,86217,TORTILLERÍA DON RAMON,"AV. RUIZ CORTINEZ S/N, ENTRE PROLONGACIÓN MINA Y RÍO OX",CASA BLANCA,(993)3941620,,Tabasco,Centro,86060.0,Profeco_272701_tiendas,data20220712
823,86105,LA LUPITA,"MARIANO ARISTA 420, ENTRE MANUEL DOBLADO E IGNACIO ALLE",CENTRO,,,Tabasco,Centro,86077.0,Profeco_272701_tiendas,data20220712
824,86151,TORTILLERIA LA GLORIA,"LINO MERINO 929, ESQ. EUSEBIO CASTILLO",CENTRO,(993)1615389,,Tabasco,Centro,86000.0,Profeco_272701_tiendas,data20220712
825,86044,ABARROTERA SANCHEZ MERCADO SUCURSAL PRIMAVERA,"PRIMAVERA 131, ENTRE ZOZAYA Y PEDRO FUENTES",CENTRO,312 6922,,Tabasco,Centro,86000.0,Profeco_272701_tiendas,data20220712
826,86231,TORTILLERÍA MÍ TORTILLA SUCURSAL CONSTITUCIÓN 1,"AV. CONSTITUCIÓN 11645, ENTRE BASTAR ZOZAYA Y RUIZ CORT",CENTRO,,,Tabasco,Centro,86000.0,Profeco_272701_tiendas,data20220712
827,86225,TORTILLERÍA SAN JOSE,"LOC. 285 MERCADO DE LA SIERRA GREGORIO MENDEZ MAGAÑA, P",REFORMA,,,Tabasco,Centro,86090.0,Profeco_272701_tiendas,data20220712
828,86127,TORTILLERIA LA ESPIGA,"JOSE MA. PINO SUAREZ 695, BASTAR ZOZAYA Y PEDRO FUENTES",CENTRO,3149718,,Tabasco,Centro,86000.0,Profeco_272701_tiendas,data20220712
829,86000,CHEDRAUI SUCURSAL MINA,"FCO. JAVIER MINA S/N ENTRE LAMBERTO CASTELLANOS, Y RUIZ",CENTRO,312 9448,312 9454,Tabasco,Centro,86000.0,Profeco_272701_tiendas,data20220712
830,86214,LIVERPOOL SUCURSAL CRYSTAL,"HEROICO COLEGIO MILIAR S/N, INTERIOR PLAZA CRYSTAL",ATASTA,(993)3106000,,Tabasco,Centro,86100.0,Profeco_272701_tiendas,data20220712
831,86123,TORTILLERIA 3 HERMANOS,"MALECON LEANDRO ROVIROSA WADE S/N, ENTRE BASTAR ZOZAYA",CENTRO,,,Tabasco,Centro,86000.0,Profeco_272701_tiendas,data20220712
832,86092,COMPUCOPIAS SUCURSAL CENTRO,"IGNACIO ZARAGOZA 507, ENTRE ALDAMA Y JUAREZ",CENTRO,314 6638,,Tabasco,Centro,86000.0,Profeco_272701_tiendas,data20220712
833,86134,FARMACIAS YZA SUCURSAL PARQUE JUAREZ,"FCO. I. MADERO 602, SANCHEZ MARMOL Y MADERO",CENTRO,(993)3122099,,Tabasco,Centro,86000.0,Profeco_272701_tiendas,data20220712
834,86140,TORTILLERIA MINA,"FRANCISCO JAVIER MINA 305, ENTRE GREGORIO MENDEZ Y SANC",CENTRO,N/T,,Tabasco,Centro,86000.0,Profeco_272701_tiendas,data20220712
835,87231,COPPEL SUCURSAL DÍAZ MIRÓN,"DÍAZ MIRÓN 314, ENTRE ADUANA Y JUÁREZ",CENTRO,8332129860.0,,Tamaulipas,Tampico,89000.0,Profeco_282804_tiendas,data20220712
836,87261,TORTILLERÍA DE LA TORRE SUCURSAL CENTRO,"13 DE ENERO 108, ESQ AV. MONTERRY",BENITO JUAREZ,,,Tamaulipas,Ciudad Madero,89580.0,Profeco_282804_tiendas,data20220712
837,87235,FARMACIAS ESPECIALIZADAS SUCURSAL TAMPICO,"AV. HIDALGO 1008, ENTRE CAMELIA Y CLAVEL",JARDÍN,8332140400.0,,Tamaulipas,Tampico,89260.0,Profeco_282804_tiendas,data20220712
838,87265,ARTELI SUCURSAL PALMAS,"MIGUEL HIDALGO 4202, ESQ. PROL. AGUA DULCE",PETROLERA,8332136600.0,,Tamaulipas,Tampico,89110.0,Profeco_282804_tiendas,data20220712
839,87224,WALMART SUCURSAL TAMPICO,"AV. HIDALGO 5100, ENTRE LOMA NORTEÑA Y JACARANDAS",FRANBOYANES,,,Tamaulipas,Tampico,89330.0,Profeco_282804_tiendas,data20220712
840,87256,TORTILLERÍA SAN JUAN,"MANTE 117, ENTRE VICTORIA Y GÓMEZ FARIAS",COLINAS SAN GERARDO,,,Tamaulipas,Tampico,89367.0,Profeco_282804_tiendas,data20220712
841,87240,PAPELERIA TONY SUCURSAL TAMPICO ADUANA,"ADUANA 104, ENTRE EMILIO CARRANZA Y ALTAMIRA",CENTRO,8332129772.0,,Tamaulipas,Tampico,89000.0,Profeco_282804_tiendas,data20220712
842,87249,TORTILLERÍA DE LA TORRE,"INDEPENDENCIA 1103, ESQ. EMILIANO ZAPATA",OBRERA,8332168468.0,,Tamaulipas,Ciudad Madero,89490.0,Profeco_282804_tiendas,data20220712
843,87237,FARMACIA DEL AHORRO SUCURSAL PLAZA CENTRO,"DÍAZ MIRÓN 115, ESQ. FRAY ANDRÉS DE OLMOS",CENTRO,8332171313.0,,Tamaulipas,Tampico,89000.0,Profeco_282804_tiendas,data20220712
844,87228,MERCADOS MUNICIPALES BENITO JUÉREZ Y MIGUEL HIDALGO,"BENITO JUARÉZ, ESQ. J. MÉNDEZ",CENTRO,,,Tamaulipas,Tampico,89000.0,Profeco_282804_tiendas,data20220712
845,87248,TORTILLERÍA CASA BLANCA,"HIDALGO 201, ESQ .BELIZARIO DOMINGUEZ",ARBOL GRANDE,,,Tamaulipas,Ciudad Madero,89490.0,Profeco_282804_tiendas,data20220712
846,87223,HEB SUCURSAL EJERCITO,"EJÉRCITO MEXICANO 717, ENTRE ESTADIO Y AYUNTAMIENTO",TAMPICO,8332175699.0,,Tamaulipas,Tampico,89120.0,Profeco_282804_tiendas,data20220712
847,87234,FARMACIA GUADALAJARA SUCURSAL FRANCISCO I. MADERO,"FRANCISCO I. MADERO 405, ENTRE GRAL. CÉSAR LÓPEZ DE LAR",CENTRO,8332146186.0,,Tamaulipas,Tampico,89000.0,Profeco_282804_tiendas,data20220712
848,87226,SORIANA HÍPER SUCURSAL EJERCITO,"EJÉRCITO NACIONAL 1101, ESQ. DIAGONAL NORTE-SUR",ARCIM,,,Tamaulipas,Tampico,89136.0,Profeco_282804_tiendas,data20220712
849,87255,TORTILLERÍA DEL GOLFO,"JESUS ELIAS PIÑA 1402, ESQ. BENITO JUAREZ",GUADALUPE VICTORIA,,,Tamaulipas,Tampico,89080.0,Profeco_282804_tiendas,data20220712
850,87222,CHEDRAUI SUCURSAL TAMPICO KRYSTAL,"AV. HIDALGO S/N, ESQ AV. REGIOMONTANA",LOMAS DEL NARANJAL,8332170142.0,,Tamaulipas,Tampico,89349.0,Profeco_282804_tiendas,data20220712
851,87229,LIVERPOOL SUCURSAL TAMPICO,"PROL. AV. HIDALGO 200, ESQ. LAGUNA CHAPAYÁN",COUNTRY CLUB,8332293600.0,,Tamaulipas,Tampico,89250.0,Profeco_282804_tiendas,data20220712
852,87236,FARMACIA SIMILARES,ADUANA 102,CENTRO,,,Tamaulipas,Tampico,89000.0,Profeco_282804_tiendas,data20220712
853,87230,SEARS SUCURSAL CENTRO TAMPICO,"DÍAZ MIRÓN 210, ESQ. JUARÉZ",CENTRO,8333570000.0,,Tamaulipas,Tampico,89000.0,Profeco_282804_tiendas,data20220712
854,87257,TORTILLERÍA LA CENTRAL,"16 DE SEPTIEMBRE 402, ESQ.FILOMENO MATA",FRENTE DEMOCRATICO,,,Tamaulipas,Tampico,89470.0,Profeco_282804_tiendas,data20220712
855,87243,PAPELERÍA MARÓN SUCURSAL JUARÉZ,BENITO JUÁREZ 122,CENTRO,8332121904.0,,Tamaulipas,Tampico,,Profeco_282804_tiendas,data20220712
856,87260,SANBORN´S SUCURSAL TAMPICO,"AV.HIDALGO 5107 LOCAL 1, ENTRE CALLE JACARANDA Y MARQUE",FRANBOYANES,8332245559.0,,Tamaulipas,Tampico,89330.0,Profeco_282804_tiendas,data20220712
857,87254,TORTILLERÍA LA CARRETA,"JOSE DE ESCANDON 202, ESQ .FRAY ANDRES DE OLMOS",ZONA CENTRO,,,Tamaulipas,Tampico,89000.0,Profeco_282804_tiendas,data20220712
858,87232,ELEKTRA SUCURSAL MEGA TAMPICO,"CARRANZA 412, ENTRE ADUANA Y GRAL. CÉSAR LÓPEZ DE LARA",CENTRO,,,Tamaulipas,Tampico,89000.0,Profeco_282804_tiendas,data20220712
859,90399,COPPEL SUCURSAL 438,"ZITLAPOPOCATL 10, ENTRE JUAREZ Y LIRA Y ORTEGA",CENTRO,466 7656,466 7663,Tlaxcala,Tlaxcala,90100.0,Profeco_292901_tiendas,data20220712
860,90400,FARMACIAS DEL AHORRO SUCURSAL LIRA,"LIRA Y ORTEGA 39, ESQ. ALONSO ESCALONA",CENTRO,462 1979,,Tlaxcala,Tlaxcala,90000.0,Profeco_292901_tiendas,data20220712
861,90427,LIVERPOOL SUCURSAL GALERIAS TLAXCALA,"LIBRAMIENTO DE TLAXCALA KM. 8 + 238, INT. GALERIAS TLAX",SAN SEBASTIAN ATLAHAPA,(246)6893200,,Tlaxcala,Tlaxcala,90111.0,Profeco_292901_tiendas,data20220712
862,90006,ABARROTES SUPER CABRERA CLASS,"LIRA Y ORTEGA 37, ENTRE ALONSO DE ESCALONA Y ZITLALPOPO",CENTRO,466 0338,,Tlaxcala,Tlaxcala,90000.0,Profeco_292901_tiendas,data20220712
863,90230,SNOOPY,"LIRA Y ORTEGA 43, ENTRE ALONSO ESCALONA Y MIGUEL N. LIR",CENTRO,462 3727,,Tlaxcala,Tlaxcala,90000.0,Profeco_292901_tiendas,data20220712
864,90434,TORTILLERIA TERESITA,"BLVD.16 DE SEPTIEMBRE 605, ENTRE AV. JUAREZ Y AV. JOSE",CENTRO,,,Tlaxcala,,90300.0,Profeco_292901_tiendas,data20220712
865,90218,FARMACIA DE SIMILARES SUCURSAL MADERO-APIZACO,"FRANCISCO. I MADERO 502, ENTRE CUAUHTEMOC E HIDALGO",CENTRO,417 9120,,Tlaxcala,,90300.0,Profeco_292901_tiendas,data20220712
866,90430,GRAN BODEGA SUCURSAL SAN GABRIEL,"CARR. OCOTLAN-TLAXCALA NO. 10, ESQ. HIDALGO",SAN GABRIEL CUAUHTLA,,,Tlaxcala,Tlaxcala,90000.0,Profeco_292901_tiendas,data20220712
867,90225,ZAPATERIA LA LUNA SUCURASAL ZUMPANGO,LARDIZABAL 49 ENTRE LIRA Y ORTEGAY 20 DE NOV.,CENTRO,466 4032,,Tlaxcala,Tlaxcala,90000.0,Profeco_292901_tiendas,data20220712
868,90185,SORIANA SUCURSAL NO. 74,BLVD. OCOTLAN NO. 20 CARR. STA. ANA OCOTLAN ESQ. VOLCAN,OCOTLAN,466 1082,,Tlaxcala,Tlaxcala,90100.0,Profeco_292901_tiendas,data20220712
869,90251,FARMACIA GUADALAJARA SUCURSAL 388,"CUAUHTEMOC 207, ENTRE 16 DE SEPTIEMBRE Y 5 DE FEBRERO",CENTRO,413 0023,,Tlaxcala,,90300.0,Profeco_292901_tiendas,data20220712
870,90435,ELEKTRA SUCURSAL OCOTLAN,"CARR. OCOTLAN-SANTA ANA NO. 10, ESQ. ADOLFO LOPEZ MATEO",OCOTLAN,,,Tlaxcala,Tlaxcala,90114.0,Profeco_292901_tiendas,data20220712
871,90318,TORTILLERIA LETY,"JUAREZ 514, ENTRE AQUILES SERDAN Y FRANCISCO I. MADERO",CENTRO,,,Tlaxcala,,90300.0,Profeco_292901_tiendas,data20220712
872,90293,OFFICE DEPOT,"ADOLFO LOPEZ MATEOS 1, ESQ. OCOTLAN",OCOTLAN,(246)1175110,,Tlaxcala,Tlaxcala,90110.0,Profeco_292901_tiendas,data20220712
873,90171,UNIFORMES ALMACENES EL AGUILA,"16 DE SEPTIEMBRE 204, ENTRE CUAUHTEMOC E HIDALGO",CENTRO,417 0386,,Tlaxcala,,90300.0,Profeco_292901_tiendas,data20220712
874,90014,MERCADO EMILIO SANCHEZ PIEDRAS,EMILIO SANCHEZ PIEDRAS S/N ESQ. ALONSO DE ESCALONA,CENTRO,N/T,,Tlaxcala,Tlaxcala,90000.0,Profeco_292901_tiendas,data20220712
