,# codigo,nombre,direccion,colonia,telefono,telefono2,estado,minicipio,codigopostal,profeco_tiendas_id,folder_id
294,37093,FARMACIAS SIMILARES SUCURSAL LEON 1,"BLVD. LOPEZ MATEOS 210, ENTRE DONATO GUERRA Y HERMANOS",ZONA CENTRO,7163000,,Guanajuato,León,37000.0,Profeco_111101_tiendas,data20220905
295,37001,MEGA SORIANA SUCURSAL LEON INSURGENTES,"BLVD. PASEO DE INSURGENTES, ENTRE. ALUD Y NIEBLA",JARDINES DEL MORAL,(477)7175195,,Guanajuato,León,37160.0,Profeco_111101_tiendas,data20220905
296,37139,LEY SUCURSAL HIDALGO (1102),"BLVD. HIDALGO 1405, ENTRE BLVD. CAMPESPRE Y DEL AVIO",FRACC. DE LOS GOMEZ,(477)7739201,,Guanajuato,León,37470.0,Profeco_111101_tiendas,data20220905
297,37128,TORTILLERIA FONSECA,"SANTIAGO 401, ESQ. BARRANQUILLA",CORTIJO,(477)3120597,,Guanajuato,León,37250.0,Profeco_111101_tiendas,data20220905
298,37115,NETO SUCURSAL OBREGON,"27 DE SEPTIEMBRE 519, ENTRE CUAUHTEMOC E IGNACIO LOPEZ",OBREGON,(477)7138270,,Guanajuato,León,37320.0,Profeco_111101_tiendas,data20220905
299,37104,TORTILLERIA FLORES,"CERRO DE JEREZ 412, ENTRE CERRO DEL DIVISADERO Y CERRO",CERRITO DE JEREZ,(477)7613580,,Guanajuato,León,37530.0,Profeco_111101_tiendas,data20220905
300,37119,CENTRAL DE ABASTOS,"BLVD. HERMANOS ALDAMA 4102, ENTRE OLEODUCTO Y MAXIPISTA",CIUDAD INDUSTRIAL,(477)7635401,,Guanajuato,León,37490.0,Profeco_111101_tiendas,data20220905
301,37096,PESCADERIA BAHIA DE KINO,"BELISARIO DOMINGUEZ 532-A, ENTRE TORREON Y MIGUEL ALEMA",ZONA CENTRO,713 3381,,Guanajuato,León,37000.0,Profeco_111101_tiendas,data20220905
302,37081,TORTILLERIA ROSITA,"BRASILIA NO. 301, ESQ. SANTIAGO",EL CORTIJO,,,Guanajuato,León,37250.0,Profeco_111101_tiendas,data20220905
303,37134,TORTILLERIA LA ALTEÑA,"ACCESO SUR NO. 134-A, ENTRE INDEPENDENCIA Y EMILIANO ZA",SAN JUAN DE DIOS,,,Guanajuato,León,37004.0,Profeco_111101_tiendas,data20220905
304,37017,COPPEL SUCURSAL REFORMA 58,PINO SUAREZ NO.226 ESQUINA REFORMA,ZONA CENTRO,713 1053,716 0565,Guanajuato,León,37000.0,Profeco_111101_tiendas,data20220905
305,37092,RYSE SUCURSAL CENTRO,"PINO SUAREZ, ENTRE DIAZ MIRON Y 5 DE FEBRERO",ZONA CENTRO,713 2574,714 2129,Guanajuato,León,37000.0,Profeco_111101_tiendas,data20220905
306,37002,MEGA SORIANA SUCURSAL LEON,"BLVD. JOSE TORRES LANDA 4137, ENTRE BLVD. A. LOPEZ MATE",JARDINES DE JEREZ,(477)7711245,/477)7711260,Guanajuato,León,37229.0,Profeco_111101_tiendas,data20220905
307,37136,TORTILLERÍA BAÑUELOS,"BLVD. HILARIO MEDINA 4902, CASI ESQ. BLVD. JUAN ALONSO",SANTA ROSA DE LIMA,,,Guanajuato,León,,Profeco_111101_tiendas,data20220905
308,37045,MERCADO ALDAMA,"JOSEFA ORTIZ DE DOMINGUEZ S/N, ENTRE MIGUEL ALEMAN Y CO",ZONA CENTRO,7162531,713 1984,Guanajuato,León,37000.0,Profeco_111101_tiendas,data20220905
309,37116,TORTILLERIA MARIA JOSE,"GUADALUPE 401, ENTRE MARÍA DOLORES Y SANTA VIRGINIA",ORIENTAL,(477)7719040,,Guanajuato,León,37500.0,Profeco_111101_tiendas,data20220905
310,37094,FARMACIA POPULAR ROMAN SUCURSAL UNICA,"MIGUEL ALEMAN 806, ENTRE DURANGO Y CHIHUAHUA",ZONA CENTRO,716 8209,,Guanajuato,León,37000.0,Profeco_111101_tiendas,data20220905
311,37105,TORTILLERIA FLORES SUCURSAL 02,"CERRO DE TANCITARO 214, ENTRE CERRO DE PATANBAN Y CERRO",CERRITO DE JEREZ,(477)7610276,,Guanajuato,León,37530.0,Profeco_111101_tiendas,data20220905
312,37083,TORTILLERIA ARANDAS,"BLVD. HILARIO 441, ESQ. TITO",EL CORTIJO,4777139702,,Guanajuato,León,37250.0,Profeco_111101_tiendas,data20220905
313,37030,FARMACIA GUADALAJARA SUCURSAL MIGUEL ALEMAN 072,"MIGUEL ALEMAN 40, ENTRE ALVARO OBREGON Y LEONA VICARIO",ZONA CENTRO,716 9891,,Guanajuato,León,37000.0,Profeco_111101_tiendas,data20220905
314,37088,TORTILLERIA SAN BENITO,"DE LA BUGAMBILIA 701, ENTRE PIRACANTOS Y DE LA BUGAMBIL",JARDINES DE JEREZ I SECCION,(477)7121145,,Guanajuato,León,37530.0,Profeco_111101_tiendas,data20220905
315,37099,PESCADERIA SEVILLA CARRO VERDE,"BLVD. M. ESCOBEDO INT. MDO. CARRO VERDE LOC. 152,153, E",ZONA CENTRO,712 3676,,Guanajuato,León,37000.0,Profeco_111101_tiendas,data20220905
316,37109,TORTILLERIA SAGRADO CORAZON DE JESUS,"REFUGIO 202, ENTRE GUADALUPE Y BLVD. MARIANO ESCOBEDO",ORIENTAL,(477)7713701,,Guanajuato,León,37510.0,Profeco_111101_tiendas,data20220905
317,37067,TORTILLERIA LA PAZ,"LA PAZ 524, ENTRE TRES GUERRAS Y GUTIERREZ NAJERA",BARRIO DE SANTIAGO,,,Guanajuato,León,37000.0,Profeco_111101_tiendas,data20220905
318,37142,TORTILLERÍA EL SOL,"BLVD. HILARIO MEDINA 4710, ENTRE FRONTÓN Y TENIS",UNIDAD DEPORTIVA 1,(477)7763879,,Guanajuato,León,37237.0,Profeco_111101_tiendas,data20220905
319,37131,MI SUPER BARA SUCURSAL MARIANO ESCOBEDO,"BLVD. MARIANO ESCOBEDO OTE. 2940, ESQ. INDEPENDENCIA",TLACOACHE PTE.,(477)1017600,,Guanajuato,León,37500.0,Profeco_111101_tiendas,data20220905
320,37023,SANBORNS SUCURSAL PLAZA MAYOR,LAS TORRES 2003-3-6A CENTRO COMERCIAL PLAZA MAYOR,VALLE DEL CAMPESTRE,773 1316,773 1318,Guanajuato,León,37160.0,Profeco_111101_tiendas,data20220905
321,37110,H.E.B. SUCURSAL 2984,"BLVD. ADOLFO LOPEZ MATEOS 2102, ESQ. BLVD. CAMPESTRE",JARDINES DEL MORAL,(447)7119810,,Guanajuato,León,37160.0,Profeco_111101_tiendas,data20220905
322,37120,ABARROTERA EL PATRÓN,"BLVD. HERMANOS ALDAMA 4102, INT. MODULO I BODEGAS 4 Y",CIUDAD INDUSTRIAL,(477)7636832,,Guanajuato,León,37490.0,Profeco_111101_tiendas,data20220905
323,37097,MARISCOS PAPILLON SUCURSAL UNICA,"LEONA VICARIO 322, ESQ. IXTLACCIHUATL",OBRERA,279 1567,,Guanajuato,León,37000.0,Profeco_111101_tiendas,data20220905
324,37090,TORTILLERIA EL SEÑOR DE LA LUZ,"GAMA 118, ENTRE CORTEZA Y VAINA",MEZQUITAL DE JEREZ,(479)2147721,,Guanajuato,León,37530.0,Profeco_111101_tiendas,data20220905
325,37079,MAQUINA 501,BELISARIO DOMINGUEZ 501 ENTRE RIVERA Y MIGUEL ALEMAN,ZONA CENTRO,NO TIENE,,Guanajuato,León,37000.0,Profeco_111101_tiendas,data20220905
326,37078,EL REFUGIO,"LEONA VICARIO 207, ENTRE GARDENIA Y MIGUEL ALEMAN",OBRERA,713 4725,,Guanajuato,León,37340.0,Profeco_111101_tiendas,data20220905
327,37098,PESCADERIA CEPESMAR,"CALLE NUEVA 102, ENTRE CHUPARROSA Y ACCESO PONIENTE",ZONA CENTRO,715 1934,,Guanajuato,León,37000.0,Profeco_111101_tiendas,data20220905
328,37138,CHEDRAUI SUCURSAL LEÓN POLIFORUM,"BLVD. FRANCISCO VILLA 105, ESQ. BLVD. ADOLFO LÓPEZ MATE",EL TLACOACHE,(477)7110642,,Guanajuato,León,37500.0,Profeco_111101_tiendas,data20220905
329,37087,TORTILLERIA SAN JOSE,"LIRIOS 112, BUGAMBILIAS Y CRISANTEMOS",JARDINES DE JEREZ. I SECCION,(477)7118519,,Guanajuato,León,37530.0,Profeco_111101_tiendas,data20220905
330,37047,MERCADO CARRO VERDE,"CALLE NUEVA, ENTRE CIRCUITO Y ACCESO SUR",ZONA CENTRO,(477)7153398,,Guanajuato,León,37000.0,Profeco_111101_tiendas,data20220905
331,37008,BODEGA AURRERA SUCURSAL HILARIO MEDINA (3804),HILARIO MEDINA NO.902 ESQUINA VICENTE VALTIERRA,CANDELARIA,772 3383,772 3400,Guanajuato,León,37250.0,Profeco_111101_tiendas,data20220905
332,37121,CREMERIA CITY ABASTOS,"BLVD. HERMANOS ALDAMA 4102, INT. BODEGA L LOC. 5, 6 Y 7",CIUDAD INDUSTRIAL,(477)7635196,,Guanajuato,León,37490.0,Profeco_111101_tiendas,data20220905
333,37143,TORTILLERÍA JUANCHOREY ZAC.,"CIRCUITO EXTERIOR NO. 206, ENTRE ACCESO SUR Y CIRCUITO",SAN JUAN DE DIOS,,,Guanajuato,León,37000.0,Profeco_111101_tiendas,data20220905
334,37024,SEARS SUCURSAL PLAZA MAYOR,BLVD. ALONSO DE TORRES NO.2002 CENTRO COMERCIAL PLAZA M,CAMPESTRE,773 5214,773 0834,Guanajuato,León,37160.0,Profeco_111101_tiendas,data20220905
335,39003,MEGA SORIANA SUCURSAL LA DIANA,"FARALLON DEL OBISPO 216, ENTRE NAVEGANTE JUAN PEREZ Y R",FARALLON,(744)4847861,,Guerrero,Acapulco de Juárez,39690.0,Profeco_121201_tiendas,data20220905
336,39000,SORIANA HIPER SUCURSAL ACAPULCO COSTERA (274),"COSTERA MIGUEL ALEMAN 240, ENTRE JUAN S. CANO Y GABRIEL",FRACCIONAMIENTO HORNOS,(744)4696160,,Guerrero,Acapulco de Juárez,39350.0,Profeco_121201_tiendas,data20220905
337,39065,TORTILLERIA ELSITA,"LAS PLAYAS 4, COSTERA MIGUEL ALEMAN Y COSTA GRANDE",FRACCIONAMIENTO LAS PLAYAS,,,Guerrero,Acapulco de Juárez,39390.0,Profeco_121201_tiendas,data20220905
338,39072,TORTILLERIA GRANO DE ORO,"VELAZQUEZ DE LEON 190 LOC. 7, ENTRE BELISARIO DOMINGUE",CENTRO,(744)1043376,,Guerrero,Acapulco de Juárez,39300.0,Profeco_121201_tiendas,data20220905
339,39005,CHEDRAUI SUCURSAL ACAPULCO PIE DE LA CUESTA,"CALZ. PIE DE LA CUESTA 239, ENTRE DE LAS FLORES Y SECC.",BARRIO DEL PASITO,(744)4835423,(744)4682108,Guerrero,Acapulco de Juárez,39480.0,Profeco_121201_tiendas,data20220905
340,39077,TORTILLERÍA LA BALANZA,"CALLE DE MINA NO 34, ENTRE CUAHUTEMOSC Y MELCHOR OCAMPO",CENTRO,,,Guerrero,Acapulco de Juárez,39300.0,Profeco_121201_tiendas,data20220905
341,39046,TORTILLERIA PAKAL,"GABRIEL AVILÉS S/N LOC. 2B, ENTRE ANDRES DE URDANETA Y",FRACCIONAMIENTO HORNOS,,,Guerrero,Acapulco de Juárez,39355.0,Profeco_121201_tiendas,data20220905
342,39024,TORTILLERIA BLANQUITA,"VELAZQUEZ DE LEON 12, ENTRE PARIAN Y 2 DE ABRIL",CENTRO,(744)4802291,,Guerrero,Acapulco de Juárez,39300.0,Profeco_121201_tiendas,data20220905
343,39006,BODEGA AURRERA SUCURSAL ACAPULCO COSTERA,"COSTERA M.ALEMAN 1000, ESQ. GABRIEL AVILES",HORNOS,,,Guerrero,Acapulco de Juárez,39300.0,Profeco_121201_tiendas,data20220905
344,42102,TORTILLERIA LA NUEVA LUPITA,"NICOLAS ROMERO 7, EXT. MERCADO BARRETEROS",CENTRO,NO TIENE,,Hidalgo,Pachuca de Soto,42050.0,Profeco_131301_tiendas,data20220905
345,42010,MERCADO FRANCISCO I. MADERO,"MARIANO ARISTA S/N, ENTRE GÓMEZ FARIAS Y GUADALUPE",LA SURTIDORA,,,Hidalgo,Pachuca de Soto,42050.0,Profeco_131301_tiendas,data20220905
346,42041,MEGA SORIANA SUCURSAL PACHUCA,"BLVD. LUIS D. COLOSIO S/N, ENTRE BLVD. VALLE DE SAN JAV",EXHACIENDA COSCOTITLAN,,,Hidalgo,Pachuca de Soto,42083.0,Profeco_131301_tiendas,data20220905
347,42110,TORTILLERIA LA HERRADURA SUCURSAL 1,"MARIANO ARISTA 230-B, FRENTE AL MERCADO LA SURTIDORA",BARRIO LA SURTIDORA,,,Hidalgo,Pachuca de Soto,42050.0,Profeco_131301_tiendas,data20220905
348,42050,CASA RIME SUCURSALPACHUCA,RIVA PALACIO LOC. 13 MDO. 1° DE MAYO ENTRE MORELOS Y MI,CENTRO,7153721,,Hidalgo,Pachuca de Soto,42000.0,Profeco_131301_tiendas,data20220905
349,42104,UNIFORMES MARINES SUCURSAL 01,"NARCIZO MENDOZA 114, ENTRE HEROES DE NACOZARI Y MEJIA",MORELOS,(771)1074229,,Hidalgo,Pachuca de Soto,42040.0,Profeco_131301_tiendas,data20220905
350,42101,TORTILLERIA LA POBLANA SUCURSAL 1,"GUADALUPE 108, INT. MERCADO FRANCISCO I MADERO",BARRIO LA SURTIDORA,NO TIENE,,Hidalgo,Pachuca de Soto,42050.0,Profeco_131301_tiendas,data20220905
351,44375,WALMART EXPRESS SUCURSAL RUBEN DARIO,"TURIN 2828, ESQ. RUBEN DARIO",LOMAS DE GUEVARA,3338135977,,Jalisco,Guadalajara,44657.0,Profeco_141401_tiendas,data20220905
352,44340,CREMERIA SANTA FE,"BETABEL S/N (CALLE 3 LOCAL 304 Y 306 BLOQUE B), ESQ. AV",MERCADO DE ABASTOS,(33)36712088,,Jalisco,Guadalajara,44530.0,Profeco_141401_tiendas,data20220905
353,44313,EKAR DE GAS SUCURSAL ABASTOS,"LAZARO CARDENAS 2380 LOCAL 12, PLAZA PREMIER",DEL FRESNO,(33)38100239,,Jalisco,Guadalajara,44530.0,Profeco_141401_tiendas,data20220905
354,44237,MERKABASTOS SUCURSAL MARIANO OTERO,"PERIFERICO 13100, ENTRE MARIANO OTERO Y VOLCAN DE QUINC",RINCONADA DEL SOL,3632 5394,,Jalisco,Zapopan,45079.0,Profeco_141401_tiendas,data20220905
355,44364,TORTILLERIA LA GUADALUPANA,"VENUSTIANO CARRANZA 245-A, HORNOS Y PINTORES",SAN PEDRO,38164950,,Jalisco,Tlaquepaque,45500.0,Profeco_141401_tiendas,data20220905
356,44346,POLLERIA PIOLIN,"BETABEL S/N (CALLE 2 LOCAL 125), ENTRE AV. PASEO DE LA",MERCADO DE ABASTOS,(33)10863605,,Jalisco,Guadalajara,44530.0,Profeco_141401_tiendas,data20220905
357,44335,TORTILLERIA LA SANTA CRUZ,"PLAYA DE HORNOS 1176-A, ENTRE AV. DEL COLLI Y PLAYA LA",LA PRIMAVERA INFONAVIT,(33)37219257,,Jalisco,Zapopan,45057.0,Profeco_141401_tiendas,data20220905
358,44266,FARMACIA BENAVIDES SUCURSAL ARBOLEDAS,"ARBOLEDAS LOCAL 11-13, PLAZA ARBOLEDAS",FRACCIONAMIENTO ARBOLEDAS,3811 8225,,Jalisco,Guadalajara,44570.0,Profeco_141401_tiendas,data20220905
359,44363,TORTILLERIA EL TEJABAN,"ZALATITAN 212, ESQ. VENUSTIANO CARRANZA",SAN PEDRO,,,Jalisco,Tlaquepaque,45500.0,Profeco_141401_tiendas,data20220905
360,44067,EL GRAN SALTO SUCURSAL JARDIN UNIVERSIDAD,"VALLARTA 5148 A, CASI ESQ. PATRIA",JARDINES UNIVERSIDAD,3629 9243,,Jalisco,Zapopan,44690.0,Profeco_141401_tiendas,data20220905
361,44368,TORTILLERIA Y MOLINO VIRGEN DE LA SOLEDAD,"FRESNO 2088 A, ENTRE LIMON Y DURAZNO",EL FRESNO,3312055351,,Jalisco,Guadalajara,44900.0,Profeco_141401_tiendas,data20220905
362,44378,TORTILLERIA Y MOLINO RUIZ,"MANUEL ACUÑA 352, ESQ. LICEO",CENTRO BARRANQUITAS,3311406109,,Jalisco,Guadalajara,44200.0,Profeco_141401_tiendas,data20220905
363,44321,PESCADERIA EL FARALLON,"DEL PIAL 424 LOC. 37, MERCADO DEL MAR ZAPOPAN",NUEVO EJIDAL,(33)36339271,,Jalisco,Zapopan,45140.0,Profeco_141401_tiendas,data20220905
364,44286,PESCADERIA HERMANOS LUNA,"ESTEBAN LOERA 324, LOC. 93, INT. MERCADO CONDO PLAZA SA",SAN FELIPE DE JESUS,(33)15913374,,Jalisco,Guadalajara,44380.0,Profeco_141401_tiendas,data20220905
365,44056,WALMART SUCURSAL VALLARTA,VALLARTA NO.5455 ESQUINA RAFAEL SANCIO,FRACCIONAMIENTO LA ESTANCIA,3673 2323,,Jalisco,Zapopan,44030.0,Profeco_141401_tiendas,data20220905
366,44024,FARMACIA GUADALAJARA SUCURSAL BANDERA,REVOLUCION NO.845 ESQUINA CALZADA DEL EJERCITO,ANALCO,3618 2718,,Jalisco,Guadalajara,44450.0,Profeco_141401_tiendas,data20220905
367,44219,CHEDRAUI SUCURSAL RIO NILO,"RIO NILO 7540, ENTRE PATRIA Y CAMELLON",VILLAS DEL ORIENTE,3668 6800,,Jalisco,Tonalá,45525.0,Profeco_141401_tiendas,data20220905
368,44101,PESCADERIA GOLFO DE MEXICO SUCURSAL ZAPOPAN,DEL PIAL 424 L-5 MERCADO DEL MAR ZAPOPAN,NUEVO EJIDAL,NO TIENE,,Jalisco,Zapopan,45140.0,Profeco_141401_tiendas,data20220905
369,44354,CARNICERIA EL BISTEC DE ORO,"CALLE 4 LOCALES 101,102 Y 103, 1A. SECCION",MERCADO DE ABASTOS,(33)36712860,,Jalisco,Guadalajara,44530.0,Profeco_141401_tiendas,data20220905
370,44317,PESCADERIA EL REY DEL MAR,"ESTEBAN LOERA 324, LOC. 124, INTERIOR MERCADO DEL MAR S",SAN FELIPE DE JESUS,(33)36188553,,Jalisco,Guadalajara,44380.0,Profeco_141401_tiendas,data20220905
371,44345,SUPER CHEO,"CHICALOTE 2528 B, ENTRE PASEO DE LA ARBOLEDA Y DEL MERC",MERCADO DE ABASTOS,(33)36712659,,Jalisco,Guadalajara,45067.0,Profeco_141401_tiendas,data20220905
372,44376,TORTILLERIA PELAYO,"AV COLLI 2075-B, ESQ. CORDILLERAS",COLLI EL URBANO,3335634190,,Jalisco,Zapopan,45070.0,Profeco_141401_tiendas,data20220905
373,44323,FARMACIAS BENAVIDES SUCURSAL X018,"VALLARTA 2488, ENTRE LOPE DE VEGA Y DUQUE DE RIVERA",ARCOS VALLARTA,(33)36151831,,Jalisco,Guadalajara,44600.0,Profeco_141401_tiendas,data20220905
374,44341,LA GALLINA FELIZ,"DEL MERCADO 1097, ESQ. AVENIDA LAZARO CARDENAS (MERCADO",MERCADO DE ABASTOS,(33)36713098,,Jalisco,Guadalajara,44530.0,Profeco_141401_tiendas,data20220905
375,44357,TORTILLERIA GABY,"PLAYA DE HORNOS 811, ENTRE AV. TEPEYAC Y CHAMELA",LA NUEVA PRIMAVERA,3331241541,,Jalisco,Zapopan,45050.0,Profeco_141401_tiendas,data20220905
376,44362,TORTILLERIA LALOS,"GARIBALDI 1344, RAMOS MILLA Y CLEMENTE OROZCO",SANTA TERESITA,38256232,,Jalisco,Guadalajara,44600.0,Profeco_141401_tiendas,data20220905
377,44379,TORTILLERIA Y MOLINO RUÍZ,"CALLE 4, ENTRE AV. MANDARINA Y AV. DEL MERCADO. 1RA SEC",MERCADO DE ABASTOS,3338126364,,Jalisco,Guadalajara,44530.0,Profeco_141401_tiendas,data20220905
378,44365,TORTILLERIA SANTA TERE,"GABRIEL RAMOS MILLAN 392, HERRERA Y CAIRO Y JUAQUIN ANG",SANTA TERESITA,,,Jalisco,Guadalajara,44600.0,Profeco_141401_tiendas,data20220905
379,44234,SORIANA SUPER SUCURSAL DEL BOSQUE,"NIÑOS HEROES 2546, ENTRE INGLATERRA Y LA CAUDA",JARDINES DEL BOSQUE,3121 7773,,Jalisco,Guadalajara,44520.0,Profeco_141401_tiendas,data20220905
380,44373,POLLERIA EL POLLITO,"CALLE 2 Y 4, INT. CENTRAL DE ABASTOS",MERCADO DE ABASTOS,3312621702,,Jalisco,Guadalajara,44530.0,Profeco_141401_tiendas,data20220905
381,44369,TORTILLERIA LUPIZ,"CONSTITUCION 678, ENTRE J. LUIS VERDIA Y FCO. SILVA ROM",ANALCO,36170628,,Jalisco,Guadalajara,44450.0,Profeco_141401_tiendas,data20220905
382,44107,PESCADERIA VIÐA DEL MAR,"DEL PIAL 424 LOC. 36, MDO. DEL MAR ZAPOPAN",NUEVO EJIDAL,(33)36333627,,Jalisco,Zapopan,45140.0,Profeco_141401_tiendas,data20220905
383,44339,CREMERIA ESPEJO,"BETABEL S/N (CALLE 2 Y 3 NO. 215 BLOQUE B), ENTRE PASEO",MERCADO DE ABASTOS,(33)36711558,,Jalisco,Guadalajara,44530.0,Profeco_141401_tiendas,data20220905
384,44285,PESCADERIA GUASAVEÑA,"DEL PIAL 424, LOC. 33, INT. MERCADO DEL MAR ZAPOPAN",NUEVO EJIDAL,(33)31658467,,Jalisco,Zapopan,45140.0,Profeco_141401_tiendas,data20220905
385,44342,ESPECIAS MOY,"DEL MERCADO 1185, ENTRE LAZARO CARDENAS Y CALLE ORIENTE",MERCADO DE ABASTOS,(33)36713017,EXT. 115,Jalisco,Guadalajara,44530.0,Profeco_141401_tiendas,data20220905
386,44270,TORTILLERIA MARY,"DURAZNO, ESQ. FRESNO",FRESNO,(33)33448631,,Jalisco,Guadalajara,44900.0,Profeco_141401_tiendas,data20220905
387,44312,NETO SUCURSAL FRESNO,"FRESNO 1953, ENTRE NOGAL Y NARANJO",FRESNO ORIENTE,(33)38101709,,Jalisco,Guadalajara,44907.0,Profeco_141401_tiendas,data20220905
388,44267,TORTILLERIA TORTILLERIA SIN NOMBRE,"ESPAÑA 1089, CALZADA DEL AGUILA Y REGULO",MODERNA,36-19-40-62,,Jalisco,Guadalajara,44190.0,Profeco_141401_tiendas,data20220905
389,44366,TORTILLERIA SANTA TERE,"ALFREDO CARRASCO 11, MANUEL ACUÑA Y JUAN ALVAREZ",SANTA TERESITA,3314788452,,Jalisco,Guadalajara,44600.0,Profeco_141401_tiendas,data20220905
390,44155,ELEKTRA SUCURSAL FRESNO,"FRESNO 2041, ENTRE DURAZNO Y NARANJO",DEL FRESNO SECTOR JUAREZ,(33)38121662,,Jalisco,Guadalajara,44900.0,Profeco_141401_tiendas,data20220905
391,44159,MERCADO ALCALDE,LICEO ENTRE HERRERA Y CAIRO Y PINO SUAREZ,CENTRO BARRANQUITAS,,,Jalisco,Guadalajara,44270.0,Profeco_141401_tiendas,data20220905
392,44243,FARMACIAS SIMILARES SUCURSAL VALLARTA,"VALLARTA 1843, ESQ. UNION",AMERICANA,36157055,,Jalisco,Guadalajara,44160.0,Profeco_141401_tiendas,data20220905
393,44230,SIN NOMBRE,"MEZQUITE 1536, ESQ. ROBLE",DEL FRESNO,,,Jalisco,Guadalajara,44900.0,Profeco_141401_tiendas,data20220905
394,44280,TORTILLERIA SANTA MONICA,"ANDRES TEHERAN 564, HOSPITAL Y JUAN ALVAREZ",SANTA TERE,11-99-45-20,,Jalisco,Guadalajara,44600.0,Profeco_141401_tiendas,data20220905
395,44344,ABARROTES ECO,"NUEZ 2140, ENTRE MANDARINA Y AV. DEL MERCADO (MERCADO D",JARDINES DE LA CRUZ,(33)36711499,,Jalisco,Guadalajara,44950.0,Profeco_141401_tiendas,data20220905
396,44021,SORIANA HIPER SUCURSAL RIO NILO,"RIO NILO 1000, ESQ. PATRIA",LOMAS DEL NILO,3818 0000,,Jalisco,Tonalá,44860.0,Profeco_141401_tiendas,data20220905
397,44064,SANBORNS SUCURSAL VALLARTA,"VALLARTA 1600, ESQ. GENERAL SAN MARTIN",ARCOS,3616 4230,,Jalisco,Guadalajara,44100.0,Profeco_141401_tiendas,data20220905
398,44348,MERCADO CONSTITUCION,"CONSTITUCION 675, ENTRE FRANCISCO SILVA ROMERO Y PRIVAD",CENTRO,,,Jalisco,Guadalajara,44550.0,Profeco_141401_tiendas,data20220905
399,44225,TORTILLERIA LA MAZORCA,"IGNACIO HERRERA Y CAIRO 198, ENTRE VENUSTIANO CARRANZA",CENTRO BARRANQUITAS,,,Jalisco,Guadalajara,44280.0,Profeco_141401_tiendas,data20220905
400,44203,COPPEL SUCURSAL ARBOLEDAS,"ARBOLEDAS 2500, PZA.FIESTA ARBOLEDAS ENTRE ISLA SOTAVEN",FRACCIONAMIENTO ARBOLEDAS,(33)38104989,,Jalisco,Guadalajara,45070.0,Profeco_141401_tiendas,data20220905
401,44372,TORTILLERIA SANTA BARBARA,"FRESNO 1937, NOGAL Y ROBLE",EL FRESNO,3332608728,,Jalisco,Guadalajara,44900.0,Profeco_141401_tiendas,data20220905
402,44106,PESCADERIA MARY SUCURSAL ZAPOPAN,DEL PIAL 424 L-7 MERCADO DEL MAR ZAPOPAN,NUEVO EJIDAL,NO TIENE,,Jalisco,Zapopan,44140.0,Profeco_141401_tiendas,data20220905
403,44284,FAMSA SUCURSAL RIO NILO,"RIO NILO 7540, ENTRE MALECON Y PATRIA",VILLAS DEL ORIENTE,(33)36800808,,Jalisco,Tonalá,45125.0,Profeco_141401_tiendas,data20220905
404,44180,BODEGA AURRERA SUCURSAL ARBOLEDAS,"PASEO ARBOLEDAS 2500, ENTRE ISLA SOTAVIENTO Y NUEZ",BOSQUE DE LA VICTORIA,(33)38111055,,Jalisco,Guadalajara,44570.0,Profeco_141401_tiendas,data20220905
405,44233,TORTILLERIA MARY,"FRANCISCO SILVA ROMERO 315, ENTRE REVOLUCION Y CONSTITU",OBRERA,,,Jalisco,Guadalajara,44360.0,Profeco_141401_tiendas,data20220905
406,44360,TORTILLERIA Y MOLINO SANTA MONICA,"PINO SUAREZ 396, JOAQUIN ANGULO Y HERRERA Y CAIRO",CENTRO,33423380,,Jalisco,Guadalajara,44100.0,Profeco_141401_tiendas,data20220905
407,44160,MERCADO ABASTOS,"BETABEL S/N, ENTRE PASEO DE LA ARBOLEDA Y DEL MERCADO (",MERCADO DE ABASTOS,,,Jalisco,Guadalajara,44530.0,Profeco_141401_tiendas,data20220905
408,44343,CARNICERIA LA CANADIENSE,"BETABEL S/N (CALLE 2 LOCAL 114 Y 116), ENTRE AV. PASEO",MERCADO DE ABASTOS,(33)36712003,,Jalisco,Guadalajara,44530.0,Profeco_141401_tiendas,data20220905
409,44206,7 ELEVEN SUCURSAL PABLO NERUDA,"RUBEN DARIO, ESQ. PABLO NERUDA",PROVIDENCIA SECTOR HIDALGO,(33)36415183,,Jalisco,Guadalajara,45110.0,Profeco_141401_tiendas,data20220905
410,44371,TORTILLERIA SAN CRISTOBAL,"JUSTO CORRO 2167, ENTRE LUIS G. CUEVAS Y FRANCISCO MARQ",LOMAS DEL PARADERO,3317085392,,Jalisco,Guadalajara,44840.0,Profeco_141401_tiendas,data20220905
411,44272,TORTILLERIA LUCY,"COFRE DE PEROTE 203, ESQ. VOLCAN DE COLIMA",EL COLLI,31-25-20-19,,Jalisco,Zapopan,45056.0,Profeco_141401_tiendas,data20220905
412,44228,REYNA DE LA PAZ,"JUAN MANUEL 548, ENTRE ZARAGOZA Y SANTA MONICA",CENTRO,,,Jalisco,Guadalajara,44100.0,Profeco_141401_tiendas,data20220905
413,44367,PESCADERIA LA ISLA,"ESTEBAN LOERA 324 LOCAL 107, MERCADO DEL MAR SAN FELIPE",ZONA OBLATOS,,,Jalisco,Guadalajara,,Profeco_141401_tiendas,data20220905
414,44231,SIN NOMBRE,"FRESNO 1171, ENTRE NOGAL Y NARANJO",DEL FRESNO,,,Jalisco,Guadalajara,44900.0,Profeco_141401_tiendas,data20220905
415,44314,MEGA SORIANA SUCURSAL GUADALAJARA,"RAFAEL SANCIO 55, ENTRE DEBUSSY Y JUAN SEBASTIAB BACH",RESIDENCIAL LA ESTANCIA,(33)36732193,,Jalisco,Zapopan,45030.0,Profeco_141401_tiendas,data20220905
416,44336,TORTILLERIA ARIES,"VOLCAN FUJIYAMA 39, ENTRE VOLCAN JORULLO Y VOLCAN COFRE",COLLI URBANO,(33)14669820,,Jalisco,Zapopan,45070.0,Profeco_141401_tiendas,data20220905
417,44183,WAL MART SUCURSAL REVOLUCION,"RAMON LOPEZ VELARDE 821, ESQ. CALZADA REVOLUCION",LOMAS DEL PARADERO,(33)36352725,,Jalisco,Guadalajara,44900.0,Profeco_141401_tiendas,data20220905
418,44218,CHEDRAUI SUCURSAL ACUEDUCTO,"ACUEDUCTO 6050, ESQ. PERIFERICO",LOMAS DEL BOSQUE,3678 6900,,Jalisco,Zapopan,45110.0,Profeco_141401_tiendas,data20220905
419,44358,FARMACIAS DEL AHORRO,"DE LAS AMERICAS 442, ESQ. JUAN ALVAREZ",LADRON DE GUEVARA,,,Jalisco,Guadalajara,44650.0,Profeco_141401_tiendas,data20220905
420,44207,PESCADERIA TAIWAN SUCURSALCONDO PLAZA SAN FELIPE,ESTEBAN LOERA 324 L-18 MERCADO CONDO PLAZA SAN FELIPE,SAN FELIPE DE JESUS,NO TIENE,,Jalisco,Guadalajara,44380.0,Profeco_141401_tiendas,data20220905
421,44140,FARMACIA GUADALAJARA LA CALMA,"ADOLFO LOPEZ MATEOS 3590, ESQ. LA CALMA",LA CALMA,(33)36320080,,Jalisco,Guadalajara,45070.0,Profeco_141401_tiendas,data20220905
422,44325,LIVERPOOL SUCURSAL TLAQUEPAQUE,"BLVD. GENERAL MARCELINO GARCIA BARRAGAN 2077 INT. 1A, P",PRADOS DEL NILO,(33)38377400,,Jalisco,Tlaquepaque,44840.0,Profeco_141401_tiendas,data20220905
423,51075,EXPENDIO DE HUEVO S/N LOC. 101,"JOSE LOPEZ PORTILLO KM. 4.5, INT. 128 LOCAL 101, PASILL",SAN MATEO OTZACATIPAN,,,Estado de México,,50200.0,Profeco_150901_tiendas,data20220905
424,10422,WALMART EXPRESS SUCURSAL LOMAS ANAHUAC,"AV. DE LOS BOSQUES NO. 234, ENTRE AV. UNIVERSIDAD ANA",LOMAS ANAHUAC,5555960246,,Estado de México,Huixquilucan,52786.0,Profeco_150901_tiendas,data20220905
425,11945,MER. SORIANA SUC R-1 LA GOBERNADORA 427,ADOLFO LOPEZ MATEOS S/N ESQ. LA GOBERNADORA,IND. TULPETLAC,57742646,,Estado de México,Ecatepec,51074.0,Profeco_150901_tiendas,data20220905
426,11879,PANADERIA LECAROZ COL. LOMAS LINDAS,"PLAZA ATIZAPÁN, CARR. ATIZAPÁN VILLA NICOLÁS ROMERO 28",ATIZAPAN CENTRO,,,Estado de México,,52948.0,Profeco_150901_tiendas,data20220905
427,10411,WALMART EXPRESS SUCURSAL ECHEGARAY,"AV. GUSTAVO BAZ NO. 244, CASI ESQ. HDA. DE LA ENCARNACI",ECHEGARAY,5553635491,,Estado de México,Naucalpan,53300.0,Profeco_150901_tiendas,data20220905
428,11016,CARNICERIA ABI (ECATEPEC),"AVENIDA CENTRAL NAVE B LOCAL 253, ESQ. BLVD. JOSE LOPEZ",SANTA CRUZ VENTA DE CARPIO,,,Estado de México,Ecatepec,55070.0,Profeco_150901_tiendas,data20220905
429,11641,CARNICERIA CRISTINA (ECATEPEC),"AVENIDA CENTRAL, ESQ. JOSE LOPEZ PORTILLO S/N BOD 254-2",SANTA CRUZ VENTA DE CARPIO,,,Estado de México,Ecatepec,5506.0,Profeco_150901_tiendas,data20220905
430,11897,PANADERIA LE CAROZ,"AVENIDA CENTRAL S/N, A UN COSTADO DE FARMACIA SAN PABLO",BOSQUES DE ARAGÓN,,,Estado de México,Nezahualcóyotl,57170.0,Profeco_150901_tiendas,data20220905
431,11005,COPPEL SUCURSAL GUSTAVO BAZ,"GUSTAVO BAZ 312, ENTRE MARIO COLIN Y SOR JUANA",INDUSTRIAL TLALNEPANTLA,28710435,,Estado de México,Tlalnepantla,54030.0,Profeco_150901_tiendas,data20220905
432,11237,DON MANUEL (ECATEPEC),"AVENIDA CENTRAL NAVE C BODEGA 326, ESQ. CON BLVD. JOSE",SANTA CRUZ VENTA DE CARPIO,,,Estado de México,Ecatepec,55060.0,Profeco_150901_tiendas,data20220905
433,11464,TORTILLERIA PREMIUM,BLVD. DE LOS AZTECAS ESQ. TOCHTEPEC,CIUDAD AZTECA 3RA SECC.,,,Estado de México,Ecatepec,55120.0,Profeco_150901_tiendas,data20220905
434,51098,TORTILLERIA SAN JUAN CHIQUITO,"MANUEL GOMEZ PEDRAZA 216 B, ESQ. SOR JUANA INES DE LA C",CENTRO,,,Estado de México,,50050.0,Profeco_150901_tiendas,data20220905
435,51087,TORTILLERIA SIN NOMBRE,"VICENTE VILLADA 91, MIGUEL HIDALGO Y MADERO",SAN LORENZO TEPALTITLAN,(722)2724277,,Estado de México,,50010.0,Profeco_150901_tiendas,data20220905
436,51081,POLLOS TOLUCA,"JOSE LOPEZ PORTILLO KM. 4.5, INT. 128 LOCAL 102, ENTRE",SAN MATEO OTZACATIPAN,,,Estado de México,,50200.0,Profeco_150901_tiendas,data20220905
437,10974,TORTILLERIA MORELOS,"MARIANO MATAMOROS 68, ESQ. CERRADA MATAMOROS",CENTRO,55-65-72-59,,Estado de México,Tlalnepantla,54000.0,Profeco_150901_tiendas,data20220905
438,11192,TORTILLERIA ANAHUAC,"IGNACIO COMONFORT 10, ENTRE CALZADA SAN MATEO Y 5 DE M",ATIZAPAN CENTRO,58161050,,Estado de México,,52900.0,Profeco_150901_tiendas,data20220905
439,11253,TORTILLERIA SIN NOMBRE,"MORELOS S/N, ESQ. ANDADOR DOS",SAN BARTOLO NAUCALPAN,,,Estado de México,Naucalpan,53000.0,Profeco_150901_tiendas,data20220905
